ffff8c93b0a953c0 167205193 S Bi:1:002:1 -115 4096 <
ffff8c93b0a953c0 167225722 C Bi:1:002:1 -2 0
ffff8c93b0a953c0 167225844 S Bi:1:002:1 -115 4096 <
ffff8c93b0a953c0 167246398 C Bi:1:002:1 -2 0
ffff8c93b0a953c0 167246528 S Bi:1:002:1 -115 4096 <
ffff8c93b0a953c0 167267054 C Bi:1:002:1 -2 0
ffff8c93b0a953c0 167267181 S Bi:1:002:1 -115 4096 <
ffff8c93b0a953c0 167287673 C Bi:1:002:1 -2 0
ffff8c93b0a953c0 167287795 S Bi:1:002:1 -115 4096 <
ffff8c93b0a953c0 167308435 C Bi:1:002:1 -2 0
ffff8c93b0a953c0 167308576 S Bi:1:002:1 -115 4096 <
ffff8c93b0a953c0 167329201 C Bi:1:002:1 -2 0
ffff8c93b0a953c0 167329324 S Bi:1:002:1 -115 4096 <
ffff8c93b0a953c0 167349852 C Bi:1:002:1 -2 0
ffff8c93b0a953c0 167349979 S Bi:1:002:1 -115 4096 <
ffff8c93b0a953c0 167370616 C Bi:1:002:1 -2 0
ffff8c93b0a953c0 167370741 S Bi:1:002:1 -115 4096 <
ffff8c93b0a953c0 167391217 C Bi:1:002:1 -2 0
ffff8c93b0a953c0 167391372 S Bi:1:002:1 -115 4096 <
ffff8c93b0a953c0 167411883 C Bi:1:002:1 -2 0
ffff8c93b0a953c0 167412017 S Bi:1:002:1 -115 4096 <
ffff8c93b0a953c0 167432509 C Bi:1:002:1 -2 0
ffff8c93b0a953c0 167432652 S Bi:1:002:1 -115 4096 <
ffff8c93b0a953c0 167453191 C Bi:1:002:1 -2 0
ffff8c93b0a953c0 167453344 S Bi:1:002:1 -115 4096 <
ffff8c93b0a953c0 167473982 C Bi:1:002:1 -2 0
ffff8c93b0a953c0 167474105 S Bi:1:002:1 -115 4096 <
ffff8c93b0a953c0 167494706 C Bi:1:002:1 -2 0
ffff8c93b0a953c0 167494851 S Bi:1:002:1 -115 4096 <
ffff8c93b0a953c0 167515285 C Bi:1:002:1 -2 0
ffff8c93b0a953c0 167515404 S Bi:1:002:1 -115 4096 <
ffff8c93b0a953c0 167536067 C Bi:1:002:1 -2 0
ffff8c93b0a953c0 167536197 S Bi:1:002:1 -115 4096 <
ffff8c93b0a953c0 167556779 C Bi:1:002:1 -2 0
ffff8c93b0a953c0 167556904 S Bi:1:002:1 -115 4096 <
ffff8c93b0a953c0 167577396 C Bi:1:002:1 -2 0
ffff8c93b0a953c0 167577531 S Bi:1:002:1 -115 4096 <
ffff8c93b0a953c0 167598205 C Bi:1:002:1 -2 0
ffff8c93b0a953c0 167598328 S Bi:1:002:1 -115 4096 <
ffff8c93b0a953c0 167618834 C Bi:1:002:1 -2 0
ffff8c93b0a953c0 167618956 S Bi:1:002:1 -115 4096 <
ffff8c93b0a953c0 167639464 C Bi:1:002:1 -2 0
ffff8c93b0a953c0 167639715 S Bi:1:002:1 -115 4096 <
ffff8c93b0a953c0 167660297 C Bi:1:002:1 -2 0
ffff8c93b0a953c0 167660426 S Bi:1:002:1 -115 4096 <
ffff8c93b0a953c0 167680911 C Bi:1:002:1 -2 0
ffff8c93b0a953c0 167681034 S Bi:1:002:1 -115 4096 <
ffff8c93b0a953c0 167701529 C Bi:1:002:1 -2 0
ffff8c93b0a953c0 167701650 S Bi:1:002:1 -115 4096 <
ffff8c93b0a953c0 167722228 C Bi:1:002:1 -2 0
ffff8c93b0a953c0 167722353 S Bi:1:002:1 -115 4096 <
ffff8c93b0a953c0 167742865 C Bi:1:002:1 -2 0
ffff8c93b0a953c0 167742990 S Bi:1:002:1 -115 4096 <
ffff8c93b0a953c0 167763561 C Bi:1:002:1 -2 0
ffff8c93b0a953c0 167763701 S Bi:1:002:1 -115 4096 <
ffff8c93b0a953c0 167784326 C Bi:1:002:1 -2 0
ffff8c93b0a953c0 167784454 S Bi:1:002:1 -115 4096 <
ffff8c93b0a953c0 167805170 C Bi:1:002:1 -2 0
ffff8c93b0a953c0 167805338 S Bi:1:002:1 -115 4096 <
ffff8c93b0a953c0 167825970 C Bi:1:002:1 -2 0
ffff8c93b0a953c0 167826103 S Bi:1:002:1 -115 4096 <
ffff8c93b0a953c0 167846728 C Bi:1:002:1 -2 0
ffff8c93b0a953c0 167846903 S Bi:1:002:1 -115 4096 <
ffff8c93b0a953c0 167867526 C Bi:1:002:1 -2 0
ffff8c93b0a953c0 167867665 S Bi:1:002:1 -115 4096 <
ffff8c93b0a953c0 167888085 C Bi:1:002:1 -2 0
ffff8c93b0a953c0 167888181 S Bi:1:002:1 -115 4096 <
ffff8c93b0a953c0 167908691 C Bi:1:002:1 -2 0
ffff8c93b0a953c0 167908823 S Bi:1:002:1 -115 4096 <
ffff8c93b0a953c0 167929332 C Bi:1:002:1 -2 0
ffff8c93b0a953c0 167929456 S Bi:1:002:1 -115 4096 <
ffff8c93b0a953c0 167949864 C Bi:1:002:1 -2 0
ffff8c93b0a953c0 167949957 S Bi:1:002:1 -115 4096 <
ffff8c93b0a953c0 167970477 C Bi:1:002:1 -2 0
ffff8c93b0a953c0 167970599 S Bi:1:002:1 -115 4096 <
ffff8c93b0a953c0 167991034 C Bi:1:002:1 -2 0
ffff8c93b0a953c0 167991198 S Bi:1:002:1 -115 4096 <
ffff8c93b0a953c0 168011662 C Bi:1:002:1 -2 0
ffff8c93b0a953c0 168011790 S Bi:1:002:1 -115 4096 <
ffff8c93b0a953c0 168032435 C Bi:1:002:1 -2 0
ffff8c93b0a953c0 168032566 S Bi:1:002:1 -115 4096 <
ffff8c93b0a953c0 168053091 C Bi:1:002:1 -2 0
ffff8c93b0a953c0 168053187 S Bi:1:002:1 -115 4096 <
ffff8c93b0a953c0 168073646 C Bi:1:002:1 -2 0
ffff8c93b0a953c0 168073776 S Bi:1:002:1 -115 4096 <
ffff8c93b0a953c0 168094279 C Bi:1:002:1 -2 0
ffff8c93b0a953c0 168094423 S Bi:1:002:1 -115 4096 <
ffff8c93b0a953c0 168114879 C Bi:1:002:1 -2 0
ffff8c93b0a953c0 168114979 S Bi:1:002:1 -115 4096 <
ffff8c93b0a953c0 168135589 C Bi:1:002:1 -2 0
ffff8c93b0a953c0 168135712 S Bi:1:002:1 -115 4096 <
ffff8c93b0a953c0 168156289 C Bi:1:002:1 -2 0
ffff8c93b0a953c0 168156409 S Bi:1:002:1 -115 4096 <
ffff8c93b0a953c0 168176856 C Bi:1:002:1 -2 0
ffff8c93b0a953c0 168176976 S Bi:1:002:1 -115 4096 <
ffff8c93b0a953c0 168197561 C Bi:1:002:1 -2 0
ffff8c93b0a953c0 168197686 S Bi:1:002:1 -115 4096 <
ffff8c93b0a953c0 168218390 C Bi:1:002:1 -2 0
ffff8c93b0a953c0 168218545 S Bi:1:002:1 -115 4096 <
ffff8c93b0a953c0 168239265 C Bi:1:002:1 -2 0
ffff8c93b0a953c0 168239394 S Bi:1:002:1 -115 4096 <
ffff8c93b0a953c0 168259887 C Bi:1:002:1 -2 0
ffff8c93b0a953c0 168260078 S Bi:1:002:1 -115 4096 <
ffff8c93b0a953c0 168280522 C Bi:1:002:1 -2 0
ffff8c93b0a953c0 168280675 S Bi:1:002:1 -115 4096 <
ffff8c93b0a953c0 168301149 C Bi:1:002:1 -2 0
ffff8c93b0a953c0 168301271 S Bi:1:002:1 -115 4096 <
ffff8c93b0a953c0 168321708 C Bi:1:002:1 -2 0
ffff8c93b0a953c0 168321824 S Bi:1:002:1 -115 4096 <
ffff8c93b0a953c0 168342288 C Bi:1:002:1 -2 0
ffff8c93b0a953c0 168342409 S Bi:1:002:1 -115 4096 <
ffff8c93b0a953c0 168363047 C Bi:1:002:1 -2 0
ffff8c93b0a953c0 168363173 S Bi:1:002:1 -115 4096 <
ffff8c93b0a953c0 168383702 C Bi:1:002:1 -2 0
ffff8c93b0a953c0 168383820 S Bi:1:002:1 -115 4096 <
ffff8c93b0a953c0 168404334 C Bi:1:002:1 -2 0
ffff8c93b0a953c0 168404457 S Bi:1:002:1 -115 4096 <
ffff8c93b0a953c0 168424910 C Bi:1:002:1 -2 0
ffff8c93b0a953c0 168425020 S Bi:1:002:1 -115 4096 <
ffff8c93b0a953c0 168445477 C Bi:1:002:1 -2 0
ffff8c93b0a953c0 168445597 S Bi:1:002:1 -115 4096 <
ffff8c93b0a953c0 168466143 C Bi:1:002:1 -2 0
ffff8c93b0a953c0 168466269 S Bi:1:002:1 -115 4096 <
ffff8c93b0a953c0 168486804 C Bi:1:002:1 -2 0
ffff8c93b0a953c0 168486944 S Bi:1:002:1 -115 4096 <
ffff8c93b0a953c0 168507520 C Bi:1:002:1 -2 0
ffff8c93b0a953c0 168507809 S Bi:1:002:1 -115 4096 <
ffff8c93b0a953c0 168528394 C Bi:1:002:1 -2 0
ffff8c93b0a953c0 168528526 S Bi:1:002:1 -115 4096 <
ffff8c93b0a953c0 168548962 C Bi:1:002:1 -2 0
ffff8c93b0a953c0 168549059 S Bi:1:002:1 -115 4096 <
ffff8c93b0a953c0 168569610 C Bi:1:002:1 -2 0
ffff8c93b0a953c0 168569741 S Bi:1:002:1 -115 4096 <
ffff8c93b0a953c0 168590270 C Bi:1:002:1 -2 0
ffff8c93b0a953c0 168590437 S Bi:1:002:1 -115 4096 <
ffff8c93b0a953c0 168610905 C Bi:1:002:1 -2 0
ffff8c93b0a953c0 168611021 S Bi:1:002:1 -115 4096 <
ffff8c93b0a953c0 168631502 C Bi:1:002:1 -2 0
ffff8c93b0a953c0 168631693 S Bi:1:002:1 -115 4096 <
ffff8c93b0a953c0 168652134 C Bi:1:002:1 -2 0
ffff8c93b0a953c0 168652290 S Bi:1:002:1 -115 4096 <
ffff8c93b0a953c0 168672820 C Bi:1:002:1 -2 0
ffff8c93b0a953c0 168672952 S Bi:1:002:1 -115 4096 <
ffff8c93b0a953c0 168693459 C Bi:1:002:1 -2 0
ffff8c93b0a953c0 168693580 S Bi:1:002:1 -115 4096 <
ffff8c93b0a953c0 168714103 C Bi:1:002:1 -2 0
ffff8c93b0a953c0 168714241 S Bi:1:002:1 -115 4096 <
ffff8c93b0a953c0 168734795 C Bi:1:002:1 -2 0
ffff8c93b0a953c0 168734957 S Bi:1:002:1 -115 4096 <
ffff8c93b0a953c0 168755514 C Bi:1:002:1 -2 0
ffff8c93b0a953c0 168755633 S Bi:1:002:1 -115 4096 <
ffff8c93b0a953c0 168776206 C Bi:1:002:1 -2 0
ffff8c93b0a953c0 168776324 S Bi:1:002:1 -115 4096 <
ffff8c93b0a953c0 168796768 C Bi:1:002:1 -2 0
ffff8c93b0a953c0 168796890 S Bi:1:002:1 -115 4096 <
ffff8c93b0a953c0 168817564 C Bi:1:002:1 -2 0
ffff8c93b0a953c0 168817788 S Bi:1:002:1 -115 4096 <
ffff8c93b0a953c0 168838467 C Bi:1:002:1 -2 0
ffff8c93b0a953c0 168838592 S Bi:1:002:1 -115 4096 <
ffff8c93b0a953c0 168859228 C Bi:1:002:1 -2 0
ffff8c93b0a953c0 168859355 S Bi:1:002:1 -115 4096 <
ffff8c93b0a953c0 168879963 C Bi:1:002:1 -2 0
ffff8c93aa26f180 168880118 S Bi:1:002:1 -115 4096 <
ffff8c93aa26f180 168900693 C Bi:1:002:1 -2 0
ffff8c93aa26f180 168900831 S Bi:1:002:1 -115 4096 <
ffff8c93aa26f180 168921383 C Bi:1:002:1 -2 0
ffff8c93aa26f180 168921465 S Bi:1:002:1 -115 4096 <
ffff8c93aa26f180 168941971 C Bi:1:002:1 -2 0
ffff8c93aa26f180 168942101 S Bi:1:002:1 -115 4096 <
ffff8c93aa26f180 168962612 C Bi:1:002:1 -2 0
ffff8c93aa26f180 168962765 S Bi:1:002:1 -115 4096 <
ffff8c93aa26f180 168983254 C Bi:1:002:1 -2 0
ffff8c93aa26f180 168983400 S Bi:1:002:1 -115 4096 <
ffff8c93aa26f180 169003936 C Bi:1:002:1 -2 0
ffff8c93aa26f180 169004097 S Bi:1:002:1 -115 4096 <
ffff8c93aa26f180 169024557 C Bi:1:002:1 -2 0
ffff8c93aa26f180 169024650 S Bi:1:002:1 -115 4096 <
ffff8c93aa26f180 169045201 C Bi:1:002:1 -2 0
ffff8c93aa26f180 169045352 S Bi:1:002:1 -115 4096 <
ffff8c93aa26f180 169065897 C Bi:1:002:1 -2 0
ffff8c93aa26f180 169066137 S Bi:1:002:1 -115 4096 <
ffff8c93aa26f180 169086776 C Bi:1:002:1 -2 0
ffff8c93aa26f180 169086905 S Bi:1:002:1 -115 4096 <
ffff8c93aa26f180 169107425 C Bi:1:002:1 -2 0
ffff8c93aa26f180 169107544 S Bi:1:002:1 -115 4096 <
ffff8c93aa26f180 169128077 C Bi:1:002:1 -2 0
ffff8c93aa26f180 169128219 S Bi:1:002:1 -115 4096 <
ffff8c93aa26f180 169148767 C Bi:1:002:1 -2 0
ffff8c93aa26f180 169149038 S Bi:1:002:1 -115 4096 <
ffff8c93aa26f180 169169501 C Bi:1:002:1 -2 0
ffff8c93aa26f180 169169619 S Bi:1:002:1 -115 4096 <
ffff8c93aa26f180 169190207 C Bi:1:002:1 -2 0
ffff8c93aa26f180 169190378 S Bi:1:002:1 -115 4096 <
ffff8c93aa26f180 169210868 C Bi:1:002:1 -2 0
ffff8c93aa26f180 169210990 S Bi:1:002:1 -115 4096 <
ffff8c93aa26f180 169231492 C Bi:1:002:1 -2 0
ffff8c93aa26f180 169231621 S Bi:1:002:1 -115 4096 <
ffff8c93aa26f180 169252094 C Bi:1:002:1 -2 0
ffff8c93aa26f180 169252203 S Bi:1:002:1 -115 4096 <
ffff8c93aa26f180 169272824 C Bi:1:002:1 -2 0
ffff8c93aa26f180 169272943 S Bi:1:002:1 -115 4096 <
ffff8c93aa26f180 169293406 C Bi:1:002:1 -2 0
ffff8c93aa26f180 169293517 S Bi:1:002:1 -115 4096 <
ffff8c93aa26f180 169313983 C Bi:1:002:1 -2 0
ffff8c93aa26f180 169314112 S Bi:1:002:1 -115 4096 <
ffff8c93aa26f180 169334954 C Bi:1:002:1 -2 0
ffff8c93aa26f180 169335100 S Bi:1:002:1 -115 4096 <
ffff8c93aa26f180 169355546 C Bi:1:002:1 -2 0
ffff8c93aa26f180 169355673 S Bi:1:002:1 -115 4096 <
ffff8c93aa26f180 169376274 C Bi:1:002:1 -2 0
ffff8c93aa26f180 169376401 S Bi:1:002:1 -115 4096 <
ffff8c93aa26f180 169396971 C Bi:1:002:1 -2 0
ffff8c93aa26f180 169397095 S Bi:1:002:1 -115 4096 <
ffff8c93aa26f180 169417572 C Bi:1:002:1 -2 0
ffff8c93aa26f180 169417722 S Bi:1:002:1 -115 4096 <
ffff8c93aa26f180 169438429 C Bi:1:002:1 -2 0
ffff8c93aa26f180 169438609 S Bi:1:002:1 -115 4096 <
ffff8c93aa26f180 169459421 C Bi:1:002:1 -2 0
ffff8c93aa26f180 169459655 S Bi:1:002:1 -115 4096 <
ffff8c93aa26f180 169480241 C Bi:1:002:1 -2 0
ffff8c93aa26f180 169480399 S Bi:1:002:1 -115 4096 <
ffff8c93aa26f180 169500926 C Bi:1:002:1 -2 0
ffff8c93aa26f180 169501085 S Bi:1:002:1 -115 4096 <
ffff8c93aa26f180 169521554 C Bi:1:002:1 -2 0
ffff8c93aa26f180 169521655 S Bi:1:002:1 -115 4096 <
ffff8c93aa26f180 169542203 C Bi:1:002:1 -2 0
ffff8c93aa26f180 169542324 S Bi:1:002:1 -115 4096 <
ffff8c93aa26f180 169562872 C Bi:1:002:1 -2 0
ffff8c93aa26f180 169562996 S Bi:1:002:1 -115 4096 <
ffff8c93aa26f180 169583768 C Bi:1:002:1 -2 0
ffff8c93aa26f180 169583872 S Bi:1:002:1 -115 4096 <
ffff8c93aa26f180 169604464 C Bi:1:002:1 -2 0
ffff8c93aa26f180 169604585 S Bi:1:002:1 -115 4096 <
ffff8c93aa26f180 169625057 C Bi:1:002:1 -2 0
ffff8c93aa26f180 169625155 S Bi:1:002:1 -115 4096 <
ffff8c93aa26f180 169645748 C Bi:1:002:1 -2 0
ffff8c93aa26f180 169645891 S Bi:1:002:1 -115 4096 <
ffff8c93aa26f180 169666450 C Bi:1:002:1 -2 0
ffff8c93aa26f180 169666571 S Bi:1:002:1 -115 4096 <
ffff8c93aa26f180 169687035 C Bi:1:002:1 -2 0
ffff8c93aa26f180 169687145 S Bi:1:002:1 -115 4096 <
ffff8c93aa26f180 169707796 C Bi:1:002:1 -2 0
ffff8c93aa26f180 169707941 S Bi:1:002:1 -115 4096 <
ffff8c93aa26f180 169728771 C Bi:1:002:1 -2 0
ffff8c93aa26f180 169728963 S Bi:1:002:1 -115 4096 <
ffff8c93aa26f180 169749442 C Bi:1:002:1 -2 0
ffff8c93aa26f180 169749563 S Bi:1:002:1 -115 4096 <
ffff8c93aa26f180 169770112 C Bi:1:002:1 -2 0
ffff8c93aa26f180 169770236 S Bi:1:002:1 -115 4096 <
ffff8c93aa26f180 169790717 C Bi:1:002:1 -2 0
ffff8c93aa26f180 169790967 S Bi:1:002:1 -115 4096 <
ffff8c93aa26f180 169811398 C Bi:1:002:1 -2 0
ffff8c93aa26f180 169811499 S Bi:1:002:1 -115 4096 <
ffff8c93aa26f180 169832094 C Bi:1:002:1 -2 0
ffff8c93aa26f180 169832229 S Bi:1:002:1 -115 4096 <
ffff8c93aa26f180 169852683 C Bi:1:002:1 -2 0
ffff8c93aa26f180 169852780 S Bi:1:002:1 -115 4096 <
ffff8c93aa26f180 169873257 C Bi:1:002:1 -2 0
ffff8c93aa26f180 169873380 S Bi:1:002:1 -115 4096 <
ffff8c93aa26f180 169893855 C Bi:1:002:1 -2 0
ffff8c93aa26f180 169894018 S Bi:1:002:1 -115 4096 <
ffff8c93aa26f180 169914653 C Bi:1:002:1 -2 0
ffff8c93aa26f180 169914791 S Bi:1:002:1 -115 4096 <
ffff8c93aa26f180 169935301 C Bi:1:002:1 -2 0
ffff8c93aa26f180 169935421 S Bi:1:002:1 -115 4096 <
ffff8c93aa26f180 169955857 C Bi:1:002:1 -2 0
ffff8c93aa26f180 169955945 S Bi:1:002:1 -115 4096 <
ffff8c93aa26f180 169976447 C Bi:1:002:1 -2 0
ffff8c93aa26f180 169976565 S Bi:1:002:1 -115 4096 <
ffff8c93aa26f180 169997033 C Bi:1:002:1 -2 0
ffff8c93aa26f180 169997158 S Bi:1:002:1 -115 4096 <
ffff8c93aa26f180 170017562 C Bi:1:002:1 -2 0
ffff8c93aa26f180 170017651 S Bi:1:002:1 -115 4096 <
ffff8c93aa26f180 170038276 C Bi:1:002:1 -2 0
ffff8c93aa26f180 170038410 S Bi:1:002:1 -115 4096 <
ffff8c93aa26f180 170058941 C Bi:1:002:1 -2 0
ffff8c93aa26f180 170059073 S Bi:1:002:1 -115 4096 <
ffff8c93aa26f180 170079536 C Bi:1:002:1 -2 0
ffff8c93aa26f180 170079632 S Bi:1:002:1 -115 4096 <
ffff8c93aa26f180 170100118 C Bi:1:002:1 -2 0
ffff8c93aa26f180 170100249 S Bi:1:002:1 -115 4096 <
ffff8c93aa26f180 170120725 C Bi:1:002:1 -2 0
ffff8c93aa26f180 170120854 S Bi:1:002:1 -115 4096 <
ffff8c93aa26f180 170141307 C Bi:1:002:1 -2 0
ffff8c93aa26f180 170141424 S Bi:1:002:1 -115 4096 <
ffff8c93aa26f180 170161977 C Bi:1:002:1 -2 0
ffff8c93aa26f180 170162280 S Bi:1:002:1 -115 4096 <
ffff8c93aa26f180 170182741 C Bi:1:002:1 -2 0
ffff8c93aa26f180 170182827 S Bi:1:002:1 -115 4096 <
ffff8c93aa26f180 170203348 C Bi:1:002:1 -2 0
