ffff8a552d810840 1947275479 S Bi:1:018:1 -115 16 <
ffff8a552d810840 1947296259 C Bi:1:018:1 -2 0
ffff8a552d810840 1947296458 S Bi:1:018:1 -115 16 <
ffff8a552d810840 1947317132 C Bi:1:018:1 -2 0
ffff8a552d810840 1947317292 S Bi:1:018:1 -115 16 <
ffff8a552d810840 1947338155 C Bi:1:018:1 -2 0
ffff8a552d810840 1947338333 S Bi:1:018:1 -115 16 <
ffff8a552d810840 1947359061 C Bi:1:018:1 -2 0
ffff8a552d810840 1947359221 S Bi:1:018:1 -115 16 <
ffff8a552d810840 1947380641 C Bi:1:018:1 -2 0
ffff8a552d810840 1947380939 S Bi:1:018:1 -115 16 <
ffff8a552d810840 1947401691 C Bi:1:018:1 -2 0
ffff8a552d810840 1947401848 S Bi:1:018:1 -115 16 <
ffff8a552d810840 1947422576 C Bi:1:018:1 -2 0
ffff8a552d810840 1947422711 S Bi:1:018:1 -115 16 <
ffff8a552d810840 1947443371 C Bi:1:018:1 -2 0
ffff8a552d810840 1947443506 S Bi:1:018:1 -115 16 <
ffff8a552d810840 1947464203 C Bi:1:018:1 -2 0
ffff8a552d810840 1947464336 S Bi:1:018:1 -115 16 <
ffff8a552d810840 1947484944 C Bi:1:018:1 -2 0
ffff8a552d810840 1947485073 S Bi:1:018:1 -115 16 <
ffff8a552d810840 1947505615 C Bi:1:018:1 -2 0
ffff8a552d810840 1947505716 S Bi:1:018:1 -115 16 <
ffff8a552d810840 1947526412 C Bi:1:018:1 -2 0
ffff8a552d810840 1947527091 S Bi:1:018:1 -115 16 <
ffff8a552d810840 1947547726 C Bi:1:018:1 -2 0
ffff8a552d810840 1947547919 S Bi:1:018:1 -115 16 <
ffff8a552d810840 1947568574 C Bi:1:018:1 -2 0
ffff8a552d810840 1947568696 S Bi:1:018:1 -115 16 <
ffff8a552d810840 1947589492 C Bi:1:018:1 -2 0
ffff8a552d810840 1947589619 S Bi:1:018:1 -115 16 <
ffff8a552d810840 1947610181 C Bi:1:018:1 -2 0
ffff8a552d810840 1947610357 S Bi:1:018:1 -115 16 <
ffff8a552d810840 1947631066 C Bi:1:018:1 -2 0
ffff8a552d810840 1947631193 S Bi:1:018:1 -115 16 <
ffff8a552d810840 1947651841 C Bi:1:018:1 -2 0
ffff8a552d810840 1947651968 S Bi:1:018:1 -115 16 <
ffff8a552d810840 1947672733 C Bi:1:018:1 -2 0
ffff8a552d810840 1947672874 S Bi:1:018:1 -115 16 <
ffff8a552d810840 1947693626 C Bi:1:018:1 -2 0
ffff8a552d810840 1947693756 S Bi:1:018:1 -115 16 <
ffff8a552d810840 1947714367 C Bi:1:018:1 -2 0
ffff8a552d810840 1947714486 S Bi:1:018:1 -115 16 <
ffff8a552d810840 1947735070 C Bi:1:018:1 -2 0
ffff8a552d810840 1947735171 S Bi:1:018:1 -115 16 <
ffff8a552d810840 1947755821 C Bi:1:018:1 -2 0
ffff8a552d810840 1947755948 S Bi:1:018:1 -115 16 <
ffff8a552d810840 1947776700 C Bi:1:018:1 -2 0
ffff8a552d810840 1947776856 S Bi:1:018:1 -115 16 <
ffff8a552d810840 1947797595 C Bi:1:018:1 -2 0
ffff8a552d810840 1947797762 S Bi:1:018:1 -115 16 <
ffff8a552d810840 1947818386 C Bi:1:018:1 -2 0
ffff8a552d810840 1947818511 S Bi:1:018:1 -115 16 <
ffff8a552d810840 1947839125 C Bi:1:018:1 -2 0
ffff8a552d810840 1947839235 S Bi:1:018:1 -115 16 <
ffff8a552d810840 1947859933 C Bi:1:018:1 -2 0
ffff8a552d810840 1947860095 S Bi:1:018:1 -115 16 <
ffff8a552d810840 1947880749 C Bi:1:018:1 -2 0
ffff8a552d810840 1947880859 S Bi:1:018:1 -115 16 <
ffff8a552d810840 1947901581 C Bi:1:018:1 -2 0
ffff8a552d810840 1947901711 S Bi:1:018:1 -115 16 <
ffff8a552d810840 1947922366 C Bi:1:018:1 -2 0
ffff8a552d810840 1947922493 S Bi:1:018:1 -115 16 <
ffff8a552d810840 1947943064 C Bi:1:018:1 -2 0
ffff8a552d810840 1947943163 S Bi:1:018:1 -115 16 <
ffff8a552d810840 1947963917 C Bi:1:018:1 -2 0
ffff8a552d810840 1947964105 S Bi:1:018:1 -115 16 <
ffff8a552d810840 1947984734 C Bi:1:018:1 -2 0
ffff8a552d810840 1947984866 S Bi:1:018:1 -115 16 <
ffff8a552d810840 1948005492 C Bi:1:018:1 -2 0
ffff8a552d810840 1948005619 S Bi:1:018:1 -115 16 <
ffff8a552d810840 1948026285 C Bi:1:018:1 -2 0
ffff8a552d810840 1948026399 S Bi:1:018:1 -115 16 <
ffff8a552d810840 1948047017 C Bi:1:018:1 -2 0
ffff8a552d810840 1948047121 S Bi:1:018:1 -115 16 <
ffff8a552d810840 1948067774 C Bi:1:018:1 -2 0
ffff8a552d810840 1948067880 S Bi:1:018:1 -115 16 <
ffff8a552d810840 1948088608 C Bi:1:018:1 -2 0
ffff8a552d810840 1948088743 S Bi:1:018:1 -115 16 <
ffff8a552d810840 1948109573 C Bi:1:018:1 -2 0
ffff8a552d810840 1948109719 S Bi:1:018:1 -115 16 <
ffff8a552d810840 1948130402 C Bi:1:018:1 -2 0
ffff8a552d810840 1948130548 S Bi:1:018:1 -115 16 <
ffff8a552d810840 1948151376 C Bi:1:018:1 -2 0
ffff8a552d810840 1948151494 S Bi:1:018:1 -115 16 <
ffff8a552d810840 1948172103 C Bi:1:018:1 -2 0
ffff8a552d810840 1948172243 S Bi:1:018:1 -115 16 <
ffff8a552d810840 1948192833 C Bi:1:018:1 -2 0
ffff8a552d810840 1948192958 S Bi:1:018:1 -115 16 <
ffff8a552d810840 1948213496 C Bi:1:018:1 -2 0
ffff8a552d810840 1948213618 S Bi:1:018:1 -115 16 <
ffff8a552d810840 1948234162 C Bi:1:018:1 -2 0
ffff8a552d810840 1948234295 S Bi:1:018:1 -115 16 <
ffff8a552d810840 1948254812 C Bi:1:018:1 -2 0
ffff8a552d810840 1948254924 S Bi:1:018:1 -115 16 <
ffff8a552d810840 1948275424 C Bi:1:018:1 -2 0
ffff8a552d810840 1948275523 S Bi:1:018:1 -115 16 <
ffff8a552d810840 1948296039 C Bi:1:018:1 -2 0
ffff8a552d810840 1948296142 S Bi:1:018:1 -115 16 <
ffff8a552d810840 1948316665 C Bi:1:018:1 -2 0
ffff8a552d810840 1948316777 S Bi:1:018:1 -115 16 <
ffff8a552d810840 1948337327 C Bi:1:018:1 -2 0
ffff8a552d810840 1948337449 S Bi:1:018:1 -115 16 <
ffff8a552d810840 1948357974 C Bi:1:018:1 -2 0
ffff8a552d810840 1948358107 S Bi:1:018:1 -115 16 <
ffff8a552d810840 1948378625 C Bi:1:018:1 -2 0
ffff8a552d810840 1948378716 S Bi:1:018:1 -115 16 <
ffff8a552d810840 1948399339 C Bi:1:018:1 -2 0
ffff8a552d810840 1948399485 S Bi:1:018:1 -115 16 <
ffff8a552d810840 1948420070 C Bi:1:018:1 -2 0
ffff8a552d810840 1948420191 S Bi:1:018:1 -115 16 <
ffff8a552d810840 1948440712 C Bi:1:018:1 -2 0
ffff8a552d810840 1948440828 S Bi:1:018:1 -115 16 <
ffff8a552d810840 1948461375 C Bi:1:018:1 -2 0
ffff8a552d810840 1948461547 S Bi:1:018:1 -115 16 <
ffff8a552d810840 1948482117 C Bi:1:018:1 -2 0
ffff8a552d810840 1948482242 S Bi:1:018:1 -115 16 <
ffff8a552d810840 1948502812 C Bi:1:018:1 -2 0
ffff8a552d810840 1948502947 S Bi:1:018:1 -115 16 <
ffff8a552d810840 1948523475 C Bi:1:018:1 -2 0
ffff8a552d810840 1948523588 S Bi:1:018:1 -115 16 <
ffff8a552d810840 1948544143 C Bi:1:018:1 -2 0
ffff8a552d810840 1948544274 S Bi:1:018:1 -115 16 <
ffff8a552d810840 1948564806 C Bi:1:018:1 -2 0
ffff8a552d810840 1948564895 S Bi:1:018:1 -115 16 <
ffff8a552d810840 1948585455 C Bi:1:018:1 -2 0
ffff8a552d810840 1948585576 S Bi:1:018:1 -115 16 <
ffff8a552d810840 1948606153 C Bi:1:018:1 -2 0
ffff8a552d810840 1948606271 S Bi:1:018:1 -115 16 <
ffff8a552d810840 1948626957 C Bi:1:018:1 -2 0
ffff8a552d810840 1948627104 S Bi:1:018:1 -115 16 <
ffff8a552d810840 1948647755 C Bi:1:018:1 -2 0
ffff8a552d810840 1948647902 S Bi:1:018:1 -115 16 <
ffff8a552d810840 1948668464 C Bi:1:018:1 -2 0
ffff8a552d810840 1948668604 S Bi:1:018:1 -115 16 <
ffff8a552d810840 1948689188 C Bi:1:018:1 -2 0
ffff8a552d810840 1948689302 S Bi:1:018:1 -115 16 <
ffff8a552d810840 1948709799 C Bi:1:018:1 -2 0
ffff8a552d810840 1948709895 S Bi:1:018:1 -115 16 <
ffff8a552d810840 1948730461 C Bi:1:018:1 -2 0
ffff8a552d810840 1948730578 S Bi:1:018:1 -115 16 <
ffff8a552d810840 1948751136 C Bi:1:018:1 -2 0
ffff8a552d810840 1948751262 S Bi:1:018:1 -115 16 <
ffff8a552d810840 1948771722 C Bi:1:018:1 -2 0
ffff8a552d810840 1948771819 S Bi:1:018:1 -115 16 <
ffff8a552d810840 1948792408 C Bi:1:018:1 -2 0
ffff8a552d810840 1948792556 S Bi:1:018:1 -115 16 <
ffff8a552d810840 1948813239 C Bi:1:018:1 -2 0
ffff8a552d810840 1948813390 S Bi:1:018:1 -115 16 <
ffff8a552d810840 1948833945 C Bi:1:018:1 -2 0
ffff8a552d810840 1948834067 S Bi:1:018:1 -115 16 <
ffff8a552d810840 1948854650 C Bi:1:018:1 -2 0
ffff8a552d810840 1948854756 S Bi:1:018:1 -115 16 <
ffff8a552d810840 1948875281 C Bi:1:018:1 -2 0
ffff8a552d810840 1948875517 S Bi:1:018:1 -115 16 <
ffff8a552d810840 1948896091 C Bi:1:018:1 -2 0
ffff8a552d810840 1948896184 S Bi:1:018:1 -115 16 <
ffff8a552d810840 1948916843 C Bi:1:018:1 -2 0
ffff8a552d810840 1948916995 S Bi:1:018:1 -115 16 <
ffff8a552d810840 1948937711 C Bi:1:018:1 -2 0
ffff8a552d810840 1948937858 S Bi:1:018:1 -115 16 <
ffff8a552d810840 1948958587 C Bi:1:018:1 -2 0
ffff8a552d810840 1948958732 S Bi:1:018:1 -115 16 <
ffff8a552d810840 1948979384 C Bi:1:018:1 -2 0
ffff8a552d810840 1948979610 S Bi:1:018:1 -115 16 <
ffff8a552d810840 1949000332 C Bi:1:018:1 -2 0
ffff8a552d810840 1949000496 S Bi:1:018:1 -115 16 <
ffff8a552d810840 1949021042 C Bi:1:018:1 -2 0
ffff8a552d810840 1949021157 S Bi:1:018:1 -115 16 <
ffff8a552d810840 1949041710 C Bi:1:018:1 -2 0
ffff8a552d810840 1949041825 S Bi:1:018:1 -115 16 <
ffff8a552d810840 1949062344 C Bi:1:018:1 -2 0
ffff8a552d810840 1949062426 S Bi:1:018:1 -115 16 <
ffff8a552d810840 1949082925 C Bi:1:018:1 -2 0
ffff8a552d810840 1949083027 S Bi:1:018:1 -115 16 <
ffff8a552d810840 1949103692 C Bi:1:018:1 -2 0
ffff8a552d810840 1949103800 S Bi:1:018:1 -115 16 <
ffff8a552d810840 1949124588 C Bi:1:018:1 -2 0
ffff8a552d810840 1949124734 S Bi:1:018:1 -115 16 <
ffff8a552d810840 1949145330 C Bi:1:018:1 -2 0
ffff8a552d810840 1949145470 S Bi:1:018:1 -115 16 <
ffff8a552d810840 1949166050 C Bi:1:018:1 -2 0
ffff8a552d810840 1949166196 S Bi:1:018:1 -115 16 <
ffff8a552d810840 1949186674 C Bi:1:018:1 -2 0
ffff8a552d810840 1949186783 S Bi:1:018:1 -115 16 <
ffff8a552d810840 1949207384 C Bi:1:018:1 -2 0
ffff8a552d810840 1949207521 S Bi:1:018:1 -115 16 <
ffff8a552d810840 1949228135 C Bi:1:018:1 -2 0
ffff8a552d810840 1949228256 S Bi:1:018:1 -115 16 <
ffff8a552d810840 1949248870 C Bi:1:018:1 -2 0
ffff8a552d810840 1949248988 S Bi:1:018:1 -115 16 <
ffff8a552d810840 1949269541 C Bi:1:018:1 -2 0
ffff8a552d810840 1949269665 S Bi:1:018:1 -115 16 <
ffff8a552d810840 1949290217 C Bi:1:018:1 -2 0
ffff8a552d810840 1949290338 S Bi:1:018:1 -115 16 <
ffff8a552d810840 1949310971 C Bi:1:018:1 -2 0
ffff8a552d810840 1949311078 S Bi:1:018:1 -115 16 <
ffff8a552d810840 1949331603 C Bi:1:018:1 -2 0
ffff8a552d810840 1949331722 S Bi:1:018:1 -115 16 <
ffff8a552d810840 1949352186 C Bi:1:018:1 -2 0
ffff8a552d810840 1949352282 S Bi:1:018:1 -115 16 <
ffff8a552d810840 1949372848 C Bi:1:018:1 -2 0
ffff8a552d810840 1949372954 S Bi:1:018:1 -115 16 <
ffff8a552d810840 1949393470 C Bi:1:018:1 -2 0
ffff8a552d810840 1949393574 S Bi:1:018:1 -115 16 <
ffff8a552d810840 1949414135 C Bi:1:018:1 -2 0
ffff8a552d810840 1949414286 S Bi:1:018:1 -115 16 <
ffff8a552d810840 1949434843 C Bi:1:018:1 -2 0
ffff8a552d810840 1949434948 S Bi:1:018:1 -115 16 <
ffff8a552d810840 1949455415 C Bi:1:018:1 -2 0
ffff8a552d810840 1949455513 S Bi:1:018:1 -115 16 <
ffff8a552d810840 1949476058 C Bi:1:018:1 -2 0
ffff8a552d810840 1949476185 S Bi:1:018:1 -115 16 <
ffff8a552d810840 1949496695 C Bi:1:018:1 -2 0
ffff8a552d810840 1949496816 S Bi:1:018:1 -115 16 <
ffff8a552d810840 1949517313 C Bi:1:018:1 -2 0
ffff8a552d810840 1949517413 S Bi:1:018:1 -115 16 <
ffff8a552d810840 1949537954 C Bi:1:018:1 -2 0
ffff8a552d810840 1949538086 S Bi:1:018:1 -115 16 <
ffff8a552d810840 1949558572 C Bi:1:018:1 -2 0
ffff8a552d810840 1949558673 S Bi:1:018:1 -115 16 <
ffff8a552d810840 1949579274 C Bi:1:018:1 -2 0
ffff8a552d810840 1949579384 S Bi:1:018:1 -115 16 <
ffff8a552d810840 1949599936 C Bi:1:018:1 -2 0
ffff8a552d810840 1949600120 S Bi:1:018:1 -115 16 <
ffff8a552d810840 1949620631 C Bi:1:018:1 -2 0
ffff8a552d810840 1949620738 S Bi:1:018:1 -115 16 <
ffff8a552d810840 1949641230 C Bi:1:018:1 -2 0
ffff8a552d810840 1949641329 S Bi:1:018:1 -115 16 <
ffff8a552d810840 1949661998 C Bi:1:018:1 -2 0
ffff8a552d810840 1949662128 S Bi:1:018:1 -115 16 <
ffff8a552d810840 1949683079 C Bi:1:018:1 -2 0
ffff8a552d810840 1949683211 S Bi:1:018:1 -115 16 <
ffff8a552d810840 1949704503 C Bi:1:018:1 -2 0
ffff8a552d810840 1949704656 S Bi:1:018:1 -115 16 <
ffff8a552d810840 1949725214 C Bi:1:018:1 -2 0
ffff8a552d810840 1949725346 S Bi:1:018:1 -115 16 <
ffff8a552d810840 1949745835 C Bi:1:018:1 -2 0
ffff8a552d810840 1949745943 S Bi:1:018:1 -115 16 <
ffff8a552d810840 1949766594 C Bi:1:018:1 -2 0
ffff8a552d810840 1949766745 S Bi:1:018:1 -115 16 <
ffff8a552d810840 1949787265 C Bi:1:018:1 -2 0
ffff8a552d810840 1949787346 S Bi:1:018:1 -115 16 <
ffff8a552d810840 1949807828 C Bi:1:018:1 -2 0
ffff8a552d810840 1949807921 S Bi:1:018:1 -115 16 <
ffff8a552d810840 1949828480 C Bi:1:018:1 -2 0
ffff8a552d810840 1949828644 S Bi:1:018:1 -115 16 <
ffff8a552d810840 1949849366 C Bi:1:018:1 -2 0
ffff8a552d810840 1949849512 S Bi:1:018:1 -115 16 <
ffff8a552d810840 1949870237 C Bi:1:018:1 -2 0
ffff8a552d810840 1949870369 S Bi:1:018:1 -115 16 <
ffff8a552d810840 1949891505 C Bi:1:018:1 -2 0
ffff8a552d810840 1949891654 S Bi:1:018:1 -115 16 <
ffff8a552d810840 1949912179 C Bi:1:018:1 -2 0
ffff8a552d810840 1949912284 S Bi:1:018:1 -115 16 <
ffff8a552d810840 1949932825 C Bi:1:018:1 -2 0
ffff8a552d810840 1949932955 S Bi:1:018:1 -115 16 <
ffff8a552d810840 1949953545 C Bi:1:018:1 -2 0
ffff8a552d810840 1949953823 S Bi:1:018:1 -115 16 <
ffff8a552d810840 1949974388 C Bi:1:018:1 -2 0
ffff8a552d810840 1949974520 S Bi:1:018:1 -115 16 <
ffff8a552d810840 1949994954 C Bi:1:018:1 -2 0
ffff8a552d810840 1949995038 S Bi:1:018:1 -115 16 <
ffff8a552d810840 1950015710 C Bi:1:018:1 -2 0
ffff8a552d810840 1950015851 S Bi:1:018:1 -115 16 <
ffff8a552d810840 1950036628 C Bi:1:018:1 -2 0
ffff8a552d810840 1950036803 S Bi:1:018:1 -115 16 <
ffff8a552d810840 1950057508 C Bi:1:018:1 -2 0
ffff8a552d810840 1950057630 S Bi:1:018:1 -115 16 <
ffff8a552d810840 1950078668 C Bi:1:018:1 -2 0
ffff8a552d810840 1950078784 S Bi:1:018:1 -115 16 <
ffff8a552d810840 1950099419 C Bi:1:018:1 -2 0
ffff8a552d810840 1950099560 S Bi:1:018:1 -115 16 <
ffff8a552d810840 1950120130 C Bi:1:018:1 -2 0
ffff8a552d810840 1950120264 S Bi:1:018:1 -115 16 <
ffff8a552d810840 1950140944 C Bi:1:018:1 -2 0
ffff8a552d810840 1950141103 S Bi:1:018:1 -115 16 <
ffff8a552d810840 1950161776 C Bi:1:018:1 -2 0
ffff8a552d810840 1950161919 S Bi:1:018:1 -115 16 <
ffff8a552d810840 1950182418 C Bi:1:018:1 -2 0
ffff8a550d825480 1950182589 S Bi:1:018:1 -115 16 <
ffff8a550d825480 1950203198 C Bi:1:018:1 -2 0
ffff8a550d825480 1950203340 S Bi:1:018:1 -115 16 <
ffff8a550d825480 1950223914 C Bi:1:018:1 -2 0
ffff8a550d825480 1950224084 S Bi:1:018:1 -115 16 <
ffff8a550d825480 1950244632 C Bi:1:018:1 -2 0
ffff8a550d825480 1950244799 S Bi:1:018:1 -115 16 <
ffff8a550d825480 1950265414 C Bi:1:018:1 -2 0
ffff8a550d825480 1950266636 S Bo:1:018:2 -115 2 = 9002
ffff8a550d825480 1950267011 C Bo:1:018:2 0 2 >
ffff8a550d825480 1950267945 S Bi:1:018:1 -115 16 <
ffff8a550d825480 1950268381 C Bi:1:018:1 0 6 = 90045b20 2032
ffff8a550d825480 1950270145 S Bi:1:018:1 -115 16 <
ffff8a550d825480 1950271585 C Bi:1:018:1 0 6 = 90043933 2e39
ffff8a550d825480 1950273154 S Bi:1:018:1 -115 16 <
ffff8a550d825480 1950274778 C Bi:1:018:1 0 6 = 90043832 3434
ffff8a550d825480 1950276542 S Bi:1:018:1 -115 16 <
ffff8a550d825480 1950277986 C Bi:1:018:1 0 6 = 9004365d 2065
ffff8a550d825480 1950279856 S Bi:1:018:1 -115 16 <
ffff8a550d825480 1950281318 C Bi:1:018:1 0 6 = 90047564 3a20
ffff8a550d825480 1950282842 S Bi:1:018:1 -115 16 <
ffff8a550d825480 1950284433 C Bi:1:018:1 0 6 = 90045258 3436
ffff8a550d825480 1950285987 S Bi:1:018:1 -115 16 <
ffff8a550d825480 1950287600 C Bi:1:018:1 0 6 = 90042046 3120
ffff8a550d825480 1950289633 S Bi:1:018:1 -115 16 <
ffff8a550d825480 1950290821 C Bi:1:018:1 0 6 = 90047669 613d
ffff8a550d825480 1950292182 S Bi:1:018:1 -115 16 <
ffff8a550d825480 1950294023 C Bi:1:018:1 0 6 = 90046972 7120
ffff8a550d825480 1950295635 S Bi:1:018:1 -115 16 <
ffff8a550d825480 1950297226 C Bi:1:018:1 0 6 = 90046972 7173
ffff8a550d825480 1950298609 S Bi:1:018:1 -115 16 <
ffff8a550d825480 1950300406 C Bi:1:018:1 0 6 = 90043d31 2066
ffff8a550d825480 1950303498 S Bi:1:018:1 -115 16 <
ffff8a550d825480 1950303857 C Bi:1:018:1 0 6 = 90046175 6c74
ffff8a550d825480 1950305531 S Bi:1:018:1 -115 16 <
ffff8a550d825480 1950306606 C Bi:1:018:1 0 5 = 90033d30 0a
ffff8a550d825480 1950307919 S Bi:1:018:1 -115 16 <
ffff8a550d825480 1950317465 C Bi:1:018:1 0 6 = 90045b20 2032
ffff8a550d825480 1950318948 S Bi:1:018:1 -115 16 <
ffff8a550d825480 1950320627 C Bi:1:018:1 0 6 = 90043934 2e30
ffff8a550d825480 1950322022 S Bi:1:018:1 -115 16 <
ffff8a550d825480 1950323823 C Bi:1:018:1 0 6 = 90043331 3538
ffff8a550d825480 1950325961 S Bi:1:018:1 -115 16 <
ffff8a550d825480 1950327051 C Bi:1:018:1 0 6 = 9004315d 2065
ffff8a550d825480 1950328563 S Bi:1:018:1 -115 16 <
ffff8a550d825480 1950330209 C Bi:1:018:1 0 6 = 90047564 3a20
ffff8a550d825480 1950331446 S Bi:1:018:1 -115 16 <
ffff8a550d825480 1950333439 C Bi:1:018:1 0 6 = 90047265 626f
ffff8a550d825480 1950334856 S Bi:1:018:1 -115 16 <
ffff8a550d825480 1950336636 C Bi:1:018:1 0 6 = 90046f74 3220
ffff8a550d825480 1950338293 S Bi:1:018:1 -115 16 <
ffff8a550d825480 1950339838 C Bi:1:018:1 0 6 = 9004626f 6f74
ffff8a550d825480 1950341317 S Bi:1:018:1 -115 16 <
ffff8a550d825480 1950343055 C Bi:1:018:1 0 6 = 90046c6f 6164
ffff8a550d825480 1950344617 S Bi:1:018:1 -115 16 <
ffff8a550d825480 1950346236 C Bi:1:018:1 0 6 = 90046572 2072
ffff8a550d825480 1950347672 S Bi:1:018:1 -115 16 <
ffff8a550d825480 1950349434 C Bi:1:018:1 0 6 = 90046571 7565
ffff8a550d825480 1950351053 S Bi:1:018:1 -115 16 <
ffff8a550d825480 1950352646 C Bi:1:018:1 0 6 = 90047374 6564
ffff8a550d825480 1950354045 S Bi:1:018:1 -115 16 <
ffff8a550d825480 1950355274 C Bi:1:018:1 0 3 = 90010a
ffff8a550d825480 1950356957 S Bi:1:018:1 -115 16 <
ffff8a550d825480 1950364185 C Bi:1:018:1 -62 0
