ffff8a5592b90780 1626619793 S Bi:1:017:1 -115 16 <
ffff8a5592b90780 1626640556 C Bi:1:017:1 -2 0
ffff8a5592b90780 1626640765 S Bi:1:017:1 -115 16 <
ffff8a5592b90780 1626661610 C Bi:1:017:1 -2 0
ffff8a5592b90780 1626661785 S Bi:1:017:1 -115 16 <
ffff8a5592b90780 1626682743 C Bi:1:017:1 -2 0
ffff8a5592b90780 1626682913 S Bi:1:017:1 -115 16 <
ffff8a5592b90780 1626703633 C Bi:1:017:1 -2 0
ffff8a5592b90780 1626703806 S Bi:1:017:1 -115 16 <
ffff8a5592b90780 1626724597 C Bi:1:017:1 -2 0
ffff8a5592b90780 1626724763 S Bi:1:017:1 -115 16 <
ffff8a5592b90780 1626745524 C Bi:1:017:1 -2 0
ffff8a5592b90780 1626745662 S Bi:1:017:1 -115 16 <
ffff8a5592b90780 1626766620 C Bi:1:017:1 -2 0
ffff8a5592b90780 1626766794 S Bi:1:017:1 -115 16 <
ffff8a5592b90780 1626787703 C Bi:1:017:1 -2 0
ffff8a5592b90780 1626787861 S Bi:1:017:1 -115 16 <
ffff8a5592b90780 1626808615 C Bi:1:017:1 -2 0
ffff8a5592b90780 1626808776 S Bi:1:017:1 -115 16 <
ffff8a5592b90780 1626829392 C Bi:1:017:1 -2 0
ffff8a5592b90780 1626829532 S Bi:1:017:1 -115 16 <
ffff8a5592b90780 1626850188 C Bi:1:017:1 -2 0
ffff8a5592b90780 1626850334 S Bi:1:017:1 -115 16 <
ffff8a5592b90780 1626870952 C Bi:1:017:1 -2 0
ffff8a5592b90780 1626871060 S Bi:1:017:1 -115 16 <
ffff8a5592b90780 1626891930 C Bi:1:017:1 -2 0
ffff8a5592b90780 1626892135 S Bi:1:017:1 -115 16 <
ffff8a5592b90780 1626912764 C Bi:1:017:1 -2 0
ffff8a5592b90780 1626912893 S Bi:1:017:1 -115 16 <
ffff8a5592b90780 1626933481 C Bi:1:017:1 -2 0
ffff8a5592b90780 1626933578 S Bi:1:017:1 -115 16 <
ffff8a5592b90780 1626954345 C Bi:1:017:1 -2 0
ffff8a5592b90780 1626954502 S Bi:1:017:1 -115 16 <
ffff8a5592b90780 1626975066 C Bi:1:017:1 -2 0
ffff8a5592b90780 1626975182 S Bi:1:017:1 -115 16 <
ffff8a5592b90780 1626995772 C Bi:1:017:1 -2 0
ffff8a5592b90780 1626995869 S Bi:1:017:1 -115 16 <
ffff8a5592b90780 1627016723 C Bi:1:017:1 -2 0
ffff8a5592b90780 1627016851 S Bi:1:017:1 -115 16 <
ffff8a5592b90780 1627037445 C Bi:1:017:1 -2 0
ffff8a5592b90780 1627037550 S Bi:1:017:1 -115 16 <
ffff8a5592b90780 1627058262 C Bi:1:017:1 -2 0
ffff8a5592b90780 1627058361 S Bi:1:017:1 -115 16 <
ffff8a5592b90780 1627079042 C Bi:1:017:1 -2 0
ffff8a5592b90780 1627079166 S Bi:1:017:1 -115 16 <
ffff8a5592b90780 1627099689 C Bi:1:017:1 -2 0
ffff8a5592b90780 1627099783 S Bi:1:017:1 -115 16 <
ffff8a5592b90780 1627120365 C Bi:1:017:1 -2 0
ffff8a5592b90780 1627120491 S Bi:1:017:1 -115 16 <
ffff8a5592b90780 1627141254 C Bi:1:017:1 -2 0
ffff8a5592b90780 1627141385 S Bi:1:017:1 -115 16 <
ffff8a5592b90780 1627161855 C Bi:1:017:1 -2 0
ffff8a5592b90780 1627161944 S Bi:1:017:1 -115 16 <
ffff8a5592b90780 1627182607 C Bi:1:017:1 -2 0
ffff8a5592b90780 1627182734 S Bi:1:017:1 -115 16 <
ffff8a5592b90780 1627203250 C Bi:1:017:1 -2 0
ffff8a5592b90780 1627203421 S Bi:1:017:1 -115 16 <
ffff8a5592b90780 1627223958 C Bi:1:017:1 -2 0
ffff8a5592b90780 1627224123 S Bi:1:017:1 -115 16 <
ffff8a5592b90780 1627244755 C Bi:1:017:1 -2 0
ffff8a5592b90780 1627244877 S Bi:1:017:1 -115 16 <
ffff8a5592b90780 1627265489 C Bi:1:017:1 -2 0
ffff8a5592b90780 1627265605 S Bi:1:017:1 -115 16 <
ffff8a5592b90780 1627286323 C Bi:1:017:1 -2 0
ffff8a5592b90780 1627286529 S Bi:1:017:1 -115 16 <
ffff8a5592b90780 1627307188 C Bi:1:017:1 -2 0
ffff8a5592b90780 1627307319 S Bi:1:017:1 -115 16 <
ffff8a5592b90780 1627327904 C Bi:1:017:1 -2 0
ffff8a5592b90780 1627328147 S Bi:1:017:1 -115 16 <
ffff8a5592b90780 1627348836 C Bi:1:017:1 -2 0
ffff8a5592b90780 1627348970 S Bi:1:017:1 -115 16 <
ffff8a5592b90780 1627369551 C Bi:1:017:1 -2 0
ffff8a5592b90780 1627369694 S Bi:1:017:1 -115 16 <
ffff8a5592b90780 1627390396 C Bi:1:017:1 -2 0
ffff8a5592b90780 1627390547 S Bi:1:017:1 -115 16 <
ffff8a5592b90780 1627411293 C Bi:1:017:1 -2 0
ffff8a5592b90780 1627411425 S Bi:1:017:1 -115 16 <
ffff8a5592b90780 1627432070 C Bi:1:017:1 -2 0
ffff8a5592b90780 1627432179 S Bi:1:017:1 -115 16 <
ffff8a5592b90780 1627453063 C Bi:1:017:1 -2 0
ffff8a5592b90780 1627453208 S Bi:1:017:1 -115 16 <
ffff8a5592b90780 1627473744 C Bi:1:017:1 -2 0
ffff8a5592b90780 1627473865 S Bi:1:017:1 -115 16 <
ffff8a5592b90780 1627494319 C Bi:1:017:1 -2 0
ffff8a5592b90780 1627494404 S Bi:1:017:1 -115 16 <
ffff8a5592b90780 1627514913 C Bi:1:017:1 -2 0
ffff8a5592b90780 1627514998 S Bi:1:017:1 -115 16 <
ffff8a5592b90780 1627535720 C Bi:1:017:1 -2 0
ffff8a5592b90780 1627535848 S Bi:1:017:1 -115 16 <
ffff8a5592b90780 1627556578 C Bi:1:017:1 -2 0
ffff8a5592b90780 1627556706 S Bi:1:017:1 -115 16 <
ffff8a5592b90780 1627577378 C Bi:1:017:1 -2 0
ffff8a5592b90780 1627577501 S Bi:1:017:1 -115 16 <
ffff8a5592b90780 1627598022 C Bi:1:017:1 -2 0
ffff8a5592b90780 1627598128 S Bi:1:017:1 -115 16 <
ffff8a5592b90780 1627618641 C Bi:1:017:1 -2 0
ffff8a5592b90780 1627618737 S Bi:1:017:1 -115 16 <
ffff8a5592b90780 1627639424 C Bi:1:017:1 -2 0
ffff8a5592b90780 1627639548 S Bi:1:017:1 -115 16 <
ffff8a5592b90780 1627660221 C Bi:1:017:1 -2 0
ffff8a5592b90780 1627660363 S Bi:1:017:1 -115 16 <
ffff8a5592b90780 1627680936 C Bi:1:017:1 -2 0
ffff8a5592b90780 1627681067 S Bi:1:017:1 -115 16 <
ffff8a5592b90780 1627701573 C Bi:1:017:1 -2 0
ffff8a5592b90780 1627701684 S Bi:1:017:1 -115 16 <
ffff8a5592b90780 1627722215 C Bi:1:017:1 -2 0
ffff8a5592b90780 1627722316 S Bi:1:017:1 -115 16 <
ffff8a5592b90780 1627742925 C Bi:1:017:1 -2 0
ffff8a5592b90780 1627743064 S Bi:1:017:1 -115 16 <
ffff8a5592b90780 1627763634 C Bi:1:017:1 -2 0
ffff8a5592b90780 1627763732 S Bi:1:017:1 -115 16 <
ffff8a5592b90780 1627784278 C Bi:1:017:1 -2 0
ffff8a5592b90780 1627784428 S Bi:1:017:1 -115 16 <
ffff8a5592b90780 1627805045 C Bi:1:017:1 -2 0
ffff8a5592b90780 1627805171 S Bi:1:017:1 -115 16 <
ffff8a5592b90780 1627825684 C Bi:1:017:1 -2 0
ffff8a5592b90780 1627825788 S Bi:1:017:1 -115 16 <
ffff8a5592b90780 1627846418 C Bi:1:017:1 -2 0
ffff8a5592b90780 1627846551 S Bi:1:017:1 -115 16 <
ffff8a5592b90780 1627867076 C Bi:1:017:1 -2 0
ffff8a5592b90780 1627867184 S Bi:1:017:1 -115 16 <
ffff8a5592b90780 1627887834 C Bi:1:017:1 -2 0
ffff8a5592b90780 1627887944 S Bi:1:017:1 -115 16 <
ffff8a5592b90780 1627908723 C Bi:1:017:1 -2 0
ffff8a5592b90780 1627908873 S Bi:1:017:1 -115 16 <
ffff8a5592b90780 1627929410 C Bi:1:017:1 -2 0
ffff8a5592b90780 1627929541 S Bi:1:017:1 -115 16 <
ffff8a5592b90780 1627950019 C Bi:1:017:1 -2 0
ffff8a5592b90780 1627950110 S Bi:1:017:1 -115 16 <
ffff8a5592b90780 1627970830 C Bi:1:017:1 -2 0
ffff8a5592b90780 1627970972 S Bi:1:017:1 -115 16 <
ffff8a5592b90780 1627991496 C Bi:1:017:1 -2 0
ffff8a5592b90780 1627991604 S Bi:1:017:1 -115 16 <
ffff8a5592b90780 1628012108 C Bi:1:017:1 -2 0
ffff8a5592b90780 1628012209 S Bi:1:017:1 -115 16 <
ffff8a5592b90780 1628032854 C Bi:1:017:1 -2 0
ffff8a5592b90780 1628032988 S Bi:1:017:1 -115 16 <
ffff8a5592b90780 1628053625 C Bi:1:017:1 -2 0
ffff8a5592b90780 1628053797 S Bi:1:017:1 -115 16 <
ffff8a5592b90780 1628074334 C Bi:1:017:1 -2 0
ffff8a5592b90780 1628074442 S Bi:1:017:1 -115 16 <
ffff8a5592b90780 1628095064 C Bi:1:017:1 -2 0
ffff8a5592b90780 1628095195 S Bi:1:017:1 -115 16 <
ffff8a5592b90780 1628115734 C Bi:1:017:1 -2 0
ffff8a5592b90780 1628115859 S Bi:1:017:1 -115 16 <
ffff8a5592b90780 1628136714 C Bi:1:017:1 -2 0
ffff8a5592b90780 1628136898 S Bi:1:017:1 -115 16 <
ffff8a5592b90780 1628157524 C Bi:1:017:1 -2 0
ffff8a5592b90780 1628157658 S Bi:1:017:1 -115 16 <
ffff8a5592b90780 1628178206 C Bi:1:017:1 -2 0
ffff8a5592b90780 1628178327 S Bi:1:017:1 -115 16 <
ffff8a5592b90780 1628199107 C Bi:1:017:1 -2 0
ffff8a5592b90780 1628199252 S Bi:1:017:1 -115 16 <
ffff8a5592b90780 1628219877 C Bi:1:017:1 -2 0
ffff8a5592b90780 1628219987 S Bi:1:017:1 -115 16 <
ffff8a5592b90780 1628240667 C Bi:1:017:1 -2 0
ffff8a5592b90780 1628240773 S Bi:1:017:1 -115 16 <
ffff8a5592b90780 1628261928 C Bi:1:017:1 -2 0
ffff8a5592b90780 1628262088 S Bi:1:017:1 -115 16 <
ffff8a5592b90780 1628282668 C Bi:1:017:1 -2 0
ffff8a5592b90780 1628282804 S Bi:1:017:1 -115 16 <
ffff8a5592b90780 1628303474 C Bi:1:017:1 -2 0
ffff8a5592b90780 1628303617 S Bi:1:017:1 -115 16 <
ffff8a5592b90780 1628324292 C Bi:1:017:1 -2 0
ffff8a5592b90780 1628324433 S Bi:1:017:1 -115 16 <
ffff8a5592b90780 1628344937 C Bi:1:017:1 -2 0
ffff8a5592b90780 1628345047 S Bi:1:017:1 -115 16 <
ffff8a5592b90780 1628365654 C Bi:1:017:1 -2 0
ffff8a5592b90780 1628365779 S Bi:1:017:1 -115 16 <
ffff8a5592b90780 1628386411 C Bi:1:017:1 -2 0
ffff8a5592b90780 1628386572 S Bi:1:017:1 -115 16 <
ffff8a5592b90780 1628407230 C Bi:1:017:1 -2 0
ffff8a5592b90780 1628407360 S Bi:1:017:1 -115 16 <
ffff8a5592b90780 1628427898 C Bi:1:017:1 -2 0
ffff8a5592b90780 1628428095 S Bi:1:017:1 -115 16 <
ffff8a5592b90780 1628448696 C Bi:1:017:1 -2 0
ffff8a5592b90780 1628448820 S Bi:1:017:1 -115 16 <
ffff8a5592b90780 1628469444 C Bi:1:017:1 -2 0
ffff8a5592b90780 1628469568 S Bi:1:017:1 -115 16 <
ffff8a5592b90780 1628490149 C Bi:1:017:1 -2 0
ffff8a5592b90780 1628490265 S Bi:1:017:1 -115 16 <
ffff8a5592b90780 1628510881 C Bi:1:017:1 -2 0
ffff8a5592b90780 1628511018 S Bi:1:017:1 -115 16 <
ffff8a5592b90780 1628531737 C Bi:1:017:1 -2 0
ffff8a5592b90780 1628531879 S Bi:1:017:1 -115 16 <
ffff8a5592b90780 1628552624 C Bi:1:017:1 -2 0
ffff8a5592b90780 1628552762 S Bi:1:017:1 -115 16 <
ffff8a5592b90780 1628573423 C Bi:1:017:1 -2 0
ffff8a5592b90780 1628573546 S Bi:1:017:1 -115 16 <
ffff8a5592b90780 1628594139 C Bi:1:017:1 -2 0
ffff8a5592b90780 1628594281 S Bi:1:017:1 -115 16 <
ffff8a5592b90780 1628614772 C Bi:1:017:1 -2 0
ffff8a5592b90780 1628614878 S Bi:1:017:1 -115 16 <
ffff8a5592b90780 1628635508 C Bi:1:017:1 -2 0
ffff8a5592b90780 1628635645 S Bi:1:017:1 -115 16 <
ffff8a5592b90780 1628656262 C Bi:1:017:1 -2 0
ffff8a5592b90780 1628656403 S Bi:1:017:1 -115 16 <
ffff8a5592b90780 1628676965 C Bi:1:017:1 -2 0
ffff8a5592b90780 1628677070 S Bi:1:017:1 -115 16 <
ffff8a5592b90780 1628697653 C Bi:1:017:1 -2 0
ffff8a5592b90780 1628697770 S Bi:1:017:1 -115 16 <
ffff8a5592b90780 1628718261 C Bi:1:017:1 -2 0
ffff8a5592b90780 1628718350 S Bi:1:017:1 -115 16 <
ffff8a5592b90780 1628738997 C Bi:1:017:1 -2 0
ffff8a5592b90780 1628739112 S Bi:1:017:1 -115 16 <
ffff8a5592b90780 1628759761 C Bi:1:017:1 -2 0
ffff8a5592b90780 1628759893 S Bi:1:017:1 -115 16 <
ffff8a5592b90780 1628780468 C Bi:1:017:1 -2 0
ffff8a5592b90780 1628780620 S Bi:1:017:1 -115 16 <
ffff8a5592b90780 1628801217 C Bi:1:017:1 -2 0
ffff8a5592b90780 1628801337 S Bi:1:017:1 -115 16 <
ffff8a5592b90780 1628821986 C Bi:1:017:1 -2 0
ffff8a5592b90780 1628822134 S Bi:1:017:1 -115 16 <
ffff8a5592b90780 1628842658 C Bi:1:017:1 -2 0
ffff8a5592b90780 1628842771 S Bi:1:017:1 -115 16 <
ffff8a5592b90780 1628863470 C Bi:1:017:1 -2 0
ffff8a5592b90780 1628863595 S Bi:1:017:1 -115 16 <
ffff8a5592b90780 1628884110 C Bi:1:017:1 -2 0
ffff8a5592b90780 1628884235 S Bi:1:017:1 -115 16 <
ffff8a5592b90780 1628904733 C Bi:1:017:1 -2 0
ffff8a5592b90780 1628904846 S Bi:1:017:1 -115 16 <
ffff8a5592b90780 1628925427 C Bi:1:017:1 -2 0
ffff8a5592b90780 1628925551 S Bi:1:017:1 -115 16 <
ffff8a5592b90780 1628946072 C Bi:1:017:1 -2 0
ffff8a5592b90780 1628946180 S Bi:1:017:1 -115 16 <
ffff8a5592b90780 1628966881 C Bi:1:017:1 -2 0
ffff8a5592b90780 1628967024 S Bi:1:017:1 -115 16 <
ffff8a5592b90780 1628987548 C Bi:1:017:1 -2 0
ffff8a5592b90780 1628987698 S Bi:1:017:1 -115 16 <
ffff8a5592b90780 1629008344 C Bi:1:017:1 -2 0
ffff8a5592b90780 1629008460 S Bi:1:017:1 -115 16 <
ffff8a5592b90780 1629028959 C Bi:1:017:1 -2 0
ffff8a5592b90780 1629029059 S Bi:1:017:1 -115 16 <
ffff8a5592b90780 1629049542 C Bi:1:017:1 -2 0
ffff8a5592b90780 1629049645 S Bi:1:017:1 -115 16 <
ffff8a5592b90780 1629070203 C Bi:1:017:1 -2 0
ffff8a5592b90780 1629070346 S Bi:1:017:1 -115 16 <
ffff8a5592b90780 1629091013 C Bi:1:017:1 -2 0
ffff8a5592b90780 1629091141 S Bi:1:017:1 -115 16 <
ffff8a5592b90780 1629111726 C Bi:1:017:1 -2 0
ffff8a5592b90780 1629111840 S Bi:1:017:1 -115 16 <
ffff8a5592b90780 1629132683 C Bi:1:017:1 -2 0
ffff8a5592b90780 1629132849 S Bi:1:017:1 -115 16 <
ffff8a5592b90780 1629153422 C Bi:1:017:1 -2 0
ffff8a5592b90780 1629153554 S Bi:1:017:1 -115 16 <
ffff8a5592b90780 1629174019 C Bi:1:017:1 -2 0
ffff8a5592b90780 1629174114 S Bi:1:017:1 -115 16 <
ffff8a5592b90780 1629194720 C Bi:1:017:1 -2 0
ffff8a5592b90780 1629194851 S Bi:1:017:1 -115 16 <
ffff8a5592b90780 1629215371 C Bi:1:017:1 -2 0
ffff8a5592b90780 1629215485 S Bi:1:017:1 -115 16 <
ffff8a5592b90780 1629235964 C Bi:1:017:1 -2 0
ffff8a5592b90780 1629236123 S Bi:1:017:1 -115 16 <
ffff8a5592b90780 1629256725 C Bi:1:017:1 -2 0
ffff8a5592b90780 1629256866 S Bi:1:017:1 -115 16 <
ffff8a5592b90780 1629277345 C Bi:1:017:1 -2 0
ffff8a5592b90780 1629277438 S Bi:1:017:1 -115 16 <
ffff8a5592b90780 1629297953 C Bi:1:017:1 -2 0
ffff8a5592b90780 1629298052 S Bi:1:017:1 -115 16 <
ffff8a5592b90780 1629318771 C Bi:1:017:1 -2 0
ffff8a5592b90780 1629318917 S Bi:1:017:1 -115 16 <
ffff8a5592b90780 1629339478 C Bi:1:017:1 -2 0
ffff8a5592b90780 1629339575 S Bi:1:017:1 -115 16 <
ffff8a5592b90780 1629360033 C Bi:1:017:1 -2 0
ffff8a5592b90780 1629360135 S Bi:1:017:1 -115 16 <
ffff8a5592b90780 1629380826 C Bi:1:017:1 -2 0
ffff8a5592b90780 1629380951 S Bi:1:017:1 -115 16 <
ffff8a5592b90780 1629401447 C Bi:1:017:1 -2 0
ffff8a5592b90780 1629401536 S Bi:1:017:1 -115 16 <
ffff8a5592b90780 1629422053 C Bi:1:017:1 -2 0
ffff8a5592b90780 1629422161 S Bi:1:017:1 -115 16 <
ffff8a5592b90780 1629442713 C Bi:1:017:1 -2 0
ffff8a5592b90780 1629442825 S Bi:1:017:1 -115 16 <
ffff8a5592b90780 1629463415 C Bi:1:017:1 -2 0
ffff8a5592b90780 1629463533 S Bi:1:017:1 -115 16 <
ffff8a5592b90780 1629484180 C Bi:1:017:1 -2 0
ffff8a5592b90780 1629484302 S Bi:1:017:1 -115 16 <
ffff8a5592b90780 1629504768 C Bi:1:017:1 -2 0
ffff8a5592b90780 1629504866 S Bi:1:017:1 -115 16 <
ffff8a5592b90780 1629525509 C Bi:1:017:1 -2 0
ffff8a5592b90780 1629525636 S Bi:1:017:1 -115 16 <
ffff8a5592b90780 1629546164 C Bi:1:017:1 -2 0
ffff8a5592b90780 1629546280 S Bi:1:017:1 -115 16 <
ffff8a5592b90780 1629566773 C Bi:1:017:1 -2 0
ffff8a5592b90780 1629566865 S Bi:1:017:1 -115 16 <
ffff8a5592b90780 1629587499 C Bi:1:017:1 -2 0
ffff8a5592b90780 1629587630 S Bi:1:017:1 -115 16 <
ffff8a5592b90780 1629608245 C Bi:1:017:1 -2 0
ffff8a5592b90780 1629609356 S Bo:1:017:2 -115 2 = 9002
ffff8a5592b90780 1629609816 C Bo:1:017:2 0 2 >
ffff8a5592b90780 1629610551 S Bi:1:017:1 -115 16 <
ffff8a5592b90780 1629612141 C Bi:1:017:1 0 6 = 90045b20 3135
ffff8a5592b90300 1629613953 S Bi:1:017:1 -115 16 <
ffff8a5592b90300 1629615284 C Bi:1:017:1 0 6 = 90043936 2e35
ffff8a5592b90300 1629617017 S Bi:1:017:1 -115 16 <
ffff8a5592b90300 1629618471 C Bi:1:017:1 0 6 = 90043530 3231
ffff8a5592b90300 1629619879 S Bi:1:017:1 -115 16 <
ffff8a5592b90300 1629621702 C Bi:1:017:1 0 6 = 9004305d 2065
ffff8a5592b90300 1629623187 S Bi:1:017:1 -115 16 <
ffff8a5592b90300 1629624839 C Bi:1:017:1 0 6 = 90047564 3a20
ffff8a5592b90300 1629626246 S Bi:1:017:1 -115 16 <
ffff8a5592b90300 1629628043 C Bi:1:017:1 0 6 = 90045258 3436
ffff8a5592b90300 1629629330 S Bi:1:017:1 -115 16 <
ffff8a5592b90300 1629631308 C Bi:1:017:1 0 6 = 90042046 3120
ffff8a5592b90300 1629633464 S Bi:1:017:1 -115 16 <
ffff8a5592b90300 1629634483 C Bi:1:017:1 0 6 = 90047669 613d
ffff8a5592b90300 1629635978 S Bi:1:017:1 -115 16 <
ffff8a5592b90300 1629637646 C Bi:1:017:1 0 6 = 90046972 7120
ffff8a5592b90300 1629639064 S Bi:1:017:1 -115 16 <
ffff8a5592b90300 1629640848 C Bi:1:017:1 0 6 = 90046972 7173
ffff8a5592b90300 1629642191 S Bi:1:017:1 -115 16 <
ffff8a5592b90300 1629644068 C Bi:1:017:1 0 6 = 90043d31 2066
ffff8a5592b90300 1629647104 S Bi:1:017:1 -115 16 <
ffff8a5592b90300 1629647513 C Bi:1:017:1 0 6 = 90046175 6c74
ffff8a5592b90300 1629648935 S Bi:1:017:1 -115 16 <
ffff8a5592b90300 1629650258 C Bi:1:017:1 0 5 = 90033d30 0a
ffff8a5592b90300 1629651518 S Bi:1:017:1 -115 16 <
ffff8a5592b90300 1629661321 C Bi:1:017:1 0 6 = 90045b20 3135
ffff8a5592b90300 1629662882 S Bi:1:017:1 -115 16 <
ffff8a5592b90300 1629664502 C Bi:1:017:1 0 6 = 90043936 2e35
ffff8a5592b90300 1629665918 S Bi:1:017:1 -115 16 <
ffff8a5592b90300 1629667676 C Bi:1:017:1 0 6 = 90043939 3436
ffff8a5592b90300 1629669119 S Bi:1:017:1 -115 16 <
ffff8a5592b90300 1629670872 C Bi:1:017:1 0 6 = 9004375d 2065
ffff8a5592b90300 1629672262 S Bi:1:017:1 -115 16 <
ffff8a5592b90300 1629674080 C Bi:1:017:1 0 6 = 90047564 3a20
ffff8a5592b90300 1629675479 S Bi:1:017:1 -115 16 <
ffff8a5592b90300 1629677261 C Bi:1:017:1 0 6 = 90047265 626f
ffff8a5592b90300 1629678555 S Bi:1:017:1 -115 16 <
ffff8a5592b90300 1629680477 C Bi:1:017:1 0 6 = 90046f74 3220
ffff8a5592b90300 1629681758 S Bi:1:017:1 -115 16 <
ffff8a5592b90300 1629683673 C Bi:1:017:1 0 6 = 9004626f 6f74
ffff8a5592b90300 1629684945 S Bi:1:017:1 -115 16 <
ffff8a5592b90300 1629686878 C Bi:1:017:1 0 6 = 90046c6f 6164
ffff8a5592b90300 1629688373 S Bi:1:017:1 -115 16 <
ffff8a5592b90300 1629690092 C Bi:1:017:1 0 6 = 90046572 2072
ffff8a55e6ca0600 1629691406 S Bi:1:017:1 -115 16 <
ffff8a55e6ca0600 1629693327 C Bi:1:017:1 0 6 = 90046571 7565
ffff8a55e6ca0600 1629694770 S Bi:1:017:1 -115 16 <
ffff8a55e6ca0600 1629696498 C Bi:1:017:1 0 6 = 90047374 6564
ffff8a55e6ca0600 1629698025 S Bi:1:017:1 -115 16 <
ffff8a55e6ca0600 1629699079 C Bi:1:017:1 0 3 = 90010a
ffff8a55e6ca0600 1629700468 S Bi:1:017:1 -115 16 <
ffff8a55e6ca0600 1629707347 C Bi:1:017:1 -62 0
