ffff8996857b1900 489591360 S Bi:1:002:1 -115 16 <
ffff8996857b1900 489612048 C Bi:1:002:1 -2 0
ffff8996857b1900 489612436 S Bi:1:002:1 -115 16 <
ffff8996857b1900 489633261 C Bi:1:002:1 -2 0
ffff8996857b1900 489633409 S Bi:1:002:1 -115 16 <
ffff8996857b1900 489653949 C Bi:1:002:1 -2 0
ffff8996857b1900 489654103 S Bi:1:002:1 -115 16 <
ffff8996857b1900 489674726 C Bi:1:002:1 -2 0
ffff8996857b1900 489674898 S Bi:1:002:1 -115 16 <
ffff8996857b1900 489695484 C Bi:1:002:1 -2 0
ffff8996857b1900 489695654 S Bi:1:002:1 -115 16 <
ffff8996857b1900 489716160 C Bi:1:002:1 -2 0
ffff8996876c8d80 489716280 S Bi:1:002:1 -115 16 <
ffff8996876c8d80 489736809 C Bi:1:002:1 -2 0
ffff8996876c8d80 489736930 S Bi:1:002:1 -115 16 <
ffff8996876c8d80 489757404 C Bi:1:002:1 -2 0
ffff8996876c8d80 489757522 S Bi:1:002:1 -115 16 <
ffff8996876c8d80 489778019 C Bi:1:002:1 -2 0
ffff8996876c8d80 489778137 S Bi:1:002:1 -115 16 <
ffff8996876c8d80 489798667 C Bi:1:002:1 -2 0
ffff8996876c8d80 489798785 S Bi:1:002:1 -115 16 <
ffff8996876c8d80 489819358 C Bi:1:002:1 -2 0
ffff8996876c8d80 489819532 S Bi:1:002:1 -115 16 <
ffff8996876c8d80 489840057 C Bi:1:002:1 -2 0
ffff8996876c8d80 489840181 S Bi:1:002:1 -115 16 <
ffff8996876c8d80 489860745 C Bi:1:002:1 -2 0
ffff8996876c8d80 489860874 S Bi:1:002:1 -115 16 <
ffff8996876c8d80 489881381 C Bi:1:002:1 -2 0
ffff8996876c8d80 489881491 S Bi:1:002:1 -115 16 <
ffff8996876c8d80 489902091 C Bi:1:002:1 -2 0
ffff8996876c8d80 489902258 S Bi:1:002:1 -115 16 <
ffff8996876c8d80 489922826 C Bi:1:002:1 -2 0
ffff8996876c8d80 489922942 S Bi:1:002:1 -115 16 <
ffff8996876c8d80 489943505 C Bi:1:002:1 -2 0
ffff8996876c8d80 489943649 S Bi:1:002:1 -115 16 <
ffff8996876c8d80 489964249 C Bi:1:002:1 -2 0
ffff8996454f4e40 489964394 S Bi:1:002:1 -115 16 <
ffff8996454f4e40 489984977 C Bi:1:002:1 -2 0
ffff8996454f4e40 489985095 S Bi:1:002:1 -115 16 <
ffff8996454f4e40 490005619 C Bi:1:002:1 -2 0
ffff8996454f4e40 490005779 S Bi:1:002:1 -115 16 <
ffff8996454f4e40 490026539 C Bi:1:002:1 -2 0
ffff8996454f4e40 490026694 S Bi:1:002:1 -115 16 <
ffff8996454f4e40 490047183 C Bi:1:002:1 -2 0
ffff8996454f4e40 490047331 S Bi:1:002:1 -115 16 <
ffff8996454f4e40 490067939 C Bi:1:002:1 -2 0
ffff8996454f4e40 490068078 S Bi:1:002:1 -115 16 <
ffff8996454f4e40 490088662 C Bi:1:002:1 -2 0
ffff8996454f4e40 490088792 S Bi:1:002:1 -115 16 <
ffff8996454f4e40 490109399 C Bi:1:002:1 -2 0
ffff8996454f4e40 490109581 S Bi:1:002:1 -115 16 <
ffff8996454f4e40 490130185 C Bi:1:002:1 -2 0
ffff8996454f4e40 490130307 S Bi:1:002:1 -115 16 <
ffff8996454f4e40 490150861 C Bi:1:002:1 -2 0
ffff8996454f4e40 490150977 S Bi:1:002:1 -115 16 <
ffff8996454f4e40 490171536 C Bi:1:002:1 -2 0
ffff8996454f4e40 490171678 S Bi:1:002:1 -115 16 <
ffff8996454f4e40 490192195 C Bi:1:002:1 -2 0
ffff8996454f4e40 490192317 S Bi:1:002:1 -115 16 <
ffff8996454f4e40 490212831 C Bi:1:002:1 -2 0
ffff8996454f4e40 490212959 S Bi:1:002:1 -115 16 <
ffff8996454f4e40 490233467 C Bi:1:002:1 -2 0
ffff8996454f4e40 490233581 S Bi:1:002:1 -115 16 <
ffff8996454f4e40 490254204 C Bi:1:002:1 -2 0
ffff8996454f4e40 490254549 S Bi:1:002:1 -115 16 <
ffff8996454f4e40 490275114 C Bi:1:002:1 -2 0
ffff8996454f4e40 490275244 S Bi:1:002:1 -115 16 <
ffff8996454f4e40 490295820 C Bi:1:002:1 -2 0
ffff8996454f4e40 490295941 S Bi:1:002:1 -115 16 <
ffff8996454f4e40 490316482 C Bi:1:002:1 -2 0
ffff8996454f4e40 490316614 S Bi:1:002:1 -115 16 <
ffff8996454f4e40 490337264 C Bi:1:002:1 -2 0
ffff8996454f4e40 490337437 S Bi:1:002:1 -115 16 <
ffff8996454f4e40 490358027 C Bi:1:002:1 -2 0
ffff8996454f4e40 490358191 S Bi:1:002:1 -115 16 <
ffff8996454f4e40 490378777 C Bi:1:002:1 -2 0
ffff8996454f4e40 490378894 S Bi:1:002:1 -115 16 <
ffff8996454f4e40 490399469 C Bi:1:002:1 -2 0
ffff8996454f4e40 490399582 S Bi:1:002:1 -115 16 <
ffff8996454f4e40 490420132 C Bi:1:002:1 -2 0
ffff8996454f4e40 490420297 S Bi:1:002:1 -115 16 <
ffff8996454f4e40 490440814 C Bi:1:002:1 -2 0
ffff8996454f4e40 490440930 S Bi:1:002:1 -115 16 <
ffff8996454f4e40 490461398 C Bi:1:002:1 -2 0
ffff8996454f4e40 490461525 S Bi:1:002:1 -115 16 <
ffff8996454f4e40 490481978 C Bi:1:002:1 -2 0
ffff8996454f4e40 490482092 S Bi:1:002:1 -115 16 <
ffff8996454f4e40 490502653 C Bi:1:002:1 -2 0
ffff8996454f4e40 490502776 S Bi:1:002:1 -115 16 <
ffff8996454f4e40 490523333 C Bi:1:002:1 -2 0
ffff8996454f4e40 490523464 S Bi:1:002:1 -115 16 <
ffff8996454f4e40 490544054 C Bi:1:002:1 -2 0
ffff8996454f4e40 490544180 S Bi:1:002:1 -115 16 <
ffff8996454f4e40 490564754 C Bi:1:002:1 -2 0
ffff8996454f4e40 490564870 S Bi:1:002:1 -115 16 <
ffff8996454f4e40 490585426 C Bi:1:002:1 -2 0
ffff8996454f4e40 490585566 S Bi:1:002:1 -115 16 <
ffff8996454f4e40 490606133 C Bi:1:002:1 -2 0
ffff8996454f4e40 490606270 S Bi:1:002:1 -115 16 <
ffff8996454f4e40 490626890 C Bi:1:002:1 -2 0
ffff8996454f4e40 490627025 S Bi:1:002:1 -115 16 <
ffff8996454f4e40 490647544 C Bi:1:002:1 -2 0
ffff8996454f4e40 490647665 S Bi:1:002:1 -115 16 <
ffff8996454f4e40 490668223 C Bi:1:002:1 -2 0
ffff8996454f4e40 490668363 S Bi:1:002:1 -115 16 <
ffff8996454f4e40 490688904 C Bi:1:002:1 -2 0
ffff8996454f4e40 490689017 S Bi:1:002:1 -115 16 <
ffff8996454f4e40 490709553 C Bi:1:002:1 -2 0
ffff8996454f4e40 490709714 S Bi:1:002:1 -115 16 <
ffff8996454f4e40 490730334 C Bi:1:002:1 -2 0
ffff8996454f4e40 490730453 S Bi:1:002:1 -115 16 <
ffff8996454f4e40 490751002 C Bi:1:002:1 -2 0
ffff8996454f4e40 490751150 S Bi:1:002:1 -115 16 <
ffff8996454f4e40 490771750 C Bi:1:002:1 -2 0
ffff8996454f4e40 490771875 S Bi:1:002:1 -115 16 <
ffff8996454f4e40 490792574 C Bi:1:002:1 -2 0
ffff8996454f4e40 490792758 S Bi:1:002:1 -115 16 <
ffff8996454f4e40 490813330 C Bi:1:002:1 -2 0
ffff8996454f4e40 490813454 S Bi:1:002:1 -115 16 <
ffff8996454f4e40 490834000 C Bi:1:002:1 -2 0
ffff8996454f4e40 490834127 S Bi:1:002:1 -115 16 <
ffff8996454f4e40 490854709 C Bi:1:002:1 -2 0
ffff8996454f4e40 490854862 S Bi:1:002:1 -115 16 <
ffff8996454f4e40 490875464 C Bi:1:002:1 -2 0
ffff8996454f4e40 490875600 S Bi:1:002:1 -115 16 <
ffff8996454f4e40 490896168 C Bi:1:002:1 -2 0
ffff8996454f4e40 490896289 S Bi:1:002:1 -115 16 <
ffff8996454f4e40 490916805 C Bi:1:002:1 -2 0
ffff8996454f4e40 490916926 S Bi:1:002:1 -115 16 <
ffff8996454f4e40 490937460 C Bi:1:002:1 -2 0
ffff8996454f4e40 490937582 S Bi:1:002:1 -115 16 <
ffff8996454f4e40 490958178 C Bi:1:002:1 -2 0
ffff8996454f4e40 490958316 S Bi:1:002:1 -115 16 <
ffff8996454f4e40 490978900 C Bi:1:002:1 -2 0
ffff8996454f4e40 490979018 S Bi:1:002:1 -115 16 <
ffff8996454f4e40 490999531 C Bi:1:002:1 -2 0
ffff8996454f4e40 490999649 S Bi:1:002:1 -115 16 <
ffff8996454f4e40 491020171 C Bi:1:002:1 -2 0
ffff8996454f4e40 491020289 S Bi:1:002:1 -115 16 <
ffff8996454f4e40 491040835 C Bi:1:002:1 -2 0
ffff8996454f4e40 491040951 S Bi:1:002:1 -115 16 <
ffff8996454f4e40 491061506 C Bi:1:002:1 -2 0
ffff8996454f4e40 491061660 S Bi:1:002:1 -115 16 <
ffff8996454f4e40 491082262 C Bi:1:002:1 -2 0
ffff8996454f4e40 491082378 S Bi:1:002:1 -115 16 <
ffff8996454f4e40 491102881 C Bi:1:002:1 -2 0
ffff8996454f4e40 491103028 S Bi:1:002:1 -115 16 <
ffff8996454f4e40 491123544 C Bi:1:002:1 -2 0
ffff8996454f4e40 491123667 S Bi:1:002:1 -115 16 <
ffff8996454f4e40 491144298 C Bi:1:002:1 -2 0
ffff8996454f4e40 491144436 S Bi:1:002:1 -115 16 <
ffff8996454f4e40 491164959 C Bi:1:002:1 -2 0
ffff8996454f4e40 491165074 S Bi:1:002:1 -115 16 <
ffff8996454f4e40 491185620 C Bi:1:002:1 -2 0
ffff8996454f4e40 491185742 S Bi:1:002:1 -115 16 <
ffff8996454f4e40 491206316 C Bi:1:002:1 -2 0
ffff8996454f4e40 491206468 S Bi:1:002:1 -115 16 <
ffff8996454f4e40 491227085 C Bi:1:002:1 -2 0
ffff8996454f4e40 491227228 S Bi:1:002:1 -115 16 <
ffff8996454f4e40 491247788 C Bi:1:002:1 -2 0
ffff8996454f4e40 491247917 S Bi:1:002:1 -115 16 <
ffff8996454f4e40 491268497 C Bi:1:002:1 -2 0
ffff8996454f4e40 491268625 S Bi:1:002:1 -115 16 <
ffff8996454f4e40 491289120 C Bi:1:002:1 -2 0
ffff8996454f4e40 491289227 S Bi:1:002:1 -115 16 <
ffff8996454f4e40 491309786 C Bi:1:002:1 -2 0
ffff8996454f4e40 491309914 S Bi:1:002:1 -115 16 <
ffff8996454f4e40 491330496 C Bi:1:002:1 -2 0
ffff8996454f4e40 491330647 S Bi:1:002:1 -115 16 <
ffff8996454f4e40 491351131 C Bi:1:002:1 -2 0
ffff8996454f4e40 491351294 S Bi:1:002:1 -115 16 <
ffff8996454f4e40 491371917 C Bi:1:002:1 -2 0
ffff8996454f4e40 491372088 S Bi:1:002:1 -115 16 <
ffff8996454f4e40 491392601 C Bi:1:002:1 -2 0
ffff8996454f4e40 491392715 S Bi:1:002:1 -115 16 <
ffff8996454f4e40 491413259 C Bi:1:002:1 -2 0
ffff8996454f4e40 491413374 S Bi:1:002:1 -115 16 <
ffff8996454f4e40 491433909 C Bi:1:002:1 -2 0
ffff8996454f4e40 491434026 S Bi:1:002:1 -115 16 <
ffff8996454f4e40 491454473 C Bi:1:002:1 -2 0
ffff8996454f4e40 491454574 S Bi:1:002:1 -115 16 <
ffff8996454f4e40 491475156 C Bi:1:002:1 -2 0
ffff8996454f4e40 491475278 S Bi:1:002:1 -115 16 <
ffff8996454f4e40 491495793 C Bi:1:002:1 -2 0
ffff8996454f4e40 491495906 S Bi:1:002:1 -115 16 <
ffff8996454f4e40 491516436 C Bi:1:002:1 -2 0
ffff8996454f4e40 491516534 S Bi:1:002:1 -115 16 <
ffff8996454f4e40 491537140 C Bi:1:002:1 -2 0
ffff8996454f4e40 491537273 S Bi:1:002:1 -115 16 <
ffff8996454f4e40 491557752 C Bi:1:002:1 -2 0
ffff8996454f4e40 491557876 S Bi:1:002:1 -115 16 <
ffff8996454f4e40 491578484 C Bi:1:002:1 -2 0
ffff8996454f4e40 491578634 S Bi:1:002:1 -115 16 <
ffff8996454f4e40 491599255 C Bi:1:002:1 -2 0
ffff8996454f4e40 491599376 S Bi:1:002:1 -115 16 <
ffff8996454f4e40 491619991 C Bi:1:002:1 -2 0
ffff8996454f4e40 491620156 S Bi:1:002:1 -115 16 <
ffff8996454f4e40 491640717 C Bi:1:002:1 -2 0
ffff8996454f4e40 491640852 S Bi:1:002:1 -115 16 <
ffff8996454f4e40 491661312 C Bi:1:002:1 -2 0
ffff8996454f4e40 491661427 S Bi:1:002:1 -115 16 <
ffff8996454f4e40 491681963 C Bi:1:002:1 -2 0
ffff8996454f4e40 491682070 S Bi:1:002:1 -115 16 <
ffff8996454f4e40 491702648 C Bi:1:002:1 -2 0
ffff8996454f4e40 491702772 S Bi:1:002:1 -115 16 <
ffff8996454f4e40 491723406 C Bi:1:002:1 -2 0
ffff8996454f4e40 491723542 S Bi:1:002:1 -115 16 <
ffff8996454f4e40 491744128 C Bi:1:002:1 -2 0
ffff8996454f4e40 491744270 S Bi:1:002:1 -115 16 <
ffff8996454f4e40 491764850 C Bi:1:002:1 -2 0
ffff8996454f4e40 491764971 S Bi:1:002:1 -115 16 <
ffff8996454f4e40 491785491 C Bi:1:002:1 -2 0
ffff8996454f4e40 491785596 S Bi:1:002:1 -115 16 <
ffff8996454f4e40 491806084 C Bi:1:002:1 -2 0
ffff8996454f4e40 491806201 S Bi:1:002:1 -115 16 <
ffff8996454f4e40 491826784 C Bi:1:002:1 -2 0
ffff8996454f4e40 491826932 S Bi:1:002:1 -115 16 <
ffff8996454f4e40 491847492 C Bi:1:002:1 -2 0
ffff8996454f4e40 491847605 S Bi:1:002:1 -115 16 <
ffff8996454f4e40 491868347 C Bi:1:002:1 -2 0
ffff8996454f4e40 491868481 S Bi:1:002:1 -115 16 <
ffff8996454f4e40 491888922 C Bi:1:002:1 -2 0
ffff8996454f4e40 491889027 S Bi:1:002:1 -115 16 <
ffff8996454f4e40 491909586 C Bi:1:002:1 -2 0
ffff8996454f4e40 491909717 S Bi:1:002:1 -115 16 <
ffff8996454f4e40 491930519 C Bi:1:002:1 -2 0
ffff8996454f4e40 491930665 S Bi:1:002:1 -115 16 <
ffff8996454f4e40 491951291 C Bi:1:002:1 -2 0
ffff8996454f4e40 491951442 S Bi:1:002:1 -115 16 <
ffff8996454f4e40 491972094 C Bi:1:002:1 -2 0
ffff8996454f4e40 491972236 S Bi:1:002:1 -115 16 <
ffff8996454f4e40 491992770 C Bi:1:002:1 -2 0
ffff8996454f4e40 491992963 S Bi:1:002:1 -115 16 <
ffff8996454f4e40 492013594 C Bi:1:002:1 -2 0
ffff8996454f4e40 492013732 S Bi:1:002:1 -115 16 <
ffff8996454f4e40 492034374 C Bi:1:002:1 -2 0
ffff8996454f4e40 492034511 S Bi:1:002:1 -115 16 <
ffff8996454f4e40 492055000 C Bi:1:002:1 -2 0
ffff8996454f4e40 492055135 S Bi:1:002:1 -115 16 <
ffff8996454f4e40 492075674 C Bi:1:002:1 -2 0
ffff8996876c8d80 492075870 S Bi:1:002:1 -115 16 <
ffff8996876c8d80 492096431 C Bi:1:002:1 -2 0
ffff8996876c8d80 492096569 S Bi:1:002:1 -115 16 <
ffff8996876c8d80 492117027 C Bi:1:002:1 -2 0
ffff8996876c8d80 492117140 S Bi:1:002:1 -115 16 <
ffff8996876c8d80 492137703 C Bi:1:002:1 -2 0
ffff8996876c8d80 492137819 S Bi:1:002:1 -115 16 <
ffff8996876c8d80 492158355 C Bi:1:002:1 -2 0
ffff8996876c8d80 492158485 S Bi:1:002:1 -115 16 <
ffff8996876c8d80 492179037 C Bi:1:002:1 -2 0
ffff8996876c8d80 492179179 S Bi:1:002:1 -115 16 <
ffff8996876c8d80 492199804 C Bi:1:002:1 -2 0
ffff8996876c8d80 492199923 S Bi:1:002:1 -115 16 <
ffff8996876c8d80 492220401 C Bi:1:002:1 -2 0
ffff8996876c8d80 492220530 S Bi:1:002:1 -115 16 <
ffff8996876c8d80 492241072 C Bi:1:002:1 -2 0
ffff8996876c8d80 492241190 S Bi:1:002:1 -115 16 <
ffff8996876c8d80 492261690 C Bi:1:002:1 -2 0
ffff8996876c8d80 492261846 S Bi:1:002:1 -115 16 <
ffff8996876c8d80 492282582 C Bi:1:002:1 -2 0
ffff8996876c8d80 492282753 S Bi:1:002:1 -115 16 <
ffff8996876c8d80 492303553 C Bi:1:002:1 -2 0
ffff8996876c8d80 492303724 S Bi:1:002:1 -115 16 <
ffff8996876c8d80 492324308 C Bi:1:002:1 -2 0
ffff8996876c8d80 492324481 S Bi:1:002:1 -115 16 <
ffff8996876c8d80 492345149 C Bi:1:002:1 -2 0
ffff8996876c8d80 492345326 S Bi:1:002:1 -115 16 <
ffff8996876c8d80 492366051 C Bi:1:002:1 -2 0
ffff8996876c8d80 492366182 S Bi:1:002:1 -115 16 <
ffff8996876c8d80 492386950 C Bi:1:002:1 -2 0
ffff8996876c8d80 492387085 S Bi:1:002:1 -115 16 <
ffff8996876c8d80 492407800 C Bi:1:002:1 -2 0
ffff8996876c8d80 492407960 S Bi:1:002:1 -115 16 <
ffff8996876c8d80 492428743 C Bi:1:002:1 -2 0
ffff8996876c8d80 492428915 S Bi:1:002:1 -115 16 <
ffff8996876c8d80 492449607 C Bi:1:002:1 -2 0
ffff8996876c8d80 492449739 S Bi:1:002:1 -115 16 <
ffff8996876c8d80 492470530 C Bi:1:002:1 -2 0
ffff8996876c8d80 492470687 S Bi:1:002:1 -115 16 <
ffff8996876c8d80 492491365 C Bi:1:002:1 -2 0
ffff8996876c8d80 492491519 S Bi:1:002:1 -115 16 <
ffff8996876c8d80 492512126 C Bi:1:002:1 -2 0
ffff8996876c8d80 492512242 S Bi:1:002:1 -115 16 <
ffff8996876c8d80 492532904 C Bi:1:002:1 -2 0
ffff8996876c8d80 492533029 S Bi:1:002:1 -115 16 <
ffff8996876c8d80 492553534 C Bi:1:002:1 -2 0
ffff8996876c8d80 492553645 S Bi:1:002:1 -115 16 <
ffff8996876c8d80 492574150 C Bi:1:002:1 -2 0
ffff8996876c8d80 492575198 S Bo:1:002:2 -115 13 = 900b646d 6573677c 7461696c 0a
ffff8996876c8d80 492575573 C Bo:1:002:2 0 13 >
ffff8996876c8d80 492576992 S Bi:1:002:1 -115 16 <
ffff8996876c8d80 492579587 C Bi:1:002:1 0 6 = 90045b20 2033
ffff8996454f4780 492581622 S Bi:1:002:1 -115 16 <
ffff8996454f4780 492582681 C Bi:1:002:1 0 6 = 90043339 2e37
ffff8996454f4780 492584098 S Bi:1:002:1 -115 16 <
ffff8996454f4780 492585846 C Bi:1:002:1 0 6 = 90043032 3837
ffff8996454f4780 492587321 S Bi:1:002:1 -115 16 <
ffff8996454f4780 492589081 C Bi:1:002:1 0 6 = 9004375d 2065
ffff8996454f4780 492590605 S Bi:1:002:1 -115 16 <
ffff8996454f4780 492592279 C Bi:1:002:1 0 6 = 90047564 3a20
ffff8996454f4780 492593687 S Bi:1:002:1 -115 16 <
ffff8996454f4780 492595559 C Bi:1:002:1 0 6 = 90047278 2066
ffff8996454f4780 492596973 S Bi:1:002:1 -115 16 <
ffff8996454f4780 492598663 C Bi:1:002:1 0 6 = 90047261 6d65
ffff8996454f4780 492600568 S Bi:1:002:1 -115 16 <
ffff8996454f4780 492601858 C Bi:1:002:1 0 6 = 9004206c 656e
ffff8996454f4780 492603184 S Bi:1:002:1 -115 16 <
ffff8996454f4780 492605046 C Bi:1:002:1 0 6 = 90043d31 3120
ffff8996454f4780 492606524 S Bi:1:002:1 -115 16 <
ffff8996454f4780 492608257 C Bi:1:002:1 0 6 = 90046461 7461
ffff8996454f4780 492609974 S Bi:1:002:1 -115 16 <
ffff8996454f4780 492611472 C Bi:1:002:1 0 6 = 90043d36 3420
ffff8996454f4780 492613004 S Bi:1:002:1 -115 16 <
ffff8996454f4780 492614664 C Bi:1:002:1 0 6 = 90043664 2036
ffff8996454f4780 492617876 S Bi:1:002:1 -115 16 <
ffff8996454f4780 492618260 C Bi:1:002:1 0 6 = 90043520 3733
ffff8996454f4780 492619927 S Bi:1:002:1 -115 16 <
ffff8996454f4780 492621054 C Bi:1:002:1 0 6 = 90042036 3720
ffff8996454f4780 492622689 S Bi:1:002:1 -115 16 <
ffff8996454f4780 492624323 C Bi:1:002:1 0 6 = 90043763 2037
ffff8996454f4780 492625950 S Bi:1:002:1 -115 16 <
ffff8996454f4780 492627461 C Bi:1:002:1 0 6 = 90043420 3631
ffff8996876c8d80 492629039 S Bi:1:002:1 -115 16 <
ffff8996876c8d80 492630664 C Bi:1:002:1 0 6 = 90042036 3920
ffff8996876c8d80 492632135 S Bi:1:002:1 -115 16 <
ffff8996876c8d80 492633877 C Bi:1:002:1 0 6 = 90043663 2030
ffff8996876c8d80 492635286 S Bi:1:002:1 -115 16 <
ffff8996876c8d80 492637063 C Bi:1:002:1 0 6 = 90046120 7331
ffff8996876c8d80 492639468 S Bi:1:002:1 -115 16 <
ffff8996876c8d80 492640425 C Bi:1:002:1 0 6 = 90045f61 6674
ffff8996876c8d80 492641932 S Bi:1:002:1 -115 16 <
ffff8996876c8d80 492643479 C Bi:1:002:1 0 6 = 90046572 3d30
ffff8996876c8d80 492645120 S Bi:1:002:1 -115 16 <
ffff8996876c8d80 492646656 C Bi:1:002:1 0 6 = 90043630 3630
ffff8996876c8d80 492647984 S Bi:1:002:1 -115 16 <
ffff8996876c8d80 492649899 C Bi:1:002:1 0 6 = 90043630 360a
ffff8996876c8d80 492651222 S Bi:1:002:1 -115 16 <
ffff8996876c8d80 492655671 C Bi:1:002:1 0 6 = 9004646d 6573
ffff8996876c8d80 492657054 S Bi:1:002:1 -115 16 <
ffff8996876c8d80 492658936 C Bi:1:002:1 0 6 = 9004677c 7461
ffff8996876c8d80 492660342 S Bi:1:002:1 -115 16 <
ffff8996876c8d80 492662134 C Bi:1:002:1 0 6 = 9004696c 0d0a
ffff8996876c8d80 492663703 S Bi:1:002:1 -115 16 <
ffff8996876c8d80 492677308 C Bi:1:002:1 0 6 = 90045b20 2020
ffff8996876c8d80 492678978 S Bi:1:002:1 -115 16 <
ffff8996876c8d80 492680468 C Bi:1:002:1 0 6 = 90043334 2e30
ffff8996876c8d80 492681794 S Bi:1:002:1 -115 16 <
ffff8996876c8d80 492683694 C Bi:1:002:1 0 6 = 90043630 3836
ffff8996876c8d80 492685409 S Bi:1:002:1 -115 16 <
ffff8996876c8d80 492686957 C Bi:1:002:1 0 6 = 9004395d 2073
ffff8996876c8d80 492688518 S Bi:1:002:1 -115 16 <
ffff8996876c8d80 492690142 C Bi:1:002:1 0 6 = 90046420 303a
ffff8996876c8d80 492691613 S Bi:1:002:1 -115 16 <
ffff8996876c8d80 492693315 C Bi:1:002:1 0 6 = 9004303a 303a
ffff8996876c8d80 492694993 S Bi:1:002:1 -115 16 <
ffff8996876c8d80 492696587 C Bi:1:002:1 0 6 = 9004323a 205b
ffff8996876c8d80 492698332 S Bi:1:002:1 -115 16 <
ffff8996876c8d80 492699824 C Bi:1:002:1 0 6 = 90047364 635d
ffff8996876c8d80 492701684 S Bi:1:002:1 -115 16 <
ffff8996876c8d80 492702941 C Bi:1:002:1 0 6 = 90042041 7474
ffff8996876c8d80 492704512 S Bi:1:002:1 -115 16 <
ffff8996876c8d80 492706183 C Bi:1:002:1 0 6 = 90046163 6865
ffff8996876c8d80 492707697 S Bi:1:002:1 -115 16 <
ffff8996876c8d80 492709379 C Bi:1:002:1 0 6 = 90046420 5343
ffff8996876c8d80 492710827 S Bi:1:002:1 -115 16 <
ffff8996876c8d80 492712550 C Bi:1:002:1 0 6 = 90045349 2064
ffff8996876c8d80 492713825 S Bi:1:002:1 -115 16 <
ffff8996876c8d80 492715754 C Bi:1:002:1 0 6 = 90046973 6b0d
ffff8996876c8d80 492717263 S Bi:1:002:1 -115 16 <
ffff8996876c8d80 492719066 C Bi:1:002:1 0 6 = 90040a5b 2020
ffff8996876c8d80 492720585 S Bi:1:002:1 -115 16 <
ffff8996876c8d80 492722209 C Bi:1:002:1 0 6 = 90042033 342e
ffff8996876c8d80 492723713 S Bi:1:002:1 -115 16 <
ffff8996876c8d80 492725344 C Bi:1:002:1 0 6 = 90043036 3334
ffff8996876c8d80 492726718 S Bi:1:002:1 -115 16 <
ffff8996876c8d80 492728601 C Bi:1:002:1 0 6 = 90043737 5d20
ffff8996876c8d80 492729969 S Bi:1:002:1 -115 16 <
ffff8996876c8d80 492731886 C Bi:1:002:1 0 6 = 90042073 6466
ffff8996876c8d80 492733586 S Bi:1:002:1 -115 16 <
ffff8996876c8d80 492734977 C Bi:1:002:1 0 6 = 90043a20 7364
ffff8996876c8d80 492736326 S Bi:1:002:1 -115 16 <
ffff8996876c8d80 492738214 C Bi:1:002:1 0 6 = 90046631 2073
ffff8996876c8d80 492739727 S Bi:1:002:1 -115 16 <
ffff8996876c8d80 492741371 C Bi:1:002:1 0 6 = 90046466 3220
ffff8996876c8d80 492742926 S Bi:1:002:1 -115 16 <
ffff8996876c8d80 492744594 C Bi:1:002:1 0 6 = 90047364 6633
ffff8996876c8d80 492746052 S Bi:1:002:1 -115 16 <
ffff8996876c8d80 492747788 C Bi:1:002:1 0 6 = 90042073 6466
ffff8996876c8d80 492749166 S Bi:1:002:1 -115 16 <
ffff8996876c8d80 492751009 C Bi:1:002:1 0 6 = 90043420 7364
ffff8996876c8d80 492752529 S Bi:1:002:1 -115 16 <
ffff8996876c8d80 492754221 C Bi:1:002:1 0 6 = 90046635 2073
ffff8996876c8d80 492755555 S Bi:1:002:1 -115 16 <
ffff8996876c8d80 492757429 C Bi:1:002:1 0 6 = 90046466 3620
ffff8996876c8d80 492759044 S Bi:1:002:1 -115 16 <
ffff8996876c8d80 492761148 C Bi:1:002:1 0 6 = 90047364 6637
ffff8996876c8d80 492763072 S Bi:1:002:1 -115 16 <
ffff8996876c8d80 492763966 C Bi:1:002:1 0 6 = 90042073 6466
ffff8996876c8d80 492765807 S Bi:1:002:1 -115 16 <
ffff8996876c8d80 492767123 C Bi:1:002:1 0 6 = 90043820 7364
ffff8996876c8d80 492768755 S Bi:1:002:1 -115 16 <
ffff8996876c8d80 492770243 C Bi:1:002:1 0 6 = 90046639 2073
ffff8996876c8d80 492771629 S Bi:1:002:1 -115 16 <
ffff8996876c8d80 492773446 C Bi:1:002:1 0 6 = 90046466 3130
ffff8996876c8d80 492774800 S Bi:1:002:1 -115 16 <
ffff8996876c8d80 492776721 C Bi:1:002:1 0 6 = 90042073 6466
ffff8996876c8d80 492778468 S Bi:1:002:1 -115 16 <
ffff8996876c8d80 492779866 C Bi:1:002:1 0 6 = 90043131 2073
ffff8996876c8d80 492781418 S Bi:1:002:1 -115 16 <
ffff8996876c8d80 492783063 C Bi:1:002:1 0 6 = 90046466 3132
ffff8996876c8d80 492785006 S Bi:1:002:1 -115 16 <
ffff8996876c8d80 492786324 C Bi:1:002:1 0 6 = 90040d0a 5b20
ffff8996876c8d80 492788618 S Bi:1:002:1 -115 16 <
ffff8996876c8d80 492789514 C Bi:1:002:1 0 6 = 90042020 3334
ffff8996876c8d80 492790790 S Bi:1:002:1 -115 16 <
ffff8996876c8d80 492792688 C Bi:1:002:1 0 6 = 90042e31 3738
ffff8996876c8d80 492794124 S Bi:1:002:1 -115 16 <
ffff8996876c8d80 492795930 C Bi:1:002:1 0 6 = 90043233 345d
ffff8996876c8d80 492797797 S Bi:1:002:1 -115 16 <
ffff8996876c8d80 492799097 C Bi:1:002:1 0 6 = 90042073 6420
ffff8996876c8d80 492800549 S Bi:1:002:1 -115 16 <
ffff8996876c8d80 492802272 C Bi:1:002:1 0 6 = 9004303a 303a
ffff8996876c8d80 492803695 S Bi:1:002:1 -115 16 <
ffff8996876c8d80 492805464 C Bi:1:002:1 0 6 = 9004303a 353a
ffff8996876c8d80 492807323 S Bi:1:002:1 -115 16 <
ffff8996876c8d80 492808838 C Bi:1:002:1 0 6 = 9004205b 7364
ffff8996876c8d80 492810262 S Bi:1:002:1 -115 16 <
ffff8996876c8d80 492811888 C Bi:1:002:1 0 6 = 9004665d 2041
ffff8996876c8d80 492813356 S Bi:1:002:1 -115 16 <
ffff8996876c8d80 492815173 C Bi:1:002:1 0 6 = 90047474 6163
ffff8996876c8d80 492816547 S Bi:1:002:1 -115 16 <
ffff8996876c8d80 492818377 C Bi:1:002:1 0 6 = 90046865 6420
ffff8996876c8d80 492819949 S Bi:1:002:1 -115 16 <
ffff8996876c8d80 492821493 C Bi:1:002:1 0 6 = 90045343 5349
ffff8996876c8d80 492823176 S Bi:1:002:1 -115 16 <
ffff8996876c8d80 492824750 C Bi:1:002:1 0 6 = 90042064 6973
ffff8996876c8d80 492826273 S Bi:1:002:1 -115 16 <
ffff8996876c8d80 492827985 C Bi:1:002:1 0 6 = 90046b0d 0a5b
ffff8996876c8d80 492829584 S Bi:1:002:1 -115 16 <
ffff8996876c8d80 492831122 C Bi:1:002:1 0 6 = 90042020 2033
ffff8996876c8d80 492832492 S Bi:1:002:1 -115 16 <
ffff8996876c8d80 492834387 C Bi:1:002:1 0 6 = 9004342e 3236
ffff8996876c8d80 492835653 S Bi:1:002:1 -115 16 <
ffff8996876c8d80 492837663 C Bi:1:002:1 0 6 = 90043039 3632
ffff8996876c8d80 492839197 S Bi:1:002:1 -115 16 <
ffff8996876c8d80 492840771 C Bi:1:002:1 0 6 = 90045d20 2073
ffff8996876c8d80 492841997 S Bi:1:002:1 -115 16 <
ffff8996876c8d80 492843947 C Bi:1:002:1 0 6 = 90046465 3a20
ffff8996876c8d80 492845392 S Bi:1:002:1 -115 16 <
ffff8996876c8d80 492847140 C Bi:1:002:1 0 6 = 90047364 6531
ffff8996876c8d80 492848613 S Bi:1:002:1 -115 16 <
ffff8996876c8d80 492850341 C Bi:1:002:1 0 6 = 90042073 6465
ffff8996876c8d80 492851650 S Bi:1:002:1 -115 16 <
ffff8996876c8d80 492853529 C Bi:1:002:1 0 6 = 90043220 7364
ffff8996876c8d80 492855005 S Bi:1:002:1 -115 16 <
ffff8996876c8d80 492856803 C Bi:1:002:1 0 6 = 90046533 2073
ffff8996876c8d80 492858440 S Bi:1:002:1 -115 16 <
ffff8996876c8d80 492859972 C Bi:1:002:1 0 6 = 90046465 3420
ffff8996876c8d80 492861529 S Bi:1:002:1 -115 16 <
ffff8996876c8d80 492863197 C Bi:1:002:1 0 6 = 90047364 6535
ffff8996876c8d80 492864882 S Bi:1:002:1 -115 16 <
ffff8996876c8d80 492866409 C Bi:1:002:1 0 6 = 90042073 6465
ffff8996876c8d80 492868290 S Bi:1:002:1 -115 16 <
ffff8996876c8d80 492869612 C Bi:1:002:1 0 6 = 90043620 7364
ffff8996876c8d80 492871113 S Bi:1:002:1 -115 16 <
ffff8996876c8d80 492872778 C Bi:1:002:1 0 6 = 90046537 2073
ffff8996876c8d80 492874356 S Bi:1:002:1 -115 16 <
ffff8996876c8d80 492875981 C Bi:1:002:1 0 6 = 90046465 3820
ffff8996876c8d80 492877524 S Bi:1:002:1 -115 16 <
ffff8996876c8d80 492879215 C Bi:1:002:1 0 6 = 90047364 6539
ffff8996876c8d80 492880604 S Bi:1:002:1 -115 16 <
ffff8996876c8d80 492882409 C Bi:1:002:1 0 6 = 90042073 6465
ffff8996876c8d80 492883955 S Bi:1:002:1 -115 16 <
ffff8996876c8d80 492885616 C Bi:1:002:1 0 6 = 90043130 2073
ffff8996876c8d80 492887103 S Bi:1:002:1 -115 16 <
ffff8996876c8d80 492888809 C Bi:1:002:1 0 6 = 90046465 3131
ffff8996876c8d80 492890270 S Bi:1:002:1 -115 16 <
ffff8996876c8d80 492892053 C Bi:1:002:1 0 6 = 90042073 6465
ffff8996876c8d80 492893955 S Bi:1:002:1 -115 16 <
ffff8996876c8d80 492895326 C Bi:1:002:1 0 6 = 90043132 2073
ffff8996876c8d80 492896890 S Bi:1:002:1 -115 16 <
ffff8996876c8d80 492898464 C Bi:1:002:1 0 6 = 90046465 3133
ffff8996876c8d80 492899931 S Bi:1:002:1 -115 16 <
ffff8996876c8d80 492901635 C Bi:1:002:1 0 6 = 90042073 6465
ffff8996876c8d80 492903141 S Bi:1:002:1 -115 16 <
ffff8996876c8d80 492904848 C Bi:1:002:1 0 6 = 90043134 2073
ffff8996876c8d80 492906236 S Bi:1:002:1 -115 16 <
ffff8996876c8d80 492908107 C Bi:1:002:1 0 6 = 90046465 3135
ffff8996876c8d80 492909591 S Bi:1:002:1 -115 16 <
ffff8996876c8d80 492911259 C Bi:1:002:1 0 6 = 90042073 6465
ffff8996876c8d80 492913019 S Bi:1:002:1 -115 16 <
ffff8996876c8d80 492914504 C Bi:1:002:1 0 6 = 90043136 2073
ffff8996876c8d80 492916204 S Bi:1:002:1 -115 16 <
ffff8996876c8d80 492917701 C Bi:1:002:1 0 6 = 90046465 3137
ffff8996876c8d80 492919410 S Bi:1:002:1 -115 16 <
ffff8996876c8d80 492920871 C Bi:1:002:1 0 6 = 90042073 6465
ffff8996876c8d80 492922541 S Bi:1:002:1 -115 16 <
ffff8996876c8d80 492924124 C Bi:1:002:1 0 6 = 90043138 2073
ffff8996876c8d80 492925397 S Bi:1:002:1 -115 16 <
ffff8996876c8d80 492927633 C Bi:1:002:1 0 6 = 90046465 3139
ffff8996876c8d80 492929570 S Bi:1:002:1 -115 16 <
ffff8996876c8d80 492930658 C Bi:1:002:1 0 6 = 90042073 6465
ffff8996876c8d80 492932555 S Bi:1:002:1 -115 16 <
ffff8996876c8d80 492933759 C Bi:1:002:1 0 6 = 90043230 2073
ffff8996876c8d80 492935282 S Bi:1:002:1 -115 16 <
ffff8996876c8d80 492936960 C Bi:1:002:1 0 6 = 90046465 3231
ffff8996876c8d80 492938774 S Bi:1:002:1 -115 16 <
ffff8996876c8d80 492940147 C Bi:1:002:1 0 6 = 90042073 6465
ffff8996876c8d80 492942102 S Bi:1:002:1 -115 16 <
ffff8996876c8d80 492943402 C Bi:1:002:1 0 6 = 90043232 2073
ffff8996876c8d80 492944887 S Bi:1:002:1 -115 16 <
ffff8996876c8d80 492946682 C Bi:1:002:1 0 6 = 90046465 3233
ffff8996876c8d80 492948136 S Bi:1:002:1 -115 16 <
ffff8996876c8d80 492949796 C Bi:1:002:1 0 6 = 90042073 6465
ffff8996876c8d80 492951239 S Bi:1:002:1 -115 16 <
ffff8996876c8d80 492952964 C Bi:1:002:1 0 6 = 90043234 2073
ffff8996876c8d80 492954437 S Bi:1:002:1 -115 16 <
ffff8996876c8d80 492956144 C Bi:1:002:1 0 6 = 90046465 3235
ffff8996876c8d80 492958231 S Bi:1:002:1 -115 16 <
ffff8996876c8d80 492959427 C Bi:1:002:1 0 6 = 90042073 6465
ffff8996876c8d80 492962060 S Bi:1:002:1 -115 16 <
ffff8996876c8d80 492962597 C Bi:1:002:1 0 6 = 90043236 2073
ffff8996876c8d80 492964238 S Bi:1:002:1 -115 16 <
ffff8996876c8d80 492965808 C Bi:1:002:1 0 6 = 90046465 3237
ffff8996876c8d80 492967223 S Bi:1:002:1 -115 16 <
ffff8996876c8d80 492968962 C Bi:1:002:1 0 6 = 90042073 6465
ffff8996876c8d80 492972236 S Bi:1:002:1 -115 16 <
ffff8996876c8d80 492972994 C Bi:1:002:1 0 6 = 90043238 2073
ffff8996876c8d80 492974549 S Bi:1:002:1 -115 16 <
ffff8996876c8d80 492975432 C Bi:1:002:1 0 6 = 90046465 3239
ffff8996876c8d80 492977053 S Bi:1:002:1 -115 16 <
ffff8996876c8d80 492978593 C Bi:1:002:1 0 6 = 90042073 6465
ffff8996876c8d80 492980337 S Bi:1:002:1 -115 16 <
ffff8996876c8d80 492981790 C Bi:1:002:1 0 6 = 90043330 2073
ffff8996876c8d80 492983664 S Bi:1:002:1 -115 16 <
ffff8996876c8d80 492985002 C Bi:1:002:1 0 6 = 90046465 3331
ffff8996876c8d80 492986341 S Bi:1:002:1 -115 16 <
ffff8996876c8d80 492988468 C Bi:1:002:1 0 6 = 90042073 6465
ffff8996876c8d80 492989839 S Bi:1:002:1 -115 16 <
ffff8996876c8d80 492991514 C Bi:1:002:1 0 6 = 90043332 2073
ffff8996876c8d80 492992877 S Bi:1:002:1 -115 16 <
ffff8996876c8d80 492994585 C Bi:1:002:1 0 6 = 90046465 3333
ffff8996876c8d80 492996294 S Bi:1:002:1 -115 16 <
ffff8996876c8d80 492997859 C Bi:1:002:1 0 6 = 90042073 6465
ffff8996876c8d80 492999252 S Bi:1:002:1 -115 16 <
ffff8996876c8d80 493001082 C Bi:1:002:1 0 6 = 90043334 2073
ffff8996876c8d80 493002628 S Bi:1:002:1 -115 16 <
ffff8996876c8d80 493004218 C Bi:1:002:1 0 6 = 90046465 3335
ffff8996876c8d80 493005554 S Bi:1:002:1 -115 16 <
ffff8996876c8d80 493007469 C Bi:1:002:1 0 6 = 90042073 6465
ffff8996876c8d80 493008831 S Bi:1:002:1 -115 16 <
ffff8996876c8d80 493010621 C Bi:1:002:1 0 6 = 90043336 2073
ffff8996876c8d80 493012132 S Bi:1:002:1 -115 16 <
ffff8996876c8d80 493013823 C Bi:1:002:1 0 6 = 90046465 3337
ffff8996876c8d80 493015174 S Bi:1:002:1 -115 16 <
ffff8996876c8d80 493017053 C Bi:1:002:1 0 6 = 90042073 6465
ffff8996876c8d80 493018850 S Bi:1:002:1 -115 16 <
ffff8996876c8d80 493020239 C Bi:1:002:1 0 6 = 90043338 2073
ffff8996876c8d80 493021559 S Bi:1:002:1 -115 16 <
ffff8996876c8d80 493023435 C Bi:1:002:1 0 6 = 90046465 3339
ffff8996876c8d80 493024928 S Bi:1:002:1 -115 16 <
ffff8996876c8d80 493026698 C Bi:1:002:1 0 6 = 90042073 6465
ffff8996876c8d80 493028498 S Bi:1:002:1 -115 16 <
ffff8996876c8d80 493029850 C Bi:1:002:1 0 6 = 90043430 0d0a
ffff8996876c8d80 493031303 S Bi:1:002:1 -115 16 <
ffff8996876c8d80 493033095 C Bi:1:002:1 0 6 = 90045b20 2020
ffff8996876c8d80 493034780 S Bi:1:002:1 -115 16 <
ffff8996876c8d80 493036387 C Bi:1:002:1 0 6 = 90043334 2e34
ffff8996876c8d80 493037976 S Bi:1:002:1 -115 16 <
ffff8996876c8d80 493039485 C Bi:1:002:1 0 6 = 90043739 3338
ffff8996876c8d80 493040994 S Bi:1:002:1 -115 16 <
ffff8996876c8d80 493042736 C Bi:1:002:1 0 6 = 9004325d 2073
ffff8996876c8d80 493044099 S Bi:1:002:1 -115 16 <
ffff8996876c8d80 493045883 C Bi:1:002:1 0 6 = 90046420 303a
ffff8996876c8d80 493047395 S Bi:1:002:1 -115 16 <
ffff8996876c8d80 493049100 C Bi:1:002:1 0 6 = 9004303a 303a
ffff8996876c8d80 493050875 S Bi:1:002:1 -115 16 <
ffff8996876c8d80 493052298 C Bi:1:002:1 0 6 = 9004343a 205b
ffff8996857b16c0 493053812 S Bi:1:002:1 -115 16 <
ffff8996857b16c0 493055535 C Bi:1:002:1 0 6 = 90047364 655d
ffff8996857b16c0 493057139 S Bi:1:002:1 -115 16 <
ffff8996857b16c0 493058692 C Bi:1:002:1 0 6 = 90042041 7474
ffff8996857b16c0 493060149 S Bi:1:002:1 -115 16 <
ffff8996857b16c0 493061940 C Bi:1:002:1 0 6 = 90046163 6865
ffff8996857b16c0 493063556 S Bi:1:002:1 -115 16 <
ffff8996857b16c0 493065195 C Bi:1:002:1 0 6 = 90046420 5343
ffff8996857b16c0 493066977 S Bi:1:002:1 -115 16 <
ffff8996857b16c0 493068362 C Bi:1:002:1 0 6 = 90045349 2064
ffff8996857b16c0 493069735 S Bi:1:002:1 -115 16 <
ffff8996857b16c0 493071523 C Bi:1:002:1 0 6 = 90046973 6b0d
ffff8996857b16c0 493073166 S Bi:1:002:1 -115 16 <
ffff8996857b16c0 493074720 C Bi:1:002:1 0 6 = 90040a5b 2020
ffff8996857b16c0 493076371 S Bi:1:002:1 -115 16 <
ffff8996857b16c0 493077931 C Bi:1:002:1 0 6 = 90042034 362e
ffff8996857b16c0 493079355 S Bi:1:002:1 -115 16 <
ffff8996857b16c0 493081193 C Bi:1:002:1 0 6 = 90043737 3838
ffff8996857b16c0 493082866 S Bi:1:002:1 -115 16 <
ffff8996857b16c0 493084358 C Bi:1:002:1 0 6 = 90043638 5d20
ffff8996857b16c0 493086586 S Bi:1:002:1 -115 16 <
ffff8996857b16c0 493087543 C Bi:1:002:1 0 6 = 90047265 6775
ffff8996876c8d80 493089172 S Bi:1:002:1 -115 16 <
ffff8996876c8d80 493090826 C Bi:1:002:1 0 6 = 90046c61 746f
ffff8996653d7f00 493092867 S Bi:1:002:1 -115 16 <
ffff8996653d7f00 493093966 C Bi:1:002:1 0 6 = 9004723a 204e
ffff8996876c8d80 493095795 S Bi:1:002:1 -115 16 <
ffff8996876c8d80 493097239 C Bi:1:002:1 0 6 = 90046f74 2064
ffff8996876c8d80 493098620 S Bi:1:002:1 -115 16 <
ffff8996876c8d80 493100351 C Bi:1:002:1 0 6 = 90046973 6162
ffff8996876c8d80 493101716 S Bi:1:002:1 -115 16 <
ffff8996876c8d80 493103554 C Bi:1:002:1 0 6 = 90046c69 6e67
ffff8996876c8d80 493105203 S Bi:1:002:1 -115 16 <
ffff8996876c8d80 493106788 C Bi:1:002:1 0 6 = 90042075 6e75
ffff8996876c8d80 493108128 S Bi:1:002:1 -115 16 <
ffff8996876c8d80 493109959 C Bi:1:002:1 0 6 = 90047365 6420
ffff8996876c8d80 493111729 S Bi:1:002:1 -115 16 <
ffff8996876c8d80 493113225 C Bi:1:002:1 0 6 = 90047265 6775
ffff8996876c8d80 493114491 S Bi:1:002:1 -115 16 <
ffff8996876c8d80 493116381 C Bi:1:002:1 0 6 = 90046c61 746f
ffff8996876c8d80 493117818 S Bi:1:002:1 -115 16 <
ffff8996876c8d80 493119579 C Bi:1:002:1 0 6 = 90047273 0d0a
ffff8996876c8d80 493121212 S Bi:1:002:1 -115 16 <
ffff8996876c8d80 493122788 C Bi:1:002:1 0 6 = 90045b20 2031
ffff8996876c8d80 493124040 S Bi:1:002:1 -115 16 <
ffff8996876c8d80 493125979 C Bi:1:002:1 0 6 = 90043338 2e35
ffff8996876c8d80 493127756 S Bi:1:002:1 -115 16 <
ffff8996876c8d80 493129301 C Bi:1:002:1 0 6 = 90043035 3533
ffff8996876c8d80 493131037 S Bi:1:002:1 -115 16 <
ffff8996876c8d80 493132486 C Bi:1:002:1 0 6 = 9004375d 2065
ffff8996876c8d80 493134383 S Bi:1:002:1 -115 16 <
ffff8996876c8d80 493135624 C Bi:1:002:1 0 6 = 90047564 3a20
ffff8996876c8d80 493137250 S Bi:1:002:1 -115 16 <
ffff8996876c8d80 493138924 C Bi:1:002:1 0 6 = 90047474 7920
ffff8996876c8d80 493140640 S Bi:1:002:1 -115 16 <
ffff8996876c8d80 493142062 C Bi:1:002:1 0 6 = 90046279 7465
ffff8996876c8d80 493143761 S Bi:1:002:1 -115 16 <
ffff8996876c8d80 493145268 C Bi:1:002:1 0 6 = 90043d31 350d
ffff8996876c8d80 493146807 S Bi:1:002:1 -115 16 <
ffff8996876c8d80 493148534 C Bi:1:002:1 0 6 = 90040a5b 2020
ffff8996876c8d80 493150165 S Bi:1:002:1 -115 16 <
ffff8996876c8d80 493151636 C Bi:1:002:1 0 6 = 90043234 302e
ffff8996876c8d80 493153248 S Bi:1:002:1 -115 16 <
ffff8996876c8d80 493154854 C Bi:1:002:1 0 6 = 90043234 3238
ffff8996876c8d80 493156216 S Bi:1:002:1 -115 16 <
ffff8996876c8d80 493158091 C Bi:1:002:1 0 6 = 90043635 5d20
ffff8996876c8d80 493160554 S Bi:1:002:1 -115 16 <
ffff8996876c8d80 493161345 C Bi:1:002:1 0 6 = 90046575 643a
ffff8996876c8d80 493162704 S Bi:1:002:1 -115 16 <
ffff8996876c8d80 493164524 C Bi:1:002:1 0 6 = 90042074 7479
ffff8996876c8d80 493166108 S Bi:1:002:1 -115 16 <
ffff8996876c8d80 493167655 C Bi:1:002:1 0 6 = 90042062 7974
ffff8996876c8d80 493169058 S Bi:1:002:1 -115 16 <
ffff8996876c8d80 493170937 C Bi:1:002:1 0 6 = 9004653d 3135
ffff8996876c8d80 493172509 S Bi:1:002:1 -115 16 <
ffff8996876c8d80 493174110 C Bi:1:002:1 0 6 = 90040d0a 5b20
ffff8996653d7f00 493175612 S Bi:1:002:1 -115 16 <
ffff8996653d7f00 493177295 C Bi:1:002:1 0 6 = 90042032 3730
ffff8996653d7f00 493178599 S Bi:1:002:1 -115 16 <
ffff8996653d7f00 493180499 C Bi:1:002:1 0 6 = 90042e37 3530
ffff8996653d7f00 493181774 S Bi:1:002:1 -115 16 <
ffff8996653d7f00 493183724 C Bi:1:002:1 0 6 = 90043836 395d
ffff8996653d7f00 493185243 S Bi:1:002:1 -115 16 <
ffff8996653d7f00 493187019 C Bi:1:002:1 0 6 = 90042065 7564
ffff8996653d7f00 493188849 S Bi:1:002:1 -115 16 <
ffff8996653d7f00 493190124 C Bi:1:002:1 0 6 = 90043a20 7278
ffff8996653d7f00 493191476 S Bi:1:002:1 -115 16 <
ffff8996653d7f00 493193320 C Bi:1:002:1 0 6 = 90042066 7261
ffff8996653d7f00 493194908 S Bi:1:002:1 -115 16 <
ffff8996653d7f00 493196727 C Bi:1:002:1 0 6 = 90046d65 206c
ffff8996653d7f00 493198463 S Bi:1:002:1 -115 16 <
ffff8996653d7f00 493199738 C Bi:1:002:1 0 6 = 9004656e 3d31
ffff8996653d7f00 493201127 S Bi:1:002:1 -115 16 <
ffff8996653d7f00 493203038 C Bi:1:002:1 0 6 = 90043020 6461
ffff8996653d7f00 493204737 S Bi:1:002:1 -115 16 <
ffff8996653d7f00 493206142 C Bi:1:002:1 0 6 = 90047461 3d36
ffff8996653d7f00 493207629 S Bi:1:002:1 -115 16 <
ffff8996653d7f00 493209332 C Bi:1:002:1 0 6 = 90043520 3633
ffff8996653d7f00 493210753 S Bi:1:002:1 -115 16 <
ffff8996653d7f00 493212567 C Bi:1:002:1 0 6 = 90042036 3820
ffff8996876c8d80 493214484 S Bi:1:002:1 -115 16 <
ffff8996876c8d80 493215733 C Bi:1:002:1 0 6 = 90043666 2032
ffff8996876c8d80 493217735 S Bi:1:002:1 -115 16 <
ffff8996876c8d80 493218988 C Bi:1:002:1 0 6 = 90043020 3532
ffff8996876c8d80 493220584 S Bi:1:002:1 -115 16 <
ffff8996876c8d80 493222167 C Bi:1:002:1 0 6 = 90042033 3420
ffff8996876c8d80 493223578 S Bi:1:002:1 -115 16 <
ffff8996876c8d80 493225377 C Bi:1:002:1 0 6 = 90043333 2034
ffff8996876c8d80 493226848 S Bi:1:002:1 -115 16 <
ffff8996876c8d80 493228563 C Bi:1:002:1 0 6 = 90043220 3061
ffff8996876c8d80 493230127 S Bi:1:002:1 -115 16 <
ffff8996876c8d80 493231769 C Bi:1:002:1 0 6 = 90042073 315f
ffff8996876c8d80 493233327 S Bi:1:002:1 -115 16 <
ffff8996876c8d80 493234978 C Bi:1:002:1 0 6 = 90046166 7465
ffff8996876c8d80 493236336 S Bi:1:002:1 -115 16 <
ffff8996876c8d80 493238234 C Bi:1:002:1 0 6 = 9004723d 3036
ffff8996876c8d80 493239761 S Bi:1:002:1 -115 16 <
ffff8996876c8d80 493241402 C Bi:1:002:1 0 6 = 90043036 3036
ffff8996876c8d80 493242826 S Bi:1:002:1 -115 16 <
ffff8996876c8d80 493244595 C Bi:1:002:1 0 6 = 90043036 0d0a
ffff8996876c8d80 493245899 S Bi:1:002:1 -115 16 <
ffff8996876c8d80 493247786 C Bi:1:002:1 0 6 = 90045b20 2033
ffff8996876c8d80 493249493 S Bi:1:002:1 -115 16 <
ffff8996876c8d80 493251001 C Bi:1:002:1 0 6 = 90043339 2e37
ffff8996876c8d80 493252310 S Bi:1:002:1 -115 16 <
ffff8996876c8d80 493254229 C Bi:1:002:1 0 6 = 90043032 3837
ffff8996876c8d80 493255587 S Bi:1:002:1 -115 16 <
ffff8996876c8d80 493257433 C Bi:1:002:1 0 6 = 9004375d 2065
ffff8996876c8d80 493258763 S Bi:1:002:1 -115 16 <
ffff8996876c8d80 493260632 C Bi:1:002:1 0 6 = 90047564 3a20
ffff8996876c8d80 493262106 S Bi:1:002:1 -115 16 <
ffff8996876c8d80 493264185 C Bi:1:002:1 0 6 = 90047278 2066
ffff8996876c8d80 493265816 S Bi:1:002:1 -115 16 <
ffff8996876c8d80 493267122 C Bi:1:002:1 0 6 = 90047261 6d65
ffff8996876c8d80 493268809 S Bi:1:002:1 -115 16 <
ffff8996876c8d80 493270235 C Bi:1:002:1 0 6 = 9004206c 656e
ffff8996876c8d80 493271523 S Bi:1:002:1 -115 16 <
ffff8996876c8d80 493273565 C Bi:1:002:1 0 6 = 90043d31 3120
ffff8996876c8d80 493275019 S Bi:1:002:1 -115 16 <
ffff8996876c8d80 493276641 C Bi:1:002:1 0 6 = 90046461 7461
ffff8996876c8d80 493278075 S Bi:1:002:1 -115 16 <
ffff8996876c8d80 493279955 C Bi:1:002:1 0 6 = 90043d36 3420
ffff8996876c8d80 493281459 S Bi:1:002:1 -115 16 <
ffff8996876c8d80 493283165 C Bi:1:002:1 0 6 = 90043664 2036
ffff8996876c8d80 493284843 S Bi:1:002:1 -115 16 <
ffff8996876c8d80 493286324 C Bi:1:002:1 0 6 = 90043520 3733
ffff8996876c8d80 493288035 S Bi:1:002:1 -115 16 <
ffff8996876c8d80 493289483 C Bi:1:002:1 0 6 = 90042036 3720
ffff8996876c8d80 493290836 S Bi:1:002:1 -115 16 <
ffff8996876c8d80 493292710 C Bi:1:002:1 0 6 = 90043763 2037
ffff8996876c8d80 493294384 S Bi:1:002:1 -115 16 <
ffff8996876c8d80 493295933 C Bi:1:002:1 0 6 = 90043420 3631
ffff8996876c8d80 493297569 S Bi:1:002:1 -115 16 <
ffff8996876c8d80 493299076 C Bi:1:002:1 0 6 = 90042036 3920
ffff8996876c8d80 493300453 S Bi:1:002:1 -115 16 <
ffff8996876c8d80 493302332 C Bi:1:002:1 0 6 = 90043663 2030
ffff8996876c8d80 493303975 S Bi:1:002:1 -115 16 <
ffff8996876c8d80 493305465 C Bi:1:002:1 0 6 = 90046120 7331
ffff8996876c8d80 493307082 S Bi:1:002:1 -115 16 <
ffff8996876c8d80 493308724 C Bi:1:002:1 0 6 = 90045f61 6674
ffff8996876c8d80 493310688 S Bi:1:002:1 -115 16 <
ffff8996876c8d80 493311941 C Bi:1:002:1 0 6 = 90046572 3d30
ffff8996876c8d80 493313566 S Bi:1:002:1 -115 16 <
ffff8996876c8d80 493315100 C Bi:1:002:1 0 6 = 90043630 3630
ffff8996876c8d80 493316539 S Bi:1:002:1 -115 16 <
ffff8996876c8d80 493318305 C Bi:1:002:1 0 6 = 90043630 360d
ffff8996876c8d80 493319846 S Bi:1:002:1 -115 16 <
ffff8996876c8d80 493321520 C Bi:1:002:1 0 6 = 90040a7e 2023
ffff8996876c8d80 493323049 S Bi:1:002:1 -115 16 <
ffff8996876c8d80 493324710 C Bi:1:002:1 0 6 = 9004201b 5b36
ffff8996876c8d80 493326126 S Bi:1:002:1 -115 16 <
ffff8996876c8d80 493327326 C Bi:1:002:1 0 3 = 90016e
ffff8996876c8d80 493329160 S Bi:1:002:1 -115 16 <
ffff8996876c8d80 493349764 C Bi:1:002:1 -2 0
ffff8996876c8d80 493349893 S Bi:1:002:1 -115 16 <
ffff8996876c8d80 493370710 C Bi:1:002:1 -2 0
ffff8996876c8d80 493370854 S Bi:1:002:1 -115 16 <
ffff8996876c8d80 493391588 C Bi:1:002:1 -2 0
ffff8996876c8d80 493391867 S Bi:1:002:1 -115 16 <
ffff8996876c8d80 493412655 C Bi:1:002:1 -2 0
ffff8996876c8d80 493412791 S Bi:1:002:1 -115 16 <
ffff8996876c8d80 493433517 C Bi:1:002:1 -2 0
ffff8996876c8d80 493433695 S Bi:1:002:1 -115 16 <
ffff8996876c8d80 493454514 C Bi:1:002:1 -2 0
ffff8996876c8d80 493454680 S Bi:1:002:1 -115 16 <
ffff8996876c8d80 493475403 C Bi:1:002:1 -2 0
ffff8996876c8d80 493475572 S Bi:1:002:1 -115 16 <
ffff8996876c8d80 493496379 C Bi:1:002:1 -2 0
ffff8996876c8d80 493496526 S Bi:1:002:1 -115 16 <
ffff8996876c8d80 493517228 C Bi:1:002:1 -2 0
ffff8996876c8d80 493517361 S Bi:1:002:1 -115 16 <
ffff8996876c8d80 493537955 C Bi:1:002:1 -2 0
ffff8996876c8d80 493538084 S Bi:1:002:1 -115 16 <
ffff8996876c8d80 493558585 C Bi:1:002:1 -2 0
ffff8996876c8d80 493558706 S Bi:1:002:1 -115 16 <
ffff8996876c8d80 493579229 C Bi:1:002:1 -2 0
ffff8996876c8d80 493579555 S Bi:1:002:1 -115 16 <
ffff8996876c8d80 493600152 C Bi:1:002:1 -2 0
ffff8996876c8d80 493600318 S Bi:1:002:1 -115 16 <
ffff8996876c8d80 493620878 C Bi:1:002:1 -2 0
ffff8996876c8d80 493621072 S Bi:1:002:1 -115 16 <
ffff8996876c8d80 493641684 C Bi:1:002:1 -2 0
ffff8996876c8d80 493641844 S Bi:1:002:1 -115 16 <
ffff8996876c8d80 493662519 C Bi:1:002:1 -2 0
ffff8996876c8d80 493662653 S Bi:1:002:1 -115 16 <
ffff8996876c8d80 493683312 C Bi:1:002:1 -2 0
ffff8996876c8d80 493683432 S Bi:1:002:1 -115 16 <
ffff8996876c8d80 493703999 C Bi:1:002:1 -2 0
ffff8996876c8d80 493704155 S Bi:1:002:1 -115 16 <
ffff8996876c8d80 493724752 C Bi:1:002:1 -2 0
ffff8996876c8d80 493724870 S Bi:1:002:1 -115 16 <
ffff8996876c8d80 493745424 C Bi:1:002:1 -2 0
ffff8996876c8d80 493745563 S Bi:1:002:1 -115 16 <
ffff8996876c8d80 493766257 C Bi:1:002:1 -2 0
ffff8996876c8d80 493766418 S Bi:1:002:1 -115 16 <
ffff8996876c8d80 493787041 C Bi:1:002:1 -2 0
ffff8996876c8d80 493787177 S Bi:1:002:1 -115 16 <
ffff8996876c8d80 493807926 C Bi:1:002:1 -2 0
ffff8996876c8d80 493808084 S Bi:1:002:1 -115 16 <
ffff8996876c8d80 493828668 C Bi:1:002:1 -2 0
ffff8996876c8d80 493828838 S Bi:1:002:1 -115 16 <
ffff8996876c8d80 493849509 C Bi:1:002:1 -2 0
ffff8996876c8d80 493849657 S Bi:1:002:1 -115 16 <
ffff8996876c8d80 493870304 C Bi:1:002:1 -2 0
ffff8996876c8d80 493870441 S Bi:1:002:1 -115 16 <
ffff8996876c8d80 493890946 C Bi:1:002:1 -2 0
ffff8996876c8d80 493891065 S Bi:1:002:1 -115 16 <
ffff8996876c8d80 493911712 C Bi:1:002:1 -2 0
ffff8996876c8d80 493911836 S Bi:1:002:1 -115 16 <
ffff8996876c8d80 493932524 C Bi:1:002:1 -2 0
ffff8996876c8d80 493932654 S Bi:1:002:1 -115 16 <
ffff8996876c8d80 493953212 C Bi:1:002:1 -2 0
ffff8996876c8d80 493953347 S Bi:1:002:1 -115 16 <
ffff8996876c8d80 493973882 C Bi:1:002:1 -2 0
ffff8996876c8d80 493974010 S Bi:1:002:1 -115 16 <
ffff8996876c8d80 493994574 C Bi:1:002:1 -2 0
ffff8996876c8d80 493994713 S Bi:1:002:1 -115 16 <
ffff8996876c8d80 494015246 C Bi:1:002:1 -2 0
ffff8996876c8d80 494015378 S Bi:1:002:1 -115 16 <
ffff8996876c8d80 494035930 C Bi:1:002:1 -2 0
ffff8996876c8d80 494036068 S Bi:1:002:1 -115 16 <
ffff8996876c8d80 494056631 C Bi:1:002:1 -2 0
ffff8996876c8d80 494056751 S Bi:1:002:1 -115 16 <
ffff8996876c8d80 494077276 C Bi:1:002:1 -2 0
ffff8996876c8d80 494077402 S Bi:1:002:1 -115 16 <
ffff8996876c8d80 494098019 C Bi:1:002:1 -2 0
ffff8996876c8d80 494098146 S Bi:1:002:1 -115 16 <
ffff8996876c8d80 494118667 C Bi:1:002:1 -2 0
ffff8996876c8d80 494118776 S Bi:1:002:1 -115 16 <
ffff8996876c8d80 494139405 C Bi:1:002:1 -2 0
ffff8996876c8d80 494140036 S Bi:1:002:1 -115 16 <
ffff8996876c8d80 494160525 C Bi:1:002:1 -2 0
ffff8996876c8d80 494160659 S Bi:1:002:1 -115 16 <
ffff8996876c8d80 494181274 C Bi:1:002:1 -2 0
ffff8996876c8d80 494181429 S Bi:1:002:1 -115 16 <
ffff8996876c8d80 494202103 C Bi:1:002:1 -2 0
ffff8996876c8d80 494202226 S Bi:1:002:1 -115 16 <
ffff8996876c8d80 494222724 C Bi:1:002:1 -2 0
ffff8996876c8d80 494222847 S Bi:1:002:1 -115 16 <
ffff8996876c8d80 494243489 C Bi:1:002:1 -2 0
ffff8996876c8d80 494243633 S Bi:1:002:1 -115 16 <
ffff8996876c8d80 494264325 C Bi:1:002:1 -2 0
ffff8996876c8d80 494264463 S Bi:1:002:1 -115 16 <
ffff8996876c8d80 494284975 C Bi:1:002:1 -2 0
ffff8996876c8d80 494285112 S Bi:1:002:1 -115 16 <
ffff8996876c8d80 494305752 C Bi:1:002:1 -2 0
ffff8996876c8d80 494305901 S Bi:1:002:1 -115 16 <
ffff8996876c8d80 494326392 C Bi:1:002:1 -2 0
ffff8996876c8d80 494326505 S Bi:1:002:1 -115 16 <
ffff8996876c8d80 494347056 C Bi:1:002:1 -2 0
ffff8996876c8d80 494347173 S Bi:1:002:1 -115 16 <
ffff8996876c8d80 494367716 C Bi:1:002:1 -2 0
ffff8996876c8d80 494367849 S Bi:1:002:1 -115 16 <
ffff8996876c8d80 494388427 C Bi:1:002:1 -2 0
ffff8996876c8d80 494388555 S Bi:1:002:1 -115 16 <
ffff8996876c8d80 494409138 C Bi:1:002:1 -2 0
ffff8996876c8d80 494409287 S Bi:1:002:1 -115 16 <
ffff8996876c8d80 494429913 C Bi:1:002:1 -2 0
ffff8996876c8d80 494430037 S Bi:1:002:1 -115 16 <
ffff8996876c8d80 494450592 C Bi:1:002:1 -2 0
ffff8996876c8d80 494450726 S Bi:1:002:1 -115 16 <
ffff8996876c8d80 494471333 C Bi:1:002:1 -2 0
ffff8996876c8d80 494471450 S Bi:1:002:1 -115 16 <
ffff8996876c8d80 494491936 C Bi:1:002:1 -2 0
ffff8996876c8d80 494492141 S Bi:1:002:1 -115 16 <
ffff8996876c8d80 494512866 C Bi:1:002:1 -2 0
ffff8996876c8d80 494512981 S Bi:1:002:1 -115 16 <
ffff8996876c8d80 494533467 C Bi:1:002:1 -2 0
ffff8996876c8d80 494533614 S Bi:1:002:1 -115 16 <
ffff8996876c8d80 494554131 C Bi:1:002:1 -2 0
ffff8996876c8d80 494554245 S Bi:1:002:1 -115 16 <
ffff8996876c8d80 494574819 C Bi:1:002:1 -2 0
ffff8996876c8d80 494574949 S Bi:1:002:1 -115 16 <
ffff8996876c8d80 494595518 C Bi:1:002:1 -2 0
ffff8996876c8d80 494595650 S Bi:1:002:1 -115 16 <
ffff8996876c8d80 494616309 C Bi:1:002:1 -2 0
ffff8996876c8d80 494616440 S Bi:1:002:1 -115 16 <
ffff8996876c8d80 494636973 C Bi:1:002:1 -2 0
ffff8996876c8d80 494637091 S Bi:1:002:1 -115 16 <
ffff8996876c8d80 494657688 C Bi:1:002:1 -2 0
