ffff8a5530c63a80 730441068 S Bi:1:023:1 -115 16 <
ffff8a5530c63a80 730441705 C Bi:1:023:1 0 6 = 90045b20 2033
ffff8a5530c63a80 730443525 S Bi:1:023:1 -115 16 <
ffff8a5530c63a80 730443901 C Bi:1:023:1 0 6 = 90046666 6666
ffff8a5530c63a80 730445751 S Bi:1:023:1 -115 16 <
ffff8a5530c63a80 730446438 C Bi:1:023:1 0 6 = 90046666 3830
ffff8a5530c63a80 730447914 S Bi:1:023:1 -115 16 <
ffff8a5530c63a80 730449636 C Bi:1:023:1 0 6 = 90043831 3930
ffff8a5530c63a80 730451176 S Bi:1:023:1 -115 16 <
ffff8a5530c63a80 730452762 C Bi:1:023:1 0 6 = 90046630 3030
ffff8a5530c63a80 730454311 S Bi:1:023:1 -115 16 <
ffff8a5530c63a80 730455378 C Bi:1:023:1 0 3 = 90010a
ffff8a5530c63a80 730457420 S Bi:1:023:1 -115 16 <
ffff8a5530c63a80 730459427 C Bi:1:023:1 0 6 = 90045b20 2033
ffff8a5530c63a80 730461059 S Bi:1:023:1 -115 16 <
ffff8a5530c63a80 730462676 C Bi:1:023:1 0 6 = 90043038 2e35
ffff8a5530c63a80 730464282 S Bi:1:023:1 -115 16 <
ffff8a5530c63a80 730465814 C Bi:1:023:1 0 6 = 90043331 3333
ffff8a5530c63a80 730467424 S Bi:1:023:1 -115 16 <
ffff8a5530c63a80 730469047 C Bi:1:023:1 0 6 = 9004325d 2043
ffff8a5530c63a80 730470680 S Bi:1:023:1 -115 16 <
ffff8a5530c63a80 730472658 C Bi:1:023:1 0 6 = 9004616c 6c20
ffff8a5530c63a80 730474597 S Bi:1:023:1 -115 16 <
ffff8a5530c63a80 730475414 C Bi:1:023:1 0 6 = 90047472 6163
ffff8a5530c63a80 730477052 S Bi:1:023:1 -115 16 <
ffff8a5530c63a80 730478484 C Bi:1:023:1 0 5 = 9003653a 0a
ffff8a5530c63a80 730480214 S Bi:1:023:1 -115 16 <
ffff8a5530c63a80 730482485 C Bi:1:023:1 0 6 = 90045b20 2033
ffff8a5530c63a80 730484124 S Bi:1:023:1 -115 16 <
ffff8a5530c63a80 730485707 C Bi:1:023:1 0 6 = 90043038 2e35
ffff8a5530c63a80 730487928 S Bi:1:023:1 -115 16 <
ffff8a5530c63a80 730488927 C Bi:1:023:1 0 6 = 90043534 3337
ffff8a5530c63a80 730490914 S Bi:1:023:1 -115 16 <
ffff8a5530c63a80 730492146 C Bi:1:023:1 0 6 = 9004395d 2020
ffff8a5530c63a80 730493755 S Bi:1:023:1 -115 16 <
ffff8a5530c63a80 730495292 C Bi:1:023:1 0 6 = 90046472 6d5f
ffff8a5530c63a80 730496963 S Bi:1:023:1 -115 16 <
ffff8a5530c63a80 730498547 C Bi:1:023:1 0 6 = 90046372 7463
ffff8a5530c63a80 730500225 S Bi:1:023:1 -115 16 <
ffff8a5530c63a80 730501676 C Bi:1:023:1 0 6 = 90045f77 6169
ffff8a5530c63a80 730503702 S Bi:1:023:1 -115 16 <
ffff8a5530c63a80 730504887 C Bi:1:023:1 0 6 = 9004745f 6f6e
ffff8a5530c63a80 730506613 S Bi:1:023:1 -115 16 <
ffff8a5530c63a80 730508175 C Bi:1:023:1 0 6 = 9004655f 7662
ffff8a5530c63a80 730509772 S Bi:1:023:1 -115 16 <
ffff8a5530c63a80 730511259 C Bi:1:023:1 0 6 = 90046c61 6e6b
ffff8a5530c63a80 730512808 S Bi:1:023:1 -115 16 <
ffff8a5530c63a80 730514476 C Bi:1:023:1 0 6 = 90042b30 7831
ffff8a5530c63a80 730516089 S Bi:1:023:1 -115 16 <
ffff8a5530c63a80 730517677 C Bi:1:023:1 0 6 = 90043963 2f30
ffff8a5530c63a80 730519799 S Bi:1:023:1 -115 16 <
ffff8a5530c63a80 730520917 C Bi:1:023:1 0 6 = 90047832 3230
ffff8a5530c63a80 730522471 S Bi:1:023:1 -115 16 <
ffff8a5530c63a80 730524225 C Bi:1:023:1 0 6 = 90042028 5029
ffff8a5530c63a80 730525777 S Bi:1:023:1 -115 16 <
ffff8a5530c63a80 730526703 C Bi:1:023:1 0 3 = 90010a
ffff8a5530c63a80 730528241 S Bi:1:023:1 -115 16 <
ffff8a5530c63a80 730530703 C Bi:1:023:1 0 6 = 90045b20 2033
ffff8a5530c63a80 730532202 S Bi:1:023:1 -115 16 <
ffff8a5530c63a80 730533951 C Bi:1:023:1 0 6 = 90043038 2e36
ffff8a5530c63a80 730536172 S Bi:1:023:1 -115 16 <
ffff8a5530c63a80 730537135 C Bi:1:023:1 0 6 = 90043032 3634
ffff8a5530c63a80 730538606 S Bi:1:023:1 -115 16 <
ffff8a5530c63a80 730540378 C Bi:1:023:1 0 6 = 9004315d 2020
ffff8a5530c63a80 730541808 S Bi:1:023:1 -115 16 <
ffff8a5530c63a80 730543502 C Bi:1:023:1 0 6 = 90046472 6d5f
ffff8a5530c63a80 730544947 S Bi:1:023:1 -115 16 <
ffff8a5530c63a80 730546747 C Bi:1:023:1 0 6 = 9004636c 6965
ffff8a5530c63a80 730548231 S Bi:1:023:1 -115 16 <
ffff8a5530c63a80 730550042 C Bi:1:023:1 0 6 = 90046e74 5f6d
ffff8a5530c63a80 730552133 S Bi:1:023:1 -115 16 <
ffff8a5530c63a80 730553140 C Bi:1:023:1 0 6 = 90046f64 6573
ffff8a5530c63a80 730555365 S Bi:1:023:1 -115 16 <
ffff8a5530c63a80 730556398 C Bi:1:023:1 0 6 = 90046574 5f77
ffff8a5530c63a80 730557818 S Bi:1:023:1 -115 16 <
ffff8a5530c63a80 730559519 C Bi:1:023:1 0 6 = 90046169 745f
ffff8a5530c63a80 730560977 S Bi:1:023:1 -115 16 <
ffff8a5530c63a80 730562711 C Bi:1:023:1 0 6 = 9004666f 725f
ffff8a5530c63a80 730564122 S Bi:1:023:1 -115 16 <
ffff8a5530c63a80 730565930 C Bi:1:023:1 0 6 = 90047662 6c61
ffff8a5530c63a80 730567783 S Bi:1:023:1 -115 16 <
ffff8a5530c63a80 730569132 C Bi:1:023:1 0 6 = 90046e6b 2b30
ffff8a5530c63a80 730570717 S Bi:1:023:1 -115 16 <
ffff8a5530c63a80 730572318 C Bi:1:023:1 0 6 = 90047836 632f
ffff8a5530c63a80 730573696 S Bi:1:023:1 -115 16 <
ffff8a5530c63a80 730575532 C Bi:1:023:1 0 6 = 90043078 3830
ffff8a5530c63a80 730576980 S Bi:1:023:1 -115 16 <
ffff8a5530c63a80 730578134 C Bi:1:023:1 0 3 = 90010a
ffff8a5530c63a80 730579674 S Bi:1:023:1 -115 16 <
ffff8a5530c63a80 730582145 C Bi:1:023:1 0 6 = 90045b20 2033
ffff8a5530c63a80 730584223 S Bi:1:023:1 -115 16 <
ffff8a5530c63a80 730585464 C Bi:1:023:1 0 6 = 90043038 2e36
ffff8a5530c63a80 730587175 S Bi:1:023:1 -115 16 <
ffff8a5530c63a80 730588613 C Bi:1:023:1 0 6 = 90043534 3131
ffff8a5530c63a80 730590104 S Bi:1:023:1 -115 16 <
ffff8a5530c63a80 730591814 C Bi:1:023:1 0 6 = 9004385d 2020
ffff8a5530c63a80 730593220 S Bi:1:023:1 -115 16 <
ffff8a5530c63a80 730595042 C Bi:1:023:1 0 6 = 90046472 6d5f
ffff8a5530c63a80 730596714 S Bi:1:023:1 -115 16 <
ffff8a5530c63a80 730598192 C Bi:1:023:1 0 6 = 90046662 5f68
ffff8a5530c63a80 730599923 S Bi:1:023:1 -115 16 <
ffff8a5530c63a80 730601477 C Bi:1:023:1 0 6 = 9004656c 7065
ffff8a5530c63a80 730603148 S Bi:1:023:1 -115 16 <
ffff8a5530c63a80 730604622 C Bi:1:023:1 0 6 = 9004725f 6461
ffff8a5530c63a80 730606302 S Bi:1:023:1 -115 16 <
ffff8a5530c63a80 730607870 C Bi:1:023:1 0 6 = 90046d61 6765
ffff8a5530c63a80 730609227 S Bi:1:023:1 -115 16 <
ffff8a5530c63a80 730611085 C Bi:1:023:1 0 6 = 90045f77 6f72
ffff8a5530c63a80 730612443 S Bi:1:023:1 -115 16 <
ffff8a5530c63a80 730614206 C Bi:1:023:1 0 6 = 90046b2b 3078
ffff8a5530c63a80 730616238 S Bi:1:023:1 -115 16 <
ffff8a5530c63a80 730617413 C Bi:1:023:1 0 6 = 90043137 342f
ffff8a5530c63a80 730618770 S Bi:1:023:1 -115 16 <
ffff8a5530c63a80 730620617 C Bi:1:023:1 0 6 = 90043078 3361
ffff8a5530c63a80 730621993 S Bi:1:023:1 -115 16 <
ffff8a5530c63a80 730623416 C Bi:1:023:1 0 4 = 9002300a
ffff8a5530c63a80 730624913 S Bi:1:023:1 -115 16 <
ffff8a5530c63a80 730627413 C Bi:1:023:1 0 6 = 90045b20 2033
ffff8a5530c63a80 730628816 S Bi:1:023:1 -115 16 <
ffff8a5530c63a80 730630745 C Bi:1:023:1 0 6 = 90043038 2e36
ffff8a5530c63a80 730632394 S Bi:1:023:1 -115 16 <
ffff8a5530c63a80 730633885 C Bi:1:023:1 0 6 = 90043939 3337
ffff8a5530c63a80 730635284 S Bi:1:023:1 -115 16 <
ffff8a5530c63a80 730637052 C Bi:1:023:1 0 6 = 9004345d 2020
ffff8a5530c63a80 730638409 S Bi:1:023:1 -115 16 <
ffff8a5530c63a80 730640281 C Bi:1:023:1 0 6 = 90047072 6f63
ffff8a5530c63a80 730641793 S Bi:1:023:1 -115 16 <
ffff8a5530c63a80 730643458 C Bi:1:023:1 0 6 = 90046573 735f
ffff8a5530c63a80 730644841 S Bi:1:023:1 -115 16 <
ffff8a5530c63a80 730646756 C Bi:1:023:1 0 6 = 90046f6e 655f
ffff8a5530c63a80 730648662 S Bi:1:023:1 -115 16 <
ffff8a5530c63a80 730649906 C Bi:1:023:1 0 6 = 9004776f 726b
ffff8a5530c63a80 730651406 S Bi:1:023:1 -115 16 <
ffff8a5530c63a80 730653065 C Bi:1:023:1 0 6 = 90042b30 7831
ffff8a5530c63a80 730654570 S Bi:1:023:1 -115 16 <
ffff8a5530c63a80 730656314 C Bi:1:023:1 0 6 = 90043838 2f30
ffff8a5530c63a80 730657752 S Bi:1:023:1 -115 16 <
ffff8a5530c63a80 730659447 C Bi:1:023:1 0 6 = 90047832 6534
ffff8a5530c63a80 730661672 S Bi:1:023:1 -115 16 <
ffff8a5530c63a80 730662118 C Bi:1:023:1 0 3 = 90010a
ffff8a5530c63a80 730663520 S Bi:1:023:1 -115 16 <
ffff8a5530c63a80 730666076 C Bi:1:023:1 0 6 = 90045b20 2033
ffff8a5530c63a80 730667527 S Bi:1:023:1 -115 16 <
ffff8a5530c63a80 730669357 C Bi:1:023:1 0 6 = 90043038 2e37
ffff8a5530c63a80 730670855 S Bi:1:023:1 -115 16 <
ffff8a5530c63a80 730672513 C Bi:1:023:1 0 6 = 90043338 3033
ffff8a5530c63a80 730673888 S Bi:1:023:1 -115 16 <
ffff8a5530c63a80 730675693 C Bi:1:023:1 0 6 = 9004345d 2020
ffff8a5530c63a80 730677490 S Bi:1:023:1 -115 16 <
ffff8a5530c63a80 730678964 C Bi:1:023:1 0 6 = 9004776f 726b
ffff8a5530c63a80 730680421 S Bi:1:023:1 -115 16 <
ffff8a5530c63a80 730682115 C Bi:1:023:1 0 6 = 90046572 5f74
ffff8a5530c63a80 730683530 S Bi:1:023:1 -115 16 <
ffff8a5530c63a80 730685333 C Bi:1:023:1 0 6 = 90046872 6561
ffff8a5530c63a80 730686853 S Bi:1:023:1 -115 16 <
ffff8a5530c63a80 730688512 C Bi:1:023:1 0 6 = 9004642b 3078
ffff8a5530c63a80 730690016 S Bi:1:023:1 -115 16 <
ffff8a5530c63a80 730691730 C Bi:1:023:1 0 6 = 90043138 632f
ffff8a5530c63a80 730693976 S Bi:1:023:1 -115 16 <
ffff8a5530c63a80 730695166 C Bi:1:023:1 0 6 = 90043078 3330
ffff8a5530c63a80 730696963 S Bi:1:023:1 -115 16 <
ffff8a5530c63a80 730697750 C Bi:1:023:1 0 4 = 9002300a
ffff8a5530c63a80 730699046 S Bi:1:023:1 -115 16 <
ffff8a5530c63a80 730701768 C Bi:1:023:1 0 6 = 90045b20 2033
ffff8a5530c63a80 730703051 S Bi:1:023:1 -115 16 <
ffff8a5530c63a80 730704939 C Bi:1:023:1 0 6 = 90043038 2e37
ffff8a5530c63a80 730706463 S Bi:1:023:1 -115 16 <
ffff8a5530c63a80 730708172 C Bi:1:023:1 0 6 = 90043733 3638
ffff8a5530c63a80 730709716 S Bi:1:023:1 -115 16 <
ffff8a5530c63a80 730711410 C Bi:1:023:1 0 6 = 9004335d 2020
ffff8a5530c63a80 730713084 S Bi:1:023:1 -115 16 <
ffff8a5530c63a80 730714564 C Bi:1:023:1 0 6 = 90046b74 6872
ffff8a5530c63a80 730716148 S Bi:1:023:1 -115 16 <
ffff8a5530c63a80 730717785 C Bi:1:023:1 0 6 = 90046561 642b
ffff8a5530c63a80 730719098 S Bi:1:023:1 -115 16 <
ffff8a5530c63a80 730721009 C Bi:1:023:1 0 6 = 90043078 3131
ffff8a5530c63a80 730722386 S Bi:1:023:1 -115 16 <
ffff8a5530c63a80 730724171 C Bi:1:023:1 0 6 = 9004382f 3078
ffff8a5530c63a80 730725614 S Bi:1:023:1 -115 16 <
ffff8a5530c63a80 730727368 C Bi:1:023:1 0 6 = 90043132 340a
ffff8a55b644ec00 730728738 S Bi:1:023:1 -115 16 <
ffff8a55b644ec00 730731394 C Bi:1:023:1 0 6 = 90045b20 2033
ffff8a55b644ec00 730732752 S Bi:1:023:1 -115 16 <
ffff8a55b644ec00 730734624 C Bi:1:023:1 0 6 = 90043038 2e38
ffff8a55b644ec00 730736117 S Bi:1:023:1 -115 16 <
ffff8a55b644ec00 730737811 C Bi:1:023:1 0 6 = 90043033 3331
ffff8a55b644ec00 730739695 S Bi:1:023:1 -115 16 <
ffff8a55b644ec00 730741019 C Bi:1:023:1 0 6 = 9004385d 2020
ffff8a55b644ec00 730742536 S Bi:1:023:1 -115 16 <
ffff8a55b644ec00 730744184 C Bi:1:023:1 0 6 = 90047265 745f
ffff8a55b644ec00 730745578 S Bi:1:023:1 -115 16 <
ffff8a55b644ec00 730747368 C Bi:1:023:1 0 6 = 90046672 6f6d
ffff8a55b644ec00 730748684 S Bi:1:023:1 -115 16 <
ffff8a55b644ec00 730750595 C Bi:1:023:1 0 6 = 90045f66 6f72
ffff8a55b644ec00 730752089 S Bi:1:023:1 -115 16 <
ffff8a55b644ec00 730753834 C Bi:1:023:1 0 6 = 90046b2b 3078
ffff8a55b644ec00 730755723 S Bi:1:023:1 -115 16 <
ffff8a55b644ec00 730757073 C Bi:1:023:1 0 6 = 90043130 2f30
ffff8a55b644ec00 730758737 S Bi:1:023:1 -115 16 <
ffff8a55b644ec00 730760237 C Bi:1:023:1 0 6 = 90047832 300a
ffff8a55b644ec00 730761730 S Bi:1:023:1 -115 16 <
ffff8a55b644ec00 730764257 C Bi:1:023:1 0 6 = 90045b20 2033
ffff8a55b644ec00 730765668 S Bi:1:023:1 -115 16 <
ffff8a55b644ec00 730767442 C Bi:1:023:1 0 6 = 90043038 2e38
ffff8a55b644ec00 730768797 S Bi:1:023:1 -115 16 <
ffff8a55b644ec00 730770728 C Bi:1:023:1 0 6 = 90043336 3136
ffff8a55b644ec00 730772275 S Bi:1:023:1 -115 16 <
ffff8a55b644ec00 730773825 C Bi:1:023:1 0 6 = 9004365d 202d
ffff8a55b644ec00 730775239 S Bi:1:023:1 -115 16 <
ffff8a55b644ec00 730777006 C Bi:1:023:1 0 6 = 90042d2d 5b20
ffff8a55b644ec00 730778385 S Bi:1:023:1 -115 16 <
ffff8a55b644ec00 730780261 C Bi:1:023:1 0 6 = 9004656e 6420
ffff8a55b644ec00 730781648 S Bi:1:023:1 -115 16 <
ffff8a55b644ec00 730783427 C Bi:1:023:1 0 6 = 90047472 6163
ffff8a55b644ec00 730784841 S Bi:1:023:1 -115 16 <
ffff8a55b644ec00 730786773 C Bi:1:023:1 0 6 = 90046520 3030
ffff8a55b644ec00 730788237 S Bi:1:023:1 -115 16 <
ffff8a55b644ec00 730789851 C Bi:1:023:1 0 6 = 90043030 3030
ffff8a55b644ec00 730791122 S Bi:1:023:1 -115 16 <
ffff8a55b644ec00 730793036 C Bi:1:023:1 0 6 = 90043030 3030
ffff8a55b644ec00 730794301 S Bi:1:023:1 -115 16 <
ffff8a55b644ec00 730796286 C Bi:1:023:1 0 6 = 90043030 3030
ffff8a55b644ec00 730797893 S Bi:1:023:1 -115 16 <
ffff8a55b644ec00 730799460 C Bi:1:023:1 0 6 = 90043030 205d
ffff8a55b644ec00 730801024 S Bi:1:023:1 -115 16 <
ffff8a55b644ec00 730802766 C Bi:1:023:1 0 6 = 90042d2d 2d0a
ffff8a55b644ec00 730804316 S Bi:1:023:1 -115 16 <
ffff8a55b644ec00 730824911 C Bi:1:023:1 -2 0
ffff8a55b644ec00 730825030 S Bi:1:023:1 -115 16 <
ffff8a55b644ec00 730845668 C Bi:1:023:1 -2 0
ffff8a55b644ec00 730845794 S Bi:1:023:1 -115 16 <
ffff8a55b644ec00 730866560 C Bi:1:023:1 -2 0
ffff8a55b644ec00 730866679 S Bi:1:023:1 -115 16 <
ffff8a55b644ec00 730887288 C Bi:1:023:1 -2 0
ffff8a55b644ec00 730887405 S Bi:1:023:1 -115 16 <
ffff8a55b644ec00 730896194 C Bi:1:023:1 0 6 = 90045b20 2033
ffff8a55b644ec00 730898043 S Bi:1:023:1 -115 16 <
ffff8a55b644ec00 730899118 C Bi:1:023:1 0 6 = 90043038 2e39
ffff8a55b644ec00 730900753 S Bi:1:023:1 -115 16 <
ffff8a55b644ec00 730902345 C Bi:1:023:1 0 6 = 90043637 3738
ffff8a55b644ec00 730903899 S Bi:1:023:1 -115 16 <
ffff8a55b644ec00 730905521 C Bi:1:023:1 0 6 = 9004375d 205b
ffff8a55b644ec00 730907083 S Bi:1:023:1 -115 16 <
ffff8a55b644ec00 730908718 C Bi:1:023:1 0 6 = 90046472 6d3a
ffff8a55b644ec00 730911116 S Bi:1:023:1 -115 16 <
ffff8a55b644ec00 730911928 C Bi:1:023:1 0 6 = 90046470 755f
ffff8a55b644ec00 730913838 S Bi:1:023:1 -115 16 <
ffff8a55b644ec00 730915179 C Bi:1:023:1 0 6 = 9004656e 636f
ffff8a55b644ec00 730916767 S Bi:1:023:1 -115 16 <
ffff8a55b644ec00 730918317 C Bi:1:023:1 0 6 = 90046465 725f
ffff8a55b644ec00 730919778 S Bi:1:023:1 -115 16 <
ffff8a55b644ec00 730921503 C Bi:1:023:1 0 6 = 90047068 7973
ffff8a55b644ec00 730923951 S Bi:1:023:1 -115 16 <
ffff8a55b644ec00 730924704 C Bi:1:023:1 0 6 = 90045f63 6d64
ffff8a55b644ec00 730927051 S Bi:1:023:1 -115 16 <
ffff8a55b644ec00 730927977 C Bi:1:023:1 0 6 = 90045f70 7265
ffff8a55b644ec00 730929525 S Bi:1:023:1 -115 16 <
ffff8a55b644ec00 730931096 C Bi:1:023:1 0 6 = 90047061 7265
ffff8a55b644ec00 730932584 S Bi:1:023:1 -115 16 <
ffff8a55b644ec00 730934312 C Bi:1:023:1 0 6 = 90045f66 6f72
ffff8a55b644ec00 730935870 S Bi:1:023:1 -115 16 <
ffff8a55b644ec00 730937492 C Bi:1:023:1 0 6 = 90045f6b 6963
ffff8a55b644ec00 730938869 S Bi:1:023:1 -115 16 <
ffff8a55b644ec00 730940944 C Bi:1:023:1 0 6 = 90046b6f 6666
ffff8a55b644ec00 730942628 S Bi:1:023:1 -115 16 <
ffff8a55b644ec00 730943967 C Bi:1:023:1 0 6 = 90045d20 2a45
ffff8a55b644ec00 730945656 S Bi:1:023:1 -115 16 <
ffff8a55b644ec00 730947150 C Bi:1:023:1 0 6 = 90045252 4f52
ffff8a55b644ec00 730948760 S Bi:1:023:1 -115 16 <
ffff8a55b644ec00 730950356 C Bi:1:023:1 0 6 = 90042a20 6661
ffff8a55b644ec00 730952137 S Bi:1:023:1 -115 16 <
ffff8a55b644ec00 730953550 C Bi:1:023:1 0 6 = 9004696c 6564
ffff8a55b644ec00 730955300 S Bi:1:023:1 -115 16 <
ffff8a55b644ec00 730957146 C Bi:1:023:1 0 6 = 90042077 6169
ffff8a55b644ec00 730959158 S Bi:1:023:1 -115 16 <
ffff8a55b644ec00 730960103 C Bi:1:023:1 0 6 = 9004745f 666f
ffff8a55b644ec00 730962705 S Bi:1:023:1 -115 16 <
ffff8a55b644ec00 730963314 C Bi:1:023:1 0 6 = 9004725f 6964
ffff8a55b644ec00 730965380 S Bi:1:023:1 -115 16 <
ffff8a55b644ec00 730966366 C Bi:1:023:1 0 6 = 90046c65 3a20
ffff8a55b644ec00 730967983 S Bi:1:023:1 -115 16 <
ffff8a55b644ec00 730969580 C Bi:1:023:1 0 6 = 90046964 3a33
ffff8a55b644ec00 730971247 S Bi:1:023:1 -115 16 <
ffff8a55b644ec00 730972810 C Bi:1:023:1 0 6 = 90043520 7265
ffff8a55b644ec00 730974536 S Bi:1:023:1 -115 16 <
ffff8a55b644ec00 730976029 C Bi:1:023:1 0 6 = 9004743a 2d31
ffff8a55b644ec00 730977575 S Bi:1:023:1 -115 16 <
ffff8a55b644ec00 730979177 C Bi:1:023:1 0 6 = 90043130 2070
ffff8a55b644ec00 730980836 S Bi:1:023:1 -115 16 <
ffff8a55b644ec00 730982374 C Bi:1:023:1 0 6 = 9004703a 300a
ffff8a55b644ec00 730984144 S Bi:1:023:1 -115 16 <
ffff8a55b644ec00 731004907 C Bi:1:023:1 -2 0
ffff8a55b644ec00 731005064 S Bi:1:023:1 -115 16 <
ffff8a55b644ec00 731025792 C Bi:1:023:1 -2 0
ffff8a55b644ec00 731025925 S Bi:1:023:1 -115 16 <
ffff8a55b644ec00 731046698 C Bi:1:023:1 -2 0
ffff8a55b644ec00 731046854 S Bi:1:023:1 -115 16 <
ffff8a55b644ec00 731067470 C Bi:1:023:1 -2 0
ffff8a55b644ec00 731067591 S Bi:1:023:1 -115 16 <
ffff8a55b644ec00 731075588 C Bi:1:023:1 0 6 = 90045b20 2033
ffff8a55b644ec00 731077130 S Bi:1:023:1 -115 16 <
ffff8a55b644ec00 731078747 C Bi:1:023:1 0 6 = 90043039 2e31
ffff8a55b644ec00 731080084 S Bi:1:023:1 -115 16 <
ffff8a55b644ec00 731081942 C Bi:1:023:1 0 6 = 90043437 3437
ffff8a55b644ec00 731083954 S Bi:1:023:1 -115 16 <
ffff8a55b644ec00 731085183 C Bi:1:023:1 0 6 = 9004315d 205b
ffff8a55b644ec00 731086638 S Bi:1:023:1 -115 16 <
ffff8a55b644ec00 731088337 C Bi:1:023:1 0 6 = 90046472 6d3a
ffff8a55b644ec00 731089829 S Bi:1:023:1 -115 16 <
ffff8a55b644ec00 731091539 C Bi:1:023:1 0 6 = 90046470 755f
ffff8a55b644ec00 731092891 S Bi:1:023:1 -115 16 <
ffff8a55b644ec00 731094831 C Bi:1:023:1 0 6 = 9004656e 636f
ffff8a55b644ec00 731096031 S Bi:1:023:1 -115 16 <
ffff8a55b644ec00 731097989 C Bi:1:023:1 0 6 = 90046465 725f
ffff8a55b644ec00 731099465 S Bi:1:023:1 -115 16 <
ffff8a55b644ec00 731101160 C Bi:1:023:1 0 6 = 90046672 616d
ffff8a55b644ec00 731102437 S Bi:1:023:1 -115 16 <
ffff8a55b644ec00 731104359 C Bi:1:023:1 0 6 = 9004655f 646f
ffff8a55b644ec00 731105655 S Bi:1:023:1 -115 16 <
ffff8a55b644ec00 731107581 C Bi:1:023:1 0 6 = 90046e65 5f74
ffff8a55b644ec00 731109111 S Bi:1:023:1 -115 16 <
ffff8a55b644ec00 731110758 C Bi:1:023:1 0 6 = 9004696d 656f
ffff8a55b644ec00 731112117 S Bi:1:023:1 -115 16 <
ffff8a55b644ec00 731113982 C Bi:1:023:1 0 6 = 90047574 3a32
ffff8a55b644ec00 731115334 S Bi:1:023:1 -115 16 <
ffff8a55b644ec00 731117173 C Bi:1:023:1 0 6 = 90043733 305d
ffff8a55b644ec00 731118781 S Bi:1:023:1 -115 16 <
ffff8a55b644ec00 731120438 C Bi:1:023:1 0 6 = 9004205b 6470
ffff8a55b644ec00 731121858 S Bi:1:023:1 -115 16 <
ffff8a55b644ec00 731123600 C Bi:1:023:1 0 6 = 90047520 6572
ffff8a55b644ec00 731124964 S Bi:1:023:1 -115 16 <
ffff8a55b644ec00 731126873 C Bi:1:023:1 0 6 = 9004726f 725d
ffff8a55b644ec00 731128281 S Bi:1:023:1 -115 16 <
ffff8a55b644ec00 731130020 C Bi:1:023:1 0 6 = 9004656e 6333
ffff8a55b644ec00 731131516 S Bi:1:023:1 -115 16 <
ffff8a55b644ec00 731133171 C Bi:1:023:1 0 6 = 90043520 6672
ffff8a55b644ec00 731134534 S Bi:1:023:1 -115 16 <
ffff8a55b644ec00 731136440 C Bi:1:023:1 0 6 = 9004616d 6520
ffff8a55b644ec00 731137908 S Bi:1:023:1 -115 16 <
ffff8a55b644ec00 731139596 C Bi:1:023:1 0 6 = 9004646f 6e65
ffff8a55b644ec00 731140933 S Bi:1:023:1 -115 16 <
ffff8a55b644ec00 731142809 C Bi:1:023:1 0 6 = 90042074 696d
ffff8a55b644ec00 731144919 S Bi:1:023:1 -115 16 <
ffff8a55b644ec00 731146030 C Bi:1:023:1 0 6 = 9004656f 7574
ffff8a55b644ec00 731147648 S Bi:1:023:1 -115 16 <
ffff8a55b644ec00 731148617 C Bi:1:023:1 0 3 = 90010a
ffff8a55b644ec00 731150100 S Bi:1:023:1 -115 16 <
ffff8a55b644ec00 731170865 C Bi:1:023:1 -2 0
ffff8a55b644ec00 731171020 S Bi:1:023:1 -115 16 <
ffff8a55b644ec00 731191785 C Bi:1:023:1 -2 0
ffff8a55b644ec00 731191956 S Bi:1:023:1 -115 16 <
ffff8a55b644ec00 731212663 C Bi:1:023:1 -2 0
ffff8a55b644ec00 731212788 S Bi:1:023:1 -115 16 <
ffff8a55b644ec00 731233448 C Bi:1:023:1 -2 0
ffff8a55b644ec00 731233571 S Bi:1:023:1 -115 16 <
ffff8a55b644ec00 731254286 C Bi:1:023:1 -2 0
ffff8a55b644ec00 731254411 S Bi:1:023:1 -115 16 <
ffff8a55b644ec00 731275109 C Bi:1:023:1 -2 0
ffff8a55b644ec00 731275230 S Bi:1:023:1 -115 16 <
ffff8a55b644ec00 731295771 C Bi:1:023:1 -2 0
ffff8a55b644ec00 731295870 S Bi:1:023:1 -115 16 <
ffff8a55b644ec00 731316474 C Bi:1:023:1 -2 0
ffff8a55b644ec00 731316608 S Bi:1:023:1 -115 16 <
ffff8a55b644ec00 731337277 C Bi:1:023:1 -2 0
ffff8a55b644ec00 731337411 S Bi:1:023:1 -115 16 <
ffff8a55b644ec00 731357962 C Bi:1:023:1 -2 0
ffff8a55b644ec00 731358078 S Bi:1:023:1 -115 16 <
ffff8a55b644ec00 731378711 C Bi:1:023:1 -2 0
ffff8a55b644ec00 731378835 S Bi:1:023:1 -115 16 <
ffff8a55b644ec00 731399483 C Bi:1:023:1 -2 0
ffff8a55b644ec00 731399588 S Bi:1:023:1 -115 16 <
ffff8a55b644ec00 731420270 C Bi:1:023:1 -2 0
ffff8a55b644ec00 731420380 S Bi:1:023:1 -115 16 <
ffff8a55b644ec00 731441136 C Bi:1:023:1 -2 0
ffff8a55b644ec00 731441313 S Bi:1:023:1 -115 16 <
ffff8a55b644ec00 731461951 C Bi:1:023:1 -2 0
ffff8a55b644ec00 731462073 S Bi:1:023:1 -115 16 <
ffff8a55b644ec00 731482801 C Bi:1:023:1 -2 0
ffff8a55b644ec00 731482920 S Bi:1:023:1 -115 16 <
ffff8a55b644ec00 731503622 C Bi:1:023:1 -2 0
ffff8a55b644ec00 731503733 S Bi:1:023:1 -115 16 <
ffff8a55b644ec00 731524552 C Bi:1:023:1 -2 0
ffff8a55b644ec00 731524665 S Bi:1:023:1 -115 16 <
ffff8a55b644ec00 731545352 C Bi:1:023:1 -2 0
ffff8a55b644ec00 731545472 S Bi:1:023:1 -115 16 <
ffff8a55b644ec00 731566427 C Bi:1:023:1 -2 0
ffff8a55b644ec00 731566533 S Bi:1:023:1 -115 16 <
ffff8a55b644ec00 731587273 C Bi:1:023:1 -2 0
ffff8a55b644ec00 731587387 S Bi:1:023:1 -115 16 <
ffff8a55b644ec00 731608246 C Bi:1:023:1 -2 0
ffff8a55b644ec00 731608388 S Bi:1:023:1 -115 16 <
ffff8a55b644ec00 731628944 C Bi:1:023:1 -2 0
ffff8a55b644ec00 731629150 S Bi:1:023:1 -115 16 <
ffff8a55b644ec00 731649914 C Bi:1:023:1 -2 0
ffff8a55b644ec00 731650050 S Bi:1:023:1 -115 16 <
ffff8a55b644ec00 731670630 C Bi:1:023:1 -2 0
ffff8a55b644ec00 731670744 S Bi:1:023:1 -115 16 <
ffff8a55b644ec00 731691393 C Bi:1:023:1 -2 0
ffff8a55b644ec00 731691487 S Bi:1:023:1 -115 16 <
ffff8a55b644ec00 731712144 C Bi:1:023:1 -2 0
ffff8a55b644ec00 731712277 S Bi:1:023:1 -115 16 <
ffff8a55b644ec00 731732945 C Bi:1:023:1 -2 0
ffff8a55b644ec00 731733073 S Bi:1:023:1 -115 16 <
ffff8a55b644ec00 731753744 C Bi:1:023:1 -2 0
ffff8a55b644ec00 731753868 S Bi:1:023:1 -115 16 <
ffff8a55b644ec00 731774459 C Bi:1:023:1 -2 0
ffff8a55b644ec00 731774574 S Bi:1:023:1 -115 16 <
ffff8a55b644ec00 731795207 C Bi:1:023:1 -2 0
ffff8a55b644ec00 731795319 S Bi:1:023:1 -115 16 <
ffff8a55b644ec00 731815971 C Bi:1:023:1 -2 0
ffff8a55b644ec00 731816184 S Bi:1:023:1 -115 16 <
ffff8a55b644ec00 731836874 C Bi:1:023:1 -2 0
ffff8a55b644ec00 731836995 S Bi:1:023:1 -115 16 <
ffff8a55b644ec00 731857750 C Bi:1:023:1 -2 0
ffff8a55b644ec00 731857888 S Bi:1:023:1 -115 16 <
ffff8a55b644ec00 731878527 C Bi:1:023:1 -2 0
ffff8a55b644ec00 731878650 S Bi:1:023:1 -115 16 <
ffff8a55b644ec00 731899279 C Bi:1:023:1 -2 0
ffff8a55b644ec00 731899400 S Bi:1:023:1 -115 16 <
ffff8a55b644ec00 731919934 C Bi:1:023:1 -2 0
ffff8a55b644ec00 731920068 S Bi:1:023:1 -115 16 <
ffff8a55b644ec00 731940728 C Bi:1:023:1 -2 0
ffff8a55b644ec00 731940862 S Bi:1:023:1 -115 16 <
ffff8a55b644ec00 731961448 C Bi:1:023:1 -2 0
ffff8a55b644ec00 731961552 S Bi:1:023:1 -115 16 <
ffff8a55b644ec00 731982109 C Bi:1:023:1 -2 0
ffff8a55b644ec00 731982197 S Bi:1:023:1 -115 16 <
ffff8a55b644ec00 732002928 C Bi:1:023:1 -2 0
ffff8a55b644ec00 732003056 S Bi:1:023:1 -115 16 <
ffff8a55b644ec00 732007875 C Bi:1:023:1 0 6 = 90045b20 2033
ffff8a55b644ec00 732009236 S Bi:1:023:1 -115 16 <
ffff8a55b644ec00 732011086 C Bi:1:023:1 0 6 = 90043130 2e30
ffff8a55b644ec00 732012555 S Bi:1:023:1 -115 16 <
ffff8a55b644ec00 732014264 C Bi:1:023:1 0 6 = 90043739 3835
ffff8a55b644ec00 732016048 S Bi:1:023:1 -115 16 <
ffff8a55b644ec00 732017472 C Bi:1:023:1 0 6 = 9004325d 202d
ffff8a55b644ec00 732018798 S Bi:1:023:1 -115 16 <
ffff8a55b644ec00 732020715 C Bi:1:023:1 0 6 = 90042d2d 2d2d
ffff8a55b644ec00 732022105 S Bi:1:023:1 -115 16 <
ffff8a55b644ec00 732023873 C Bi:1:023:1 0 6 = 90042d2d 2d2d
ffff8a55b644ec00 732025319 S Bi:1:023:1 -115 16 <
ffff8a55b644ec00 732027086 C Bi:1:023:1 0 6 = 90042d2d 2d5b
ffff8a55b644ec00 732028448 S Bi:1:023:1 -115 16 <
ffff8a55b644ec00 732030297 C Bi:1:023:1 0 6 = 90042063 7574
ffff8a55b644ec00 732032169 S Bi:1:023:1 -115 16 <
ffff8a55b644ec00 732033545 C Bi:1:023:1 0 6 = 90042068 6572
ffff8a55b644ec00 732035080 S Bi:1:023:1 -115 16 <
ffff8a55b644ec00 732036717 C Bi:1:023:1 0 6 = 90046520 5d2d
ffff8a55b644ec00 732038256 S Bi:1:023:1 -115 16 <
ffff8a55b644ec00 732039921 C Bi:1:023:1 0 6 = 90042d2d 2d2d
ffff8a55b644ec00 732041505 S Bi:1:023:1 -115 16 <
ffff8a55b644ec00 732043100 C Bi:1:023:1 0 6 = 90042d2d 2d2d
ffff8a55b644ec00 732044488 S Bi:1:023:1 -115 16 <
ffff8a55b644ec00 732046883 C Bi:1:023:1 0 6 = 90042d2d 2d0a
ffff8a55b644ec00 732048475 S Bi:1:023:1 -115 16 <
ffff8a55b644ec00 732050463 C Bi:1:023:1 0 6 = 90045b20 2033
ffff8a55b644ec00 732051967 S Bi:1:023:1 -115 16 <
ffff8a55b644ec00 732053648 C Bi:1:023:1 0 6 = 90043130 2e31
ffff8a55b644ec00 732055035 S Bi:1:023:1 -115 16 <
ffff8a55b644ec00 732056897 C Bi:1:023:1 0 6 = 90043232 3432
ffff8a55b644ec00 732058362 S Bi:1:023:1 -115 16 <
ffff8a55b644ec00 732060072 C Bi:1:023:1 0 6 = 9004345d 206d
ffff8a55b644ec00 732061506 S Bi:1:023:1 -115 16 <
ffff8a55b644ec00 732063269 C Bi:1:023:1 0 6 = 9004736d 5f64
ffff8a55b644ec00 732064907 S Bi:1:023:1 -115 16 <
ffff8a55b644ec00 732066441 C Bi:1:023:1 0 6 = 90047075 2061
ffff8a55b644ec00 732069483 S Bi:1:023:1 -115 16 <
ffff8a55b644ec00 732069848 C Bi:1:023:1 0 6 = 90046530 3130
ffff8a55b644ec00 732071301 S Bi:1:023:1 -115 16 <
ffff8a55b644ec00 732072868 C Bi:1:023:1 0 6 = 90043030 2e64
ffff8a55b644ec00 732074234 S Bi:1:023:1 -115 16 <
ffff8a55b644ec00 732076081 C Bi:1:023:1 0 6 = 90046973 706c
ffff8a55b644ec00 732077806 S Bi:1:023:1 -115 16 <
ffff8a55b644ec00 732079297 C Bi:1:023:1 0 6 = 90046179 2d63
ffff8a55b644ec00 732080783 S Bi:1:023:1 -115 16 <
ffff8a55b644ec00 732082474 C Bi:1:023:1 0 6 = 90046f6e 7472
ffff8a55b644ec00 732083826 S Bi:1:023:1 -115 16 <
ffff8a55b644ec00 732085705 C Bi:1:023:1 0 6 = 90046f6c 6c65
ffff8a55b644ec00 732087170 S Bi:1:023:1 -115 16 <
ffff8a55b644ec00 732088887 C Bi:1:023:1 0 6 = 9004723a 205b
ffff8a55b644ec00 732090392 S Bi:1:023:1 -115 16 <
ffff8a55b644ec00 732092057 C Bi:1:023:1 0 6 = 90046472 6d5d
ffff8a55b644ec00 732093790 S Bi:1:023:1 -115 16 <
ffff8a55b644ec00 732095317 C Bi:1:023:1 0 6 = 90042076 626c
ffff8a55b644ec00 732096937 S Bi:1:023:1 -115 16 <
ffff8a55b644ec00 732098486 C Bi:1:023:1 0 6 = 9004616e 6b20
ffff8a55b644ec00 732099735 S Bi:1:023:1 -115 16 <
ffff8a55b644ec00 732101670 C Bi:1:023:1 0 6 = 90047761 6974
ffff8a55b644ec00 732102886 S Bi:1:023:1 -115 16 <
ffff8a55b644ec00 732104862 C Bi:1:023:1 0 6 = 90042074 696d
ffff8a55b644ec00 732106473 S Bi:1:023:1 -115 16 <
ffff8a55b644ec00 732108104 C Bi:1:023:1 0 6 = 90046564 206f
ffff8a55b644ec00 732110129 S Bi:1:023:1 -115 16 <
ffff8a55b644ec00 732111328 C Bi:1:023:1 0 6 = 90047574 206f
ffff8a55b644ec00 732112735 S Bi:1:023:1 -115 16 <
ffff8a55b644ec00 732114465 C Bi:1:023:1 0 6 = 90046e20 6372
ffff8a55b644ec00 732115869 S Bi:1:023:1 -115 16 <
ffff8a55b644ec00 732117696 C Bi:1:023:1 0 6 = 90047463 2030
ffff8a55b644ec00 732119111 S Bi:1:023:1 -115 16 <
ffff8a55b644ec00 732120429 C Bi:1:023:1 0 3 = 90010a
ffff8a55b644ec00 732121702 S Bi:1:023:1 -115 16 <
ffff8a55b644ec00 732124552 C Bi:1:023:1 0 6 = 90045b20 2033
ffff8a55b644ec00 732126341 S Bi:1:023:1 -115 16 <
ffff8a55b644ec00 732127659 C Bi:1:023:1 0 6 = 90043130 2e31
ffff8a55b644ec00 732129186 S Bi:1:023:1 -115 16 <
ffff8a55b644ec00 732130751 C Bi:1:023:1 0 6 = 90043936 3334
ffff8a55b644ec00 732132088 S Bi:1:023:1 -115 16 <
ffff8a55b644ec00 732133960 C Bi:1:023:1 0 6 = 9004345d 2057
ffff8a55b644ec00 732135434 S Bi:1:023:1 -115 16 <
ffff8a55b644ec00 732137163 C Bi:1:023:1 0 6 = 90044152 4e49
ffff8a55b644ec00 732138455 S Bi:1:023:1 -115 16 <
ffff8a55b644ec00 732140375 C Bi:1:023:1 0 6 = 90044e47 3a20
ffff8a55b644ec00 732141806 S Bi:1:023:1 -115 16 <
ffff8a55b644ec00 732143572 C Bi:1:023:1 0 6 = 90046472 6976
ffff8a55b644ec00 732145207 S Bi:1:023:1 -115 16 <
ffff8a55b644ec00 732146768 C Bi:1:023:1 0 6 = 90046572 732f
ffff8a55b644ec00 732148077 S Bi:1:023:1 -115 16 <
ffff8a55b644ec00 732149976 C Bi:1:023:1 0 6 = 90046770 752f
ffff8a55b644ec00 732151332 S Bi:1:023:1 -115 16 <
ffff8a55b644ec00 732153162 C Bi:1:023:1 0 6 = 90046472 6d2f
ffff8a55b644ec00 732155127 S Bi:1:023:1 -115 16 <
ffff8a55b644ec00 732156438 C Bi:1:023:1 0 6 = 90046472 6d5f
ffff8a55b644ec00 732158022 S Bi:1:023:1 -115 16 <
ffff8a55b644ec00 732159693 C Bi:1:023:1 0 6 = 90047662 6c61
ffff8a55b644ec00 732161121 S Bi:1:023:1 -115 16 <
ffff8a55b644ec00 732162809 C Bi:1:023:1 0 6 = 90046e6b 2e63
ffff8a55b644ec00 732164183 S Bi:1:023:1 -115 16 <
ffff8a55b644ec00 732165983 C Bi:1:023:1 0 6 = 90043a31 3332
ffff8a55b644ec00 732167300 S Bi:1:023:1 -115 16 <
ffff8a55b644ec00 732169286 C Bi:1:023:1 0 6 = 90043920 6174
ffff8a55b644ec00 732171048 S Bi:1:023:1 -115 16 <
ffff8a55b644ec00 732172399 C Bi:1:023:1 0 6 = 90042064 726d
ffff8a55b644ec00 732173778 S Bi:1:023:1 -115 16 <
ffff8a55b644ec00 732175593 C Bi:1:023:1 0 6 = 90045f63 7274
ffff8a55b644ec00 732176918 S Bi:1:023:1 -115 16 <
ffff8a55b644ec00 732178830 C Bi:1:023:1 0 6 = 9004635f 7761
ffff8a55b644ec00 732180253 S Bi:1:023:1 -115 16 <
ffff8a55b644ec00 732181981 C Bi:1:023:1 0 6 = 90046974 5f6f
ffff8a55b644ec00 732183391 S Bi:1:023:1 -115 16 <
ffff8a55b644ec00 732185210 C Bi:1:023:1 0 6 = 90046e65 5f76
ffff8a55b644ec00 732187208 S Bi:1:023:1 -115 16 <
ffff8a55b644ec00 732188418 C Bi:1:023:1 0 6 = 9004626c 616e
ffff8a55b644ec00 732189999 S Bi:1:023:1 -115 16 <
ffff8a55b644ec00 732191601 C Bi:1:023:1 0 6 = 90046b2b 3078
ffff8a55b644ec00 732193105 S Bi:1:023:1 -115 16 <
ffff8a55b644ec00 732194824 C Bi:1:023:1 0 6 = 90043139 632f
ffff8a55b644ec00 732196327 S Bi:1:023:1 -115 16 <
ffff8a55b644ec00 732197998 C Bi:1:023:1 0 6 = 90043078 3232
ffff8a55b644ec00 732199382 S Bi:1:023:1 -115 16 <
ffff8a55b644ec00 732201181 C Bi:1:023:1 0 6 = 9004302c 2043
ffff8a55b644ec00 732203255 S Bi:1:023:1 -115 16 <
ffff8a55b644ec00 732204457 C Bi:1:023:1 0 6 = 90045055 2335
ffff8a55b644ec00 732206025 S Bi:1:023:1 -115 16 <
ffff8a55b644ec00 732207659 C Bi:1:023:1 0 6 = 90043a20 6b77
ffff8a55b644ec00 732209197 S Bi:1:023:1 -115 16 <
ffff8a55b644ec00 732210817 C Bi:1:023:1 0 6 = 90046f72 6b65
ffff8a55b644ec00 732212180 S Bi:1:023:1 -115 16 <
ffff8a55b644ec00 732214049 C Bi:1:023:1 0 6 = 9004722f 353a
ffff8a55b644ec00 732215569 S Bi:1:023:1 -115 16 <
ffff8a55b644ec00 732217305 C Bi:1:023:1 0 6 = 9004312f 3832
ffff8a559719ef00 732219186 S Bi:1:023:1 -115 16 <
ffff8a559719ef00 732219829 C Bi:1:023:1 0 3 = 90010a
ffff8a559719ef00 732221554 S Bi:1:023:1 -115 16 <
ffff8a559719ef00 732223885 C Bi:1:023:1 0 6 = 90045b20 2033
ffff8a559719ef00 732225428 S Bi:1:023:1 -115 16 <
ffff8a559719ef00 732227108 C Bi:1:023:1 0 6 = 90043130 2e32
ffff8a559719ef00 732228554 S Bi:1:023:1 -115 16 <
ffff8a559719ef00 732230272 C Bi:1:023:1 0 6 = 90043935 3838
ffff8a559719ef00 732231642 S Bi:1:023:1 -115 16 <
ffff8a559719ef00 732233490 C Bi:1:023:1 0 6 = 9004325d 204d
ffff8a559719ef00 732234929 S Bi:1:023:1 -115 16 <
ffff8a559719ef00 732236689 C Bi:1:023:1 0 6 = 90046f64 756c
ffff8a559719ef00 732238107 S Bi:1:023:1 -115 16 <
ffff8a559719ef00 732239896 C Bi:1:023:1 0 6 = 90046573 206c
ffff8a559719ef00 732241339 S Bi:1:023:1 -115 16 <
ffff8a559719ef00 732243122 C Bi:1:023:1 0 6 = 9004696e 6b65
ffff8a559719ef00 732244577 S Bi:1:023:1 -115 16 <
ffff8a559719ef00 732246291 C Bi:1:023:1 0 6 = 90046420 696e
ffff8a559719ef00 732247637 S Bi:1:023:1 -115 16 <
ffff8a559719ef00 732249197 C Bi:1:023:1 0 4 = 90023a0a
ffff8a559719ef00 732250723 S Bi:1:023:1 -115 16 <
ffff8a559719ef00 732253140 C Bi:1:023:1 0 6 = 90045b20 2033
ffff8a559719ef00 732254547 S Bi:1:023:1 -115 16 <
ffff8a559719ef00 732256354 C Bi:1:023:1 0 6 = 90043130 2e33
ffff8a559719ef00 732257786 S Bi:1:023:1 -115 16 <
ffff8a559719ef00 732259525 C Bi:1:023:1 0 6 = 90043235 3134
ffff8a559719ef00 732260962 S Bi:1:023:1 -115 16 <
ffff8a559719ef00 732262731 C Bi:1:023:1 0 6 = 9004355d 2043
ffff8a559719ef00 732264629 S Bi:1:023:1 -115 16 <
ffff8a559719ef00 732265978 C Bi:1:023:1 0 6 = 90045055 3a20
ffff8a559719ef00 732268196 S Bi:1:023:1 -115 16 <
ffff8a559719ef00 732269144 C Bi:1:023:1 0 6 = 90043520 5549
ffff8a559719ef00 732270693 S Bi:1:023:1 -115 16 <
ffff8a559719ef00 732272365 C Bi:1:023:1 0 6 = 9004443a 2030
ffff8a559719ef00 732273794 S Bi:1:023:1 -115 16 <
ffff8a559719ef00 732275536 C Bi:1:023:1 0 6 = 90042050 4944
ffff8a559719ef00 732276907 S Bi:1:023:1 -115 16 <
ffff8a559719ef00 732278749 C Bi:1:023:1 0 6 = 90043a20 3832
ffff8a559719ef00 732280752 S Bi:1:023:1 -115 16 <
ffff8a559719ef00 732281948 C Bi:1:023:1 0 6 = 90042043 6f6d
ffff8a559719ef00 732283288 S Bi:1:023:1 -115 16 <
ffff8a559719ef00 732285161 C Bi:1:023:1 0 6 = 90046d3a 206b
ffff8a559719ef00 732286518 S Bi:1:023:1 -115 16 <
ffff8a559719ef00 732288344 C Bi:1:023:1 0 6 = 9004776f 726b
ffff8a559719ef00 732289706 S Bi:1:023:1 -115 16 <
ffff8a559719ef00 732291550 C Bi:1:023:1 0 6 = 90046572 2f35
ffff8a559719ef00 732292894 S Bi:1:023:1 -115 16 <
ffff8a559719ef00 732294863 C Bi:1:023:1 0 6 = 90043a31 2054
ffff8a559719ef00 732296509 S Bi:1:023:1 -115 16 <
ffff8a559719ef00 732297983 C Bi:1:023:1 0 6 = 90046169 6e74
ffff8a559719ef00 732299306 S Bi:1:023:1 -115 16 <
ffff8a559719ef00 732301316 C Bi:1:023:1 0 6 = 90046564 3a20
ffff8a559719ef00 732302749 S Bi:1:023:1 -115 16 <
ffff8a559719ef00 732304380 C Bi:1:023:1 0 6 = 90044720 2020
ffff8a559719ef00 732305861 S Bi:1:023:1 -115 16 <
ffff8a559719ef00 732307559 C Bi:1:023:1 0 6 = 90042020 2020
ffff8a559719ef00 732309028 S Bi:1:023:1 -115 16 <
ffff8a559719ef00 732310960 C Bi:1:023:1 0 6 = 90042057 2020
ffff8a559719ef00 732312369 S Bi:1:023:1 -115 16 <
ffff8a559719ef00 732314010 C Bi:1:023:1 0 6 = 90042020 2020
ffff8a559719ef00 732315521 S Bi:1:023:1 -115 16 <
ffff8a559719ef00 732317169 C Bi:1:023:1 0 6 = 90042020 2020
ffff8a559719ef00 732318597 S Bi:1:023:1 -115 16 <
ffff8a559719ef00 732320374 C Bi:1:023:1 0 6 = 90042037 2e33
ffff8a559719ef00 732322004 S Bi:1:023:1 -115 16 <
ffff8a559719ef00 732323626 C Bi:1:023:1 0 6 = 90042e30 2d72
ffff8a559719ef00 732325102 S Bi:1:023:1 -115 16 <
ffff8a559719ef00 732326829 C Bi:1:023:1 0 6 = 90046336 2d72
ffff8a559719ef00 732328341 S Bi:1:023:1 -115 16 <
ffff8a559719ef00 732330076 C Bi:1:023:1 0 6 = 90046d78 3139
ffff8a559719ef00 732331458 S Bi:1:023:1 -115 16 <
ffff8a559719ef00 732333185 C Bi:1:023:1 0 6 = 90043331 2d73
ffff8a559719ef00 732334727 S Bi:1:023:1 -115 16 <
ffff8a559719ef00 732336412 C Bi:1:023:1 0 6 = 9004616d 7572
ffff8a559719ef00 732337794 S Bi:1:023:1 -115 16 <
ffff8a559719ef00 732339615 C Bi:1:023:1 0 6 = 90046169 2b20
ffff8a559719ef00 732341096 S Bi:1:023:1 -115 16 <
ffff8a559719ef00 732342832 C Bi:1:023:1 0 6 = 90042336 3620
ffff8a559719ef00 732345431 S Bi:1:023:1 -115 16 <
ffff8a559719ef00 732346056 C Bi:1:023:1 0 6 = 90045052 4545
ffff8a559719ef00 732347530 S Bi:1:023:1 -115 16 <
ffff8a559719ef00 732349237 C Bi:1:023:1 0 6 = 90044d50 5420
ffff8a559719ef00 732350848 S Bi:1:023:1 -115 16 <
ffff8a559719ef00 732351890 C Bi:1:023:1 0 3 = 90010a
ffff8a559719ef00 732353337 S Bi:1:023:1 -115 16 <
ffff8a559719ef00 732355865 C Bi:1:023:1 0 6 = 90045b20 2033
ffff8a559719ef00 732357291 S Bi:1:023:1 -115 16 <
ffff8a559719ef00 732359075 C Bi:1:023:1 0 6 = 90043130 2e34
ffff8a559719ef00 732360787 S Bi:1:023:1 -115 16 <
ffff8a559719ef00 732362281 C Bi:1:023:1 0 6 = 90043237 3838
ffff8a559719ef00 732363632 S Bi:1:023:1 -115 16 <
ffff8a559719ef00 732365615 C Bi:1:023:1 0 6 = 9004315d 2054
ffff8a559719ef00 732366934 S Bi:1:023:1 -115 16 <
ffff8a559719ef00 732368760 C Bi:1:023:1 0 6 = 90046169 6e74
ffff8a559719ef00 732370247 S Bi:1:023:1 -115 16 <
ffff8a559719ef00 732371875 C Bi:1:023:1 0 6 = 90046564 3a20
ffff8a559719ef00 732373215 S Bi:1:023:1 -115 16 <
ffff8a559719ef00 732375177 C Bi:1:023:1 0 6 = 90045b57 5d3d
ffff8a559719ef00 732376915 S Bi:1:023:1 -115 16 <
ffff8a559719ef00 732378290 C Bi:1:023:1 0 6 = 90045741 524e
ffff8a559719ef00 732379940 S Bi:1:023:1 -115 16 <
ffff8a559719ef00 732380895 C Bi:1:023:1 0 3 = 90010a
ffff8a559719ef00 732382197 S Bi:1:023:1 -115 16 <
ffff8a559719ef00 732384925 C Bi:1:023:1 0 6 = 90045b20 2033
ffff8a559719ef00 732386374 S Bi:1:023:1 -115 16 <
ffff8a559719ef00 732388164 C Bi:1:023:1 0 6 = 90043130 2e34
ffff8a559719ef00 732390000 S Bi:1:023:1 -115 16 <
ffff8a559719ef00 732391324 C Bi:1:023:1 0 6 = 90043536 3933
ffff8a559719ef00 732392651 S Bi:1:023:1 -115 16 <
ffff8a559719ef00 732394541 C Bi:1:023:1 0 6 = 9004335d 2048
ffff8a559719ef00 732395937 S Bi:1:023:1 -115 16 <
ffff8a559719ef00 732397733 C Bi:1:023:1 0 6 = 90046172 6477
ffff8a559719ef00 732399046 S Bi:1:023:1 -115 16 <
ffff8a559719ef00 732400915 C Bi:1:023:1 0 6 = 90046172 6520
ffff8a559719ef00 732402250 S Bi:1:023:1 -115 16 <
ffff8a559719ef00 732404229 C Bi:1:023:1 0 6 = 90046e61 6d65
ffff8a559719ef00 732406261 S Bi:1:023:1 -115 16 <
ffff8a559719ef00 732407359 C Bi:1:023:1 0 6 = 90043a20 5265
ffff8a559719ef00 732408683 S Bi:1:023:1 -115 16 <
ffff8a559719ef00 732410548 C Bi:1:023:1 0 6 = 9004616c 6d65
ffff8a559719ef00 732412041 S Bi:1:023:1 -115 16 <
ffff8a559719ef00 732413745 C Bi:1:023:1 0 6 = 90042058 3220
ffff8a559719ef00 732415192 S Bi:1:023:1 -115 16 <
ffff8a559719ef00 732416945 C Bi:1:023:1 0 6 = 90045072 6f2f
ffff8a559719ef00 732418209 S Bi:1:023:1 -115 16 <
ffff8a559719ef00 732420136 C Bi:1:023:1 0 6 = 90045832 2050
ffff8a559719ef00 732422123 S Bi:1:023:1 -115 16 <
ffff8a559719ef00 732423403 C Bi:1:023:1 0 6 = 9004726f 2c20
ffff8a559719ef00 732425226 S Bi:1:023:1 -115 16 <
ffff8a559719ef00 732426559 C Bi:1:023:1 0 6 = 90044249 4f53
ffff8a559719ef00 732428218 S Bi:1:023:1 -115 16 <
ffff8a559719ef00 732429782 C Bi:1:023:1 0 6 = 90042065 646b
ffff8a559719ef00 732431071 S Bi:1:023:1 -115 16 <
ffff8a559719ef00 732432993 C Bi:1:023:1 0 6 = 9004322d 6d73
ffff8a559719ef00 732434400 S Bi:1:023:1 -115 16 <
ffff8a559719ef00 732436182 C Bi:1:023:1 0 6 = 90046d20 6264
ffff8a559719ef00 732438189 S Bi:1:023:1 -115 16 <
ffff8a559719ef00 732439405 C Bi:1:023:1 0 6 = 90043233 6161
ffff8a559719ef00 732440848 S Bi:1:023:1 -115 16 <
ffff8a559719ef00 732442561 C Bi:1:023:1 0 6 = 90046120 4f63
ffff8a559719ef00 732443860 S Bi:1:023:1 -115 16 <
ffff8a559719ef00 732445760 C Bi:1:023:1 0 6 = 90047420 2037
ffff8a559719ef00 732447153 S Bi:1:023:1 -115 16 <
ffff8a559719ef00 732448985 C Bi:1:023:1 0 6 = 90042032 3032
ffff8a559719ef00 732450416 S Bi:1:023:1 -115 16 <
ffff8a559719ef00 732451760 C Bi:1:023:1 0 4 = 9002360a
ffff8a559719ef00 732453054 S Bi:1:023:1 -115 16 <
ffff8a559719ef00 732455840 C Bi:1:023:1 0 6 = 90045b20 2033
ffff8a559719ef00 732457244 S Bi:1:023:1 -115 16 <
ffff8a559719ef00 732459025 C Bi:1:023:1 0 6 = 90043130 2e35
ffff8a559719ef00 732460495 S Bi:1:023:1 -115 16 <
ffff8a559719ef00 732462234 C Bi:1:023:1 0 6 = 90043237 3834
ffff8a559719ef00 732463583 S Bi:1:023:1 -115 16 <
ffff8a559719ef00 732465425 C Bi:1:023:1 0 6 = 9004335d 2057
ffff8a559719ef00 732466712 S Bi:1:023:1 -115 16 <
ffff8a559719ef00 732468653 C Bi:1:023:1 0 6 = 90046f72 6b71
ffff8a559719ef00 732470443 S Bi:1:023:1 -115 16 <
ffff8a559719ef00 732471848 C Bi:1:023:1 0 6 = 90047565 7565
ffff8a559719ef00 732473180 S Bi:1:023:1 -115 16 <
ffff8a559719ef00 732475038 C Bi:1:023:1 0 6 = 90043a20 6576
ffff8a559719ef00 732476339 S Bi:1:023:1 -115 16 <
ffff8a559719ef00 732478242 C Bi:1:023:1 0 6 = 9004656e 7473
ffff8a559719ef00 732479577 S Bi:1:023:1 -115 16 <
ffff8a559719ef00 732481466 C Bi:1:023:1 0 6 = 90042064 726d
ffff8a559719ef00 732482738 S Bi:1:023:1 -115 16 <
ffff8a559719ef00 732484725 C Bi:1:023:1 0 6 = 90045f66 625f
ffff8a559719ef00 732486368 S Bi:1:023:1 -115 16 <
ffff8a559719ef00 732487952 C Bi:1:023:1 0 6 = 90046865 6c70
ffff8a559719ef00 732489518 S Bi:1:023:1 -115 16 <
ffff8a559719ef00 732491097 C Bi:1:023:1 0 6 = 90046572 5f64
ffff8a559719ef00 732492487 S Bi:1:023:1 -115 16 <
ffff8a559719ef00 732494274 C Bi:1:023:1 0 6 = 9004616d 6167
ffff8a559719ef00 732495701 S Bi:1:023:1 -115 16 <
ffff8a559719ef00 732497492 C Bi:1:023:1 0 6 = 9004655f 776f
ffff8a559719ef00 732498825 S Bi:1:023:1 -115 16 <
ffff8a559719ef00 732500512 C Bi:1:023:1 0 5 = 9003726b 0a
ffff8a559719ef00 732502262 S Bi:1:023:1 -115 16 <
ffff8a559719ef00 732504530 C Bi:1:023:1 0 6 = 90045b20 2033
ffff8a559719ef00 732505988 S Bi:1:023:1 -115 16 <
ffff8a559719ef00 732507780 C Bi:1:023:1 0 6 = 90043130 2e35
ffff8a559719ef00 732509117 S Bi:1:023:1 -115 16 <
ffff8a559719ef00 732510928 C Bi:1:023:1 0 6 = 90043736 3532
ffff8a559719ef00 732512294 S Bi:1:023:1 -115 16 <
ffff8a559719ef00 732514133 C Bi:1:023:1 0 6 = 9004355d 2070
ffff8a559719ef00 732515678 S Bi:1:023:1 -115 16 <
ffff8a559719ef00 732517368 C Bi:1:023:1 0 6 = 90047374 6174
ffff8a559719ef00 732518844 S Bi:1:023:1 -115 16 <
ffff8a559719ef00 732520558 C Bi:1:023:1 0 6 = 9004653a 2036
ffff8a559719ef00 732521849 S Bi:1:023:1 -115 16 <
ffff8a559719ef00 732523743 C Bi:1:023:1 0 6 = 90043034 3030
ffff8a559719ef00 732525184 S Bi:1:023:1 -115 16 <
ffff8a559719ef00 732526934 C Bi:1:023:1 0 6 = 90043030 3520
ffff8a559719ef00 732528333 S Bi:1:023:1 -115 16 <
ffff8a559719ef00 732530140 C Bi:1:023:1 0 6 = 9004286e 5a43
ffff8a559719ef00 732531470 S Bi:1:023:1 -115 16 <
ffff8a559719ef00 732533371 C Bi:1:023:1 0 6 = 90047620 6461
ffff8a559719ef00 732534669 S Bi:1:023:1 -115 16 <
ffff8a559719ef00 732536568 C Bi:1:023:1 0 6 = 90046966 202b
ffff8a559719ef00 732537950 S Bi:1:023:1 -115 16 <
ffff8a559719ef00 732539743 C Bi:1:023:1 0 6 = 90045041 4e20
ffff8a559719ef00 732541156 S Bi:1:023:1 -115 16 <
ffff8a559719ef00 732542941 C Bi:1:023:1 0 6 = 90042d55 414f
ffff8a559719ef00 732544318 S Bi:1:023:1 -115 16 <
ffff8a559719ef00 732546145 C Bi:1:023:1 0 6 = 9004202d 5443
ffff8a559719ef00 732547408 S Bi:1:023:1 -115 16 <
ffff8a559719ef00 732549435 C Bi:1:023:1 0 6 = 90044f20 2d44
ffff8a559719ef00 732551162 S Bi:1:023:1 -115 16 <
ffff8a559719ef00 732552571 C Bi:1:023:1 0 6 = 90044954 202d
ffff8a559719ef00 732553906 S Bi:1:023:1 -115 16 <
ffff8a559719ef00 732555757 C Bi:1:023:1 0 6 = 90045353 4253
ffff8a559719ef00 732557057 S Bi:1:023:1 -115 16 <
ffff8a559719ef00 732558944 C Bi:1:023:1 0 6 = 90042042 5459
ffff8a559719ef00 732560282 S Bi:1:023:1 -115 16 <
ffff8a559719ef00 732562172 C Bi:1:023:1 0 6 = 90045045 3d2d
ffff8a559719ef00 732564146 S Bi:1:023:1 -115 16 <
ffff8a559719ef00 732565248 C Bi:1:023:1 0 5 = 90032d29 0a
ffff8a559719ef00 732566632 S Bi:1:023:1 -115 16 <
ffff8a559719ef00 732569225 C Bi:1:023:1 0 6 = 90045b20 2033
ffff8a559719ef00 732570681 S Bi:1:023:1 -115 16 <
ffff8a559719ef00 732572422 C Bi:1:023:1 0 6 = 90043130 2e36
ffff8a559719ef00 732573793 S Bi:1:023:1 -115 16 <
ffff8a559719ef00 732575635 C Bi:1:023:1 0 6 = 90043431 3231
ffff8a559719ef00 732576983 S Bi:1:023:1 -115 16 <
ffff8a559719ef00 732578813 C Bi:1:023:1 0 6 = 9004355d 2070
ffff8a559719ef00 732580796 S Bi:1:023:1 -115 16 <
ffff8a559719ef00 732582032 C Bi:1:023:1 0 6 = 90046320 3a20
ffff8a559719ef00 732583430 S Bi:1:023:1 -115 16 <
ffff8a559719ef00 732585223 C Bi:1:023:1 0 6 = 90046472 6d5f
ffff8a559719ef00 732586609 S Bi:1:023:1 -115 16 <
ffff8a559719ef00 732588456 C Bi:1:023:1 0 6 = 90046372 7463
ffff8a559719ef00 732589845 S Bi:1:023:1 -115 16 <
ffff8a559719ef00 732591620 C Bi:1:023:1 0 6 = 90045f77 6169
ffff8a559719ef00 732592985 S Bi:1:023:1 -115 16 <
ffff8a559719ef00 732594818 C Bi:1:023:1 0 6 = 9004745f 6f6e
ffff8a559719ef00 732596899 S Bi:1:023:1 -115 16 <
ffff8a559719ef00 732598065 C Bi:1:023:1 0 6 = 9004655f 7662
ffff8a559719ef00 732599573 S Bi:1:023:1 -115 16 <
ffff8a559719ef00 732601234 C Bi:1:023:1 0 6 = 90046c61 6e6b
ffff8a559719ef00 732602629 S Bi:1:023:1 -115 16 <
ffff8a559719ef00 732604452 C Bi:1:023:1 0 6 = 90042b30 7831
ffff8a559719ef00 732605904 S Bi:1:023:1 -115 16 <
ffff8a559719ef00 732607631 C Bi:1:023:1 0 6 = 90043963 2f30
ffff8a559719ef00 732609137 S Bi:1:023:1 -115 16 <
ffff8a559719ef00 732611012 C Bi:1:023:1 0 6 = 90047832 3230
ffff8a559719ef00 732612520 S Bi:1:023:1 -115 16 <
ffff8a559719ef00 732613468 C Bi:1:023:1 0 3 = 90010a
ffff8a559719ef00 732614912 S Bi:1:023:1 -115 16 <
ffff8a559719ef00 732617488 C Bi:1:023:1 0 6 = 90045b20 2033
ffff8a559719ef00 732618848 S Bi:1:023:1 -115 16 <
ffff8a559719ef00 732620836 C Bi:1:023:1 0 6 = 90043130 2e36
ffff8a559719ef00 732622197 S Bi:1:023:1 -115 16 <
ffff8a559719ef00 732623863 C Bi:1:023:1 0 6 = 90043839 3438
ffff8a559719ef00 732625336 S Bi:1:023:1 -115 16 <
ffff8a559719ef00 732627067 C Bi:1:023:1 0 6 = 9004315d 206c
ffff8a559719ef00 732628552 S Bi:1:023:1 -115 16 <
ffff8a559719ef00 732630316 C Bi:1:023:1 0 6 = 90047220 3a20
ffff8a559719ef00 732631741 S Bi:1:023:1 -115 16 <
ffff8a559719ef00 732633479 C Bi:1:023:1 0 6 = 90046472 6d5f
ffff8a559719ef00 732634907 S Bi:1:023:1 -115 16 <
ffff8a559719ef00 732636717 C Bi:1:023:1 0 6 = 90046372 7463
ffff8a559719ef00 732638105 S Bi:1:023:1 -115 16 <
ffff8a559719ef00 732639912 C Bi:1:023:1 0 6 = 90045f77 6169
ffff8a559719ef00 732641430 S Bi:1:023:1 -115 16 <
ffff8a559719ef00 732643139 C Bi:1:023:1 0 6 = 9004745f 6f6e
ffff8a559719ef00 732644753 S Bi:1:023:1 -115 16 <
ffff8a559719ef00 732646443 C Bi:1:023:1 0 6 = 9004655f 7662
ffff8a559719ef00 732647902 S Bi:1:023:1 -115 16 <
ffff8a559719ef00 732649517 C Bi:1:023:1 0 6 = 90046c61 6e6b
ffff8a559719ef00 732651035 S Bi:1:023:1 -115 16 <
ffff8a559719ef00 732652738 C Bi:1:023:1 0 6 = 90042b30 7831
ffff8a559719ef00 732654147 S Bi:1:023:1 -115 16 <
ffff8a559719ef00 732655980 C Bi:1:023:1 0 6 = 90043963 2f30
ffff8a559719ef00 732658643 S Bi:1:023:1 -115 16 <
ffff8a559719ef00 732659315 C Bi:1:023:1 0 6 = 90047832 3230
ffff8a559719ef00 732661528 S Bi:1:023:1 -115 16 <
ffff8a559719ef00 732662141 C Bi:1:023:1 0 3 = 90010a
ffff8a559719ef00 732663917 S Bi:1:023:1 -115 16 <
ffff8a559719ef00 732665793 C Bi:1:023:1 0 6 = 90045b20 2033
ffff8a559719ef00 732667211 S Bi:1:023:1 -115 16 <
ffff8a559719ef00 732669014 C Bi:1:023:1 0 6 = 90043130 2e37
ffff8a559719ef00 732670592 S Bi:1:023:1 -115 16 <
ffff8a559719ef00 732672661 C Bi:1:023:1 0 6 = 90043337 3734
ffff8a55b644ec00 732674123 S Bi:1:023:1 -115 16 <
ffff8a55b644ec00 732675480 C Bi:1:023:1 0 6 = 9004355d 2073
ffff8a55b644ec00 732676883 S Bi:1:023:1 -115 16 <
ffff8a55b644ec00 732678579 C Bi:1:023:1 0 6 = 90047020 3a20
ffff8a55b644ec00 732679983 S Bi:1:023:1 -115 16 <
ffff8a55b644ec00 732681747 C Bi:1:023:1 0 6 = 90046666 6666
ffff8a55b644ec00 732683139 S Bi:1:023:1 -115 16 <
ffff8a55b644ec00 732685066 C Bi:1:023:1 0 6 = 90046666 6330
ffff8a55b644ec00 732686482 S Bi:1:023:1 -115 16 <
ffff8a55b644ec00 732688143 C Bi:1:023:1 0 6 = 90043832 3861
ffff8a55b644ec00 732689548 S Bi:1:023:1 -115 16 <
ffff8a55b644ec00 732691359 C Bi:1:023:1 0 6 = 90046263 3430
ffff8a55b644ec00 732692688 S Bi:1:023:1 -115 16 <
ffff8a55b644ec00 732694073 C Bi:1:023:1 0 3 = 90010a
ffff8a55b644ec00 732695626 S Bi:1:023:1 -115 16 <
ffff8a55b644ec00 732697951 C Bi:1:023:1 0 6 = 90045b20 2033
ffff8a55b644ec00 732699255 S Bi:1:023:1 -115 16 <
ffff8a55b644ec00 732701161 C Bi:1:023:1 0 6 = 90043130 2e37
ffff8a55b644ec00 732702439 S Bi:1:023:1 -115 16 <
ffff8a55b644ec00 732704495 C Bi:1:023:1 0 6 = 90043639 3938
ffff8a55b644ec00 732706199 S Bi:1:023:1 -115 16 <
ffff8a55b644ec00 732707715 C Bi:1:023:1 0 6 = 9004305d 2078
ffff8a55b644ec00 732709095 S Bi:1:023:1 -115 16 <
ffff8a55b644ec00 732710814 C Bi:1:023:1 0 6 = 90043239 3a20
ffff8a55b644ec00 732712120 S Bi:1:023:1 -115 16 <
ffff8a55b644ec00 732714037 C Bi:1:023:1 0 6 = 90046666 6666
ffff8a55b644ec00 732715473 S Bi:1:023:1 -115 16 <
ffff8a55b644ec00 732717179 C Bi:1:023:1 0 6 = 90046666 6330
ffff8a55b644ec00 732718817 S Bi:1:023:1 -115 16 <
ffff8a55b644ec00 732720414 C Bi:1:023:1 0 6 = 90043832 3861
ffff8a55b644ec00 732721767 S Bi:1:023:1 -115 16 <
ffff8a55b644ec00 732723626 C Bi:1:023:1 0 6 = 90046263 3730
ffff8a55b644ec00 732724967 S Bi:1:023:1 -115 16 <
ffff8a55b644ec00 732726779 C Bi:1:023:1 0 6 = 90042078 3238
ffff8a55b644ec00 732728106 S Bi:1:023:1 -115 16 <
ffff8a55b644ec00 732729966 C Bi:1:023:1 0 6 = 90043a20 6666
ffff8a55b644ec00 732731290 S Bi:1:023:1 -115 16 <
ffff8a55b644ec00 732733186 C Bi:1:023:1 0 6 = 90046666 6666
ffff8a55b644ec00 732735081 S Bi:1:023:1 -115 16 <
ffff8a55b644ec00 732736391 C Bi:1:023:1 0 6 = 90043830 3833
ffff8a55b644ec00 732737677 S Bi:1:023:1 -115 16 <
ffff8a55b644ec00 732739639 C Bi:1:023:1 0 6 = 90046130 6430
ffff8a55b644ec00 732740996 S Bi:1:023:1 -115 16 <
ffff8a55b644ec00 732742793 C Bi:1:023:1 0 6 = 90043030 2078
ffff8a55b644ec00 732744178 S Bi:1:023:1 -115 16 <
ffff8a55b644ec00 732746004 C Bi:1:023:1 0 6 = 90043237 3a20
ffff8a55b644ec00 732747251 S Bi:1:023:1 -115 16 <
ffff8a55b644ec00 732749455 C Bi:1:023:1 0 6 = 90046666 6666
ffff8a55b644ec00 732750822 S Bi:1:023:1 -115 16 <
ffff8a55b644ec00 732752415 C Bi:1:023:1 0 6 = 90046666 3830
ffff8a55b644ec00 732753694 S Bi:1:023:1 -115 16 <
ffff8a55b644ec00 732755593 C Bi:1:023:1 0 6 = 90043833 6130
ffff8a55b644ec00 732756899 S Bi:1:023:1 -115 16 <
ffff8a55b644ec00 732758796 C Bi:1:023:1 0 6 = 90046431 3538
ffff8a55b644ec00 732760238 S Bi:1:023:1 -115 16 <
ffff8a55b644ec00 732761412 C Bi:1:023:1 0 3 = 90010a
ffff8a55b644ec00 732762715 S Bi:1:023:1 -115 16 <
ffff8a55b644ec00 732765465 C Bi:1:023:1 0 6 = 90045b20 2033
ffff8a55b644ec00 732766797 S Bi:1:023:1 -115 16 <
ffff8a55b644ec00 732768657 C Bi:1:023:1 0 6 = 90043130 2e38
ffff8a55b644ec00 732770086 S Bi:1:023:1 -115 16 <
ffff8a55b644ec00 732771837 C Bi:1:023:1 0 6 = 90043337 3436
ffff8a55b644ec00 732773262 S Bi:1:023:1 -115 16 <
ffff8a55b644ec00 732775018 C Bi:1:023:1 0 6 = 9004385d 2078
ffff8a55b644ec00 732776360 S Bi:1:023:1 -115 16 <
ffff8a55b644ec00 732778309 C Bi:1:023:1 0 6 = 90043236 3a20
ffff8a55b644ec00 732779842 S Bi:1:023:1 -115 16 <
ffff8a55b644ec00 732781451 C Bi:1:023:1 0 6 = 90046666 6666
ffff8a55b644ec00 732782828 S Bi:1:023:1 -115 16 <
ffff8a55b644ec00 732784690 C Bi:1:023:1 0 6 = 90046666 3831
ffff8a55b644ec00 732786174 S Bi:1:023:1 -115 16 <
ffff8a55b644ec00 732787859 C Bi:1:023:1 0 6 = 90046666 3065
ffff8a55b644ec00 732789264 S Bi:1:023:1 -115 16 <
ffff8a55b644ec00 732791078 C Bi:1:023:1 0 6 = 90046137 6538
ffff8a55b644ec00 732792439 S Bi:1:023:1 -115 16 <
ffff8a55b644ec00 732794285 C Bi:1:023:1 0 6 = 90042078 3235
ffff8a55b644ec00 732795689 S Bi:1:023:1 -115 16 <
ffff8a55b644ec00 732797479 C Bi:1:023:1 0 6 = 90043a20 3030
ffff8a55b644ec00 732798952 S Bi:1:023:1 -115 16 <
ffff8a55b644ec00 732800663 C Bi:1:023:1 0 6 = 90043030 3030
ffff8a55b644ec00 732801971 S Bi:1:023:1 -115 16 <
ffff8a55b644ec00 732803855 C Bi:1:023:1 0 6 = 90043030 3030
ffff8a55b644ec00 732805151 S Bi:1:023:1 -115 16 <
ffff8a55b644ec00 732807063 C Bi:1:023:1 0 6 = 90043030 3030
ffff8a55b644ec00 732808488 S Bi:1:023:1 -115 16 <
ffff8a55b644ec00 732810292 C Bi:1:023:1 0 6 = 90043030 2078
ffff8a55b644ec00 732811606 S Bi:1:023:1 -115 16 <
ffff8a55b644ec00 732813501 C Bi:1:023:1 0 6 = 90043234 3a20
ffff8a55b644ec00 732814813 S Bi:1:023:1 -115 16 <
ffff8a55b644ec00 732816795 C Bi:1:023:1 0 6 = 90046666 6666
ffff8a55b644ec00 732818415 S Bi:1:023:1 -115 16 <
ffff8a55b644ec00 732819883 C Bi:1:023:1 0 6 = 90046666 3830
ffff8a55b644ec00 732821185 S Bi:1:023:1 -115 16 <
ffff8a55b644ec00 732823116 C Bi:1:023:1 0 6 = 90043833 3966
ffff8a55b644ec00 732824522 S Bi:1:023:1 -115 16 <
ffff8a55b644ec00 732826272 C Bi:1:023:1 0 6 = 90046234 3838
ffff8a55b644ec00 732828384 S Bi:1:023:1 -115 16 <
ffff8a55b644ec00 732828961 C Bi:1:023:1 0 3 = 90010a
ffff8a55b644ec00 732830259 S Bi:1:023:1 -115 16 <
ffff8a55b644ec00 732832918 C Bi:1:023:1 0 6 = 90045b20 2033
ffff8a55b644ec00 732834345 S Bi:1:023:1 -115 16 <
ffff8a55b644ec00 732836108 C Bi:1:023:1 0 6 = 90043130 2e39
ffff8a55b644ec00 732837420 S Bi:1:023:1 -115 16 <
ffff8a55b644ec00 732839322 C Bi:1:023:1 0 6 = 90043034 3933
ffff8a55b644ec00 732840829 S Bi:1:023:1 -115 16 <
ffff8a55b644ec00 732843044 C Bi:1:023:1 0 6 = 9004395d 2078
ffff8a55b644ec00 732844638 S Bi:1:023:1 -115 16 <
ffff8a55b644ec00 732845725 C Bi:1:023:1 0 6 = 90043233 3a20
ffff8a55b644ec00 732846986 S Bi:1:023:1 -115 16 <
ffff8a55b644ec00 732848923 C Bi:1:023:1 0 6 = 90043030 3030
ffff8a55b644ec00 732850245 S Bi:1:023:1 -115 16 <
ffff8a55b644ec00 732852109 C Bi:1:023:1 0 6 = 90043030 3030
ffff8a55b644ec00 732853526 S Bi:1:023:1 -115 16 <
ffff8a55b644ec00 732855322 C Bi:1:023:1 0 6 = 90043030 3030
ffff8a55b644ec00 732856630 S Bi:1:023:1 -115 16 <
ffff8a55b644ec00 732858573 C Bi:1:023:1 0 6 = 90043030 3061
ffff8a55b644ec00 732860020 S Bi:1:023:1 -115 16 <
ffff8a55b644ec00 732861762 C Bi:1:023:1 0 6 = 90042078 3232
ffff8a55b644ec00 732863500 S Bi:1:023:1 -115 16 <
ffff8a55b644ec00 732864945 C Bi:1:023:1 0 6 = 90043a20 3030
ffff8a55b644ec00 732866284 S Bi:1:023:1 -115 16 <
ffff8a55b644ec00 732868134 C Bi:1:023:1 0 6 = 90043030 3030
ffff8a55b644ec00 732869438 S Bi:1:023:1 -115 16 <
ffff8a55b644ec00 732871338 C Bi:1:023:1 0 6 = 90043030 3030
ffff8a55b644ec00 732872851 S Bi:1:023:1 -115 16 <
ffff8a55b644ec00 732874587 C Bi:1:023:1 0 6 = 90043030 3030
ffff8a55b644ec00 732876072 S Bi:1:023:1 -115 16 <
ffff8a55b644ec00 732877836 C Bi:1:023:1 0 6 = 90043030 2078
ffff8a55b644ec00 732879314 S Bi:1:023:1 -115 16 <
ffff8a55b644ec00 732880955 C Bi:1:023:1 0 6 = 90043231 3a20
ffff8a55b644ec00 732882351 S Bi:1:023:1 -115 16 <
ffff8a55b644ec00 732884168 C Bi:1:023:1 0 6 = 90043030 3030
ffff8a55b644ec00 732885500 S Bi:1:023:1 -115 16 <
ffff8a55b644ec00 732887345 C Bi:1:023:1 0 6 = 90043030 3030
ffff8a55b644ec00 732888761 S Bi:1:023:1 -115 16 <
ffff8a55b644ec00 732890622 C Bi:1:023:1 0 6 = 90043030 3030
ffff8a55b644ec00 732892437 S Bi:1:023:1 -115 16 <
ffff8a55b644ec00 732893935 C Bi:1:023:1 0 6 = 90043030 3030
ffff8a55b644ec00 732895415 S Bi:1:023:1 -115 16 <
ffff8a55b644ec00 732896368 C Bi:1:023:1 0 3 = 90010a
ffff8a55b644ec00 732897700 S Bi:1:023:1 -115 16 <
ffff8a55b644ec00 732900393 C Bi:1:023:1 0 6 = 90045b20 2033
ffff8a55b644ec00 732901657 S Bi:1:023:1 -115 16 <
ffff8a55b644ec00 732903634 C Bi:1:023:1 0 6 = 90043130 2e39
ffff8a55b644ec00 732905493 S Bi:1:023:1 -115 16 <
ffff8a55b644ec00 732906792 C Bi:1:023:1 0 6 = 90043732 3432
ffff8a55b644ec00 732908056 S Bi:1:023:1 -115 16 <
ffff8a55b644ec00 732910039 C Bi:1:023:1 0 6 = 9004325d 2078
ffff8a55b644ec00 732911303 S Bi:1:023:1 -115 16 <
ffff8a55b644ec00 732913206 C Bi:1:023:1 0 6 = 90043230 3a20
ffff8a55b644ec00 732914598 S Bi:1:023:1 -115 16 <
ffff8a55b644ec00 732916403 C Bi:1:023:1 0 6 = 90043030 3030
ffff8a55b644ec00 732917741 S Bi:1:023:1 -115 16 <
ffff8a55b644ec00 732919597 C Bi:1:023:1 0 6 = 90043030 3030
ffff8a55b644ec00 732921406 S Bi:1:023:1 -115 16 <
ffff8a55b644ec00 732922910 C Bi:1:023:1 0 6 = 90043030 3030
ffff8a55b644ec00 732924228 S Bi:1:023:1 -115 16 <
ffff8a55b644ec00 732926008 C Bi:1:023:1 0 6 = 90043030 3030
ffff8a55b644ec00 732927254 S Bi:1:023:1 -115 16 <
ffff8a55b644ec00 732929229 C Bi:1:023:1 0 6 = 90042078 3139
ffff8a55b644ec00 732930673 S Bi:1:023:1 -115 16 <
ffff8a55b644ec00 732932422 C Bi:1:023:1 0 6 = 90043a20 6666
ffff8a55b644ec00 732933854 S Bi:1:023:1 -115 16 <
ffff8a55b644ec00 732936069 C Bi:1:023:1 0 6 = 90046666 6666
ffff8a55b644ec00 732937593 S Bi:1:023:1 -115 16 <
ffff8a55b644ec00 732938870 C Bi:1:023:1 0 6 = 90043830 3833
ffff8a55b644ec00 732940387 S Bi:1:023:1 -115 16 <
ffff8a55b644ec00 732942038 C Bi:1:023:1 0 6 = 90046130 6430
ffff8a55b644ec00 732943343 S Bi:1:023:1 -115 16 <
ffff8a55b644ec00 732945237 C Bi:1:023:1 0 6 = 90043030 2078
ffff8a55b644ec00 732946488 S Bi:1:023:1 -115 16 <
ffff8a55b644ec00 732948427 C Bi:1:023:1 0 6 = 90043138 3a20
ffff8a55b644ec00 732949829 S Bi:1:023:1 -115 16 <
ffff8a55b644ec00 732951707 C Bi:1:023:1 0 6 = 90043030 3030
ffff8a55b644ec00 732953120 S Bi:1:023:1 -115 16 <
ffff8a55b644ec00 732954859 C Bi:1:023:1 0 6 = 90043030 3030
ffff8a55b644ec00 732956213 S Bi:1:023:1 -115 16 <
ffff8a55b644ec00 732958026 C Bi:1:023:1 0 6 = 90043030 3030
ffff8a55b644ec00 732959413 S Bi:1:023:1 -115 16 <
ffff8a55b644ec00 732961252 C Bi:1:023:1 0 6 = 90043030 3061
ffff8a55b644ec00 732962468 S Bi:1:023:1 -115 16 <
ffff8a55b644ec00 732963855 C Bi:1:023:1 0 3 = 90010a
ffff8a55b644ec00 732965209 S Bi:1:023:1 -115 16 <
ffff8a55b644ec00 732967881 C Bi:1:023:1 0 6 = 90045b20 2033
ffff8a55b644ec00 732969292 S Bi:1:023:1 -115 16 <
ffff8a55b644ec00 732971121 C Bi:1:023:1 0 6 = 90043131 2e30
ffff8a55b644ec00 732972461 S Bi:1:023:1 -115 16 <
ffff8a55b644ec00 732974279 C Bi:1:023:1 0 6 = 90043339 3931
ffff8a55b644ec00 732975546 S Bi:1:023:1 -115 16 <
ffff8a55b644ec00 732977574 C Bi:1:023:1 0 6 = 9004345d 2078
ffff8a55b644ec00 732978973 S Bi:1:023:1 -115 16 <
ffff8a55b644ec00 732980689 C Bi:1:023:1 0 6 = 90043137 3a20
ffff8a55b644ec00 732982471 S Bi:1:023:1 -115 16 <
ffff8a55b644ec00 732983934 C Bi:1:023:1 0 6 = 90043230 3734
ffff8a55b644ec00 732985570 S Bi:1:023:1 -115 16 <
ffff8a55b644ec00 732987104 C Bi:1:023:1 0 6 = 90043735 3666
ffff8a55b644ec00 732988392 S Bi:1:023:1 -115 16 <
ffff8a55b644ec00 732990307 C Bi:1:023:1 0 6 = 90043230 3634
ffff8a55b644ec00 732991594 S Bi:1:023:1 -115 16 <
ffff8a55b644ec00 732993586 C Bi:1:023:1 0 6 = 90043635 3664
ffff8a55b644ec00 732994884 S Bi:1:023:1 -115 16 <
ffff8a55b644ec00 732996695 C Bi:1:023:1 0 6 = 90042078 3136
ffff8a55b644ec00 732998567 S Bi:1:023:1 -115 16 <
ffff8a55b644ec00 732999915 C Bi:1:023:1 0 6 = 90043a20 3639
ffff8a55b644ec00 733001254 S Bi:1:023:1 -115 16 <
ffff8a55b644ec00 733003205 C Bi:1:023:1 0 6 = 90043734 3230
ffff8a55b644ec00 733004602 S Bi:1:023:1 -115 16 <
ffff8a55b644ec00 733006291 C Bi:1:023:1 0 6 = 90043734 3639
ffff8a55b644ec00 733007509 S Bi:1:023:1 -115 16 <
ffff8a55b644ec00 733009508 C Bi:1:023:1 0 6 = 90043631 3737
ffff8a55b644ec00 733010804 S Bi:1:023:1 -115 16 <
ffff8a55b644ec00 733012710 C Bi:1:023:1 0 6 = 90043230 2078
ffff8a55b644ec00 733014850 S Bi:1:023:1 -115 16 <
ffff8a55b644ec00 733015911 C Bi:1:023:1 0 6 = 90043135 3a20
ffff8a55b644ec00 733017251 S Bi:1:023:1 -115 16 <
ffff8a55b644ec00 733019108 C Bi:1:023:1 0 6 = 90043030 3030
ffff8a55b644ec00 733020440 S Bi:1:023:1 -115 16 <
ffff8a55b644ec00 733022310 C Bi:1:023:1 0 6 = 90043030 3030
ffff8a55b644ec00 733023711 S Bi:1:023:1 -115 16 <
ffff8a55b644ec00 733025512 C Bi:1:023:1 0 6 = 90043030 3030
ffff8a55b644ec00 733026744 S Bi:1:023:1 -115 16 <
ffff8a55b644ec00 733028724 C Bi:1:023:1 0 6 = 90043030 3030
ffff8a55b644ec00 733030140 S Bi:1:023:1 -115 16 <
ffff8a55b644ec00 733031310 C Bi:1:023:1 0 3 = 90010a
ffff8a55b644ec00 733032695 S Bi:1:023:1 -115 16 <
ffff8a55b644ec00 733035363 C Bi:1:023:1 0 6 = 90045b20 2033
ffff8a55b644ec00 733036630 S Bi:1:023:1 -115 16 <
ffff8a55b644ec00 733038647 C Bi:1:023:1 0 6 = 90043131 2e31
ffff8a55b644ec00 733039887 S Bi:1:023:1 -115 16 <
ffff8a55b644ec00 733041742 C Bi:1:023:1 0 6 = 90043037 3337
ffff8a55b644ec00 733043142 S Bi:1:023:1 -115 16 <
ffff8a55b644ec00 733045060 C Bi:1:023:1 0 6 = 9004395d 2078
ffff8a55b644ec00 733046404 S Bi:1:023:1 -115 16 <
ffff8a55b644ec00 733048167 C Bi:1:023:1 0 6 = 90043134 3a20
ffff8a55b644ec00 733049554 S Bi:1:023:1 -115 16 <
ffff8a55b644ec00 733051345 C Bi:1:023:1 0 6 = 90046666 6666
ffff8a5530c63a80 733052701 S Bi:1:023:1 -115 16 <
ffff8a5530c63a80 733054527 C Bi:1:023:1 0 6 = 90046666 6666
ffff8a5530c63a80 733055825 S Bi:1:023:1 -115 16 <
ffff8a5530c63a80 733057750 C Bi:1:023:1 0 6 = 90046666 6666
ffff8a5530c63a80 733059251 S Bi:1:023:1 -115 16 <
ffff8a5530c63a80 733060972 C Bi:1:023:1 0 6 = 90046666 6666
ffff8a5530c63a80 733062305 S Bi:1:023:1 -115 16 <
ffff8a5530c63a80 733064263 C Bi:1:023:1 0 6 = 90042078 3133
ffff8a5530c63a80 733065566 S Bi:1:023:1 -115 16 <
ffff8a5530c63a80 733067355 C Bi:1:023:1 0 6 = 90043a20 6666
ffff8a5530c63a80 733068698 S Bi:1:023:1 -115 16 <
ffff8a5530c63a80 733070568 C Bi:1:023:1 0 6 = 90046666 6666
ffff8a5530c63a80 733071814 S Bi:1:023:1 -115 16 <
ffff8a5530c63a80 733073782 C Bi:1:023:1 0 6 = 90046330 3831
ffff8a5530c63a80 733075222 S Bi:1:023:1 -115 16 <
ffff8a5530c63a80 733077014 C Bi:1:023:1 0 6 = 90046162 3331
ffff8a5530c63a80 733078359 S Bi:1:023:1 -115 16 <
ffff8a5530c63a80 733080184 C Bi:1:023:1 0 6 = 90046438 2078
ffff8a5530c63a80 733081473 S Bi:1:023:1 -115 16 <
ffff8a5530c63a80 733083367 C Bi:1:023:1 0 6 = 90043132 3a20
ffff8a5530c63a80 733084708 S Bi:1:023:1 -115 16 <
ffff8a5530c63a80 733086589 C Bi:1:023:1 0 6 = 90043030 3030
ffff8a5530c63a80 733087838 S Bi:1:023:1 -115 16 <
ffff8a5530c63a80 733089783 C Bi:1:023:1 0 6 = 90043030 3030
ffff8a5530c63a80 733091551 S Bi:1:023:1 -115 16 <
ffff8a5530c63a80 733092997 C Bi:1:023:1 0 6 = 90043030 3030
ffff8a5530c63a80 733094309 S Bi:1:023:1 -115 16 <
ffff8a5530c63a80 733096222 C Bi:1:023:1 0 6 = 90043065 6332
ffff8a5530c63a80 733097507 S Bi:1:023:1 -115 16 <
ffff8a5530c63a80 733098782 C Bi:1:023:1 0 3 = 90010a
ffff8a5530c63a80 733100365 S Bi:1:023:1 -115 16 <
ffff8a5530c63a80 733102814 C Bi:1:023:1 0 6 = 90045b20 2033
ffff8a5530c63a80 733104218 S Bi:1:023:1 -115 16 <
ffff8a5530c63a80 733106095 C Bi:1:023:1 0 6 = 90043131 2e31
ffff8a5530c63a80 733107508 S Bi:1:023:1 -115 16 <
ffff8a5530c63a80 733109236 C Bi:1:023:1 0 6 = 90043734 3835
ffff8a5530c63a80 733110694 S Bi:1:023:1 -115 16 <
ffff8a5530c63a80 733112406 C Bi:1:023:1 0 6 = 9004365d 2078
ffff8a5530c63a80 733113756 S Bi:1:023:1 -115 16 <
ffff8a5530c63a80 733115618 C Bi:1:023:1 0 6 = 90043131 3a20
ffff8a5530c63a80 733116886 S Bi:1:023:1 -115 16 <
ffff8a5530c63a80 733118821 C Bi:1:023:1 0 6 = 90046666 6666
ffff8a5530c63a80 733120239 S Bi:1:023:1 -115 16 <
ffff8a5530c63a80 733122059 C Bi:1:023:1 0 6 = 90046666 3830
ffff8a5530c63a80 733123560 S Bi:1:023:1 -115 16 <
ffff8a5530c63a80 733125239 C Bi:1:023:1 0 6 = 90043833 6133
ffff8a5530c63a80 733126615 S Bi:1:023:1 -115 16 <
ffff8a5530c63a80 733128425 C Bi:1:023:1 0 6 = 90046361 3430
ffff8a5530c63a80 733129736 S Bi:1:023:1 -115 16 <
ffff8a5530c63a80 733131633 C Bi:1:023:1 0 6 = 90042078 3130
ffff8a5530c63a80 733132963 S Bi:1:023:1 -115 16 <
ffff8a5530c63a80 733134826 C Bi:1:023:1 0 6 = 90043a20 6666
ffff8a5530c63a80 733136173 S Bi:1:023:1 -115 16 <
ffff8a5530c63a80 733138041 C Bi:1:023:1 0 6 = 90046666 6666
ffff8a5530c63a80 733139336 S Bi:1:023:1 -115 16 <
ffff8a5530c63a80 733141231 C Bi:1:023:1 0 6 = 90046330 3839
ffff8a5530c63a80 733142462 S Bi:1:023:1 -115 16 <
ffff8a5530c63a80 733144483 C Bi:1:023:1 0 6 = 90043066 3566
ffff8a5530c63a80 733145864 S Bi:1:023:1 -115 16 <
ffff8a5530c63a80 733147638 C Bi:1:023:1 0 6 = 90043030 2078
ffff8a5530c63a80 733149036 S Bi:1:023:1 -115 16 <
ffff8a5530c63a80 733150834 C Bi:1:023:1 0 6 = 90043920 3a20
ffff8a5530c63a80 733152214 S Bi:1:023:1 -115 16 <
ffff8a5530c63a80 733154067 C Bi:1:023:1 0 6 = 90046666 6666
ffff8a5530c63a80 733155515 S Bi:1:023:1 -115 16 <
ffff8a5530c63a80 733157255 C Bi:1:023:1 0 6 = 90046666 6330
ffff8a5530c63a80 733158694 S Bi:1:023:1 -115 16 <
ffff8a5530c63a80 733160473 C Bi:1:023:1 0 6 = 90043831 6162
ffff8a5530c63a80 733161717 S Bi:1:023:1 -115 16 <
ffff8a5530c63a80 733163647 C Bi:1:023:1 0 6 = 90043331 6438
ffff8a5530c63a80 733165039 S Bi:1:023:1 -115 16 <
ffff8a5530c63a80 733166259 C Bi:1:023:1 0 3 = 90010a
ffff8a5530c63a80 733167510 S Bi:1:023:1 -115 16 <
ffff8a5530c63a80 733170335 C Bi:1:023:1 0 6 = 90045b20 2033
ffff8a5530c63a80 733171745 S Bi:1:023:1 -115 16 <
ffff8a5530c63a80 733173495 C Bi:1:023:1 0 6 = 90043131 2e32
ffff8a5530c63a80 733174904 S Bi:1:023:1 -115 16 <
ffff8a5530c63a80 733176691 C Bi:1:023:1 0 6 = 90043432 3332
ffff8a5530c63a80 733177984 S Bi:1:023:1 -115 16 <
ffff8a5530c63a80 733179891 C Bi:1:023:1 0 6 = 9004385d 2078
ffff8a5530c63a80 733181134 S Bi:1:023:1 -115 16 <
ffff8a5530c63a80 733183083 C Bi:1:023:1 0 6 = 90043820 3a20
ffff8a5530c63a80 733184847 S Bi:1:023:1 -115 16 <
ffff8a5530c63a80 733186307 C Bi:1:023:1 0 6 = 90043366 6666
ffff8a5530c63a80 733187615 S Bi:1:023:1 -115 16 <
ffff8a5530c63a80 733189569 C Bi:1:023:1 0 6 = 90046666 6666
ffff8a5530c63a80 733190920 S Bi:1:023:1 -115 16 <
ffff8a5530c63a80 733192722 C Bi:1:023:1 0 6 = 90046666 6666
ffff8a5530c63a80 733194053 S Bi:1:023:1 -115 16 <
ffff8a5530c63a80 733195938 C Bi:1:023:1 0 6 = 90046566 6666
ffff8a5530c63a80 733197252 S Bi:1:023:1 -115 16 <
ffff8a5530c63a80 733199157 C Bi:1:023:1 0 6 = 90042078 3720
ffff8a5530c63a80 733201074 S Bi:1:023:1 -115 16 <
ffff8a5530c63a80 733202315 C Bi:1:023:1 0 6 = 90043a20 6666
ffff8a5530c63a80 733203730 S Bi:1:023:1 -115 16 <
ffff8a5530c63a80 733205516 C Bi:1:023:1 0 6 = 90046666 6666
ffff8a5530c63a80 733206839 S Bi:1:023:1 -115 16 <
ffff8a5530c63a80 733208702 C Bi:1:023:1 0 6 = 90046330 3831
ffff8a5530c63a80 733210015 S Bi:1:023:1 -115 16 <
ffff8a5530c63a80 733211913 C Bi:1:023:1 0 6 = 90046230 6231
ffff8a5530c63a80 733213213 S Bi:1:023:1 -115 16 <
ffff8a5530c63a80 733215117 C Bi:1:023:1 0 6 = 90046438 2078
ffff8a5530c63a80 733218327 S Bi:1:023:1 -115 16 <
ffff8a5530c63a80 733219000 C Bi:1:023:1 0 6 = 90043620 3a20
ffff8a5530c63a80 733220575 S Bi:1:023:1 -115 16 <
ffff8a5530c63a80 733221547 C Bi:1:023:1 0 6 = 90043030 3030
ffff8a5530c63a80 733222873 S Bi:1:023:1 -115 16 <
ffff8a5530c63a80 733224729 C Bi:1:023:1 0 6 = 90043030 3030
ffff8a5530c63a80 733225986 S Bi:1:023:1 -115 16 <
ffff8a5530c63a80 733227913 C Bi:1:023:1 0 6 = 90043030 3030
ffff8a5530c63a80 733229228 S Bi:1:023:1 -115 16 <
ffff8a5530c63a80 733231306 C Bi:1:023:1 0 6 = 90043065 6333
ffff8a5530c63a80 733232834 S Bi:1:023:1 -115 16 <
ffff8a5530c63a80 733233744 C Bi:1:023:1 0 3 = 90010a
ffff8a5530c63a80 733235073 S Bi:1:023:1 -115 16 <
ffff8a5530c63a80 733237801 C Bi:1:023:1 0 6 = 90045b20 2033
ffff8a5530c63a80 733239187 S Bi:1:023:1 -115 16 <
ffff8a5530c63a80 733240974 C Bi:1:023:1 0 6 = 90043131 2e33
ffff8a5530c63a80 733242225 S Bi:1:023:1 -115 16 <
ffff8a5530c63a80 733244242 C Bi:1:023:1 0 6 = 90043039 3831
ffff8a5530c63a80 733245729 S Bi:1:023:1 -115 16 <
ffff8a5530c63a80 733247451 C Bi:1:023:1 0 6 = 9004325d 2078
ffff8a55b644ec00 733249256 S Bi:1:023:1 -115 16 <
ffff8a55b644ec00 733250731 C Bi:1:023:1 0 6 = 90043520 3a20
ffff8a55b644ec00 733252276 S Bi:1:023:1 -115 16 <
ffff8a55b644ec00 733253850 C Bi:1:023:1 0 6 = 90046666 6666
ffff8a55b644ec00 733255450 S Bi:1:023:1 -115 16 <
ffff8a55b644ec00 733257032 C Bi:1:023:1 0 6 = 90046666 6330
ffff8a55b644ec00 733258464 S Bi:1:023:1 -115 16 <
ffff8a55b644ec00 733260200 C Bi:1:023:1 0 6 = 90043831 6230
ffff8a55b644ec00 733261944 S Bi:1:023:1 -115 16 <
ffff8a55b644ec00 733263429 C Bi:1:023:1 0 6 = 90046231 6438
ffff8a55b644ec00 733265043 S Bi:1:023:1 -115 16 <
ffff8a55b644ec00 733266606 C Bi:1:023:1 0 6 = 90042078 3420
ffff8a55b644ec00 733268141 S Bi:1:023:1 -115 16 <
ffff8a55b644ec00 733269807 C Bi:1:023:1 0 6 = 90043a20 3030
ffff8a55b644ec00 733271126 S Bi:1:023:1 -115 16 <
ffff8a55b644ec00 733273036 C Bi:1:023:1 0 6 = 90043030 3030
ffff8a55b644ec00 733274759 S Bi:1:023:1 -115 16 <
ffff8a55b644ec00 733276381 C Bi:1:023:1 0 6 = 90043030 3030
ffff8a55b644ec00 733278448 S Bi:1:023:1 -115 16 <
ffff8a55b644ec00 733279472 C Bi:1:023:1 0 6 = 90043030 3030
ffff8a55b644ec00 733281086 S Bi:1:023:1 -115 16 <
ffff8a55b644ec00 733282635 C Bi:1:023:1 0 6 = 90043030 2078
ffff8a55b644ec00 733284193 S Bi:1:023:1 -115 16 <
ffff8a55b644ec00 733285839 C Bi:1:023:1 0 6 = 90043320 3a20
ffff8a55b644ec00 733287191 S Bi:1:023:1 -115 16 <
ffff8a55b644ec00 733289040 C Bi:1:023:1 0 6 = 90043030 3030
ffff8a55b644ec00 733290425 S Bi:1:023:1 -115 16 <
ffff8a55b644ec00 733292343 C Bi:1:023:1 0 6 = 90043030 3030
ffff8a55b644ec00 733294459 S Bi:1:023:1 -115 16 <
ffff8a55b644ec00 733295454 C Bi:1:023:1 0 6 = 90043030 3030
ffff8a55b644ec00 733296840 S Bi:1:023:1 -115 16 <
ffff8a55b644ec00 733298654 C Bi:1:023:1 0 6 = 90043030 3030
ffff8a55b644ec00 733300351 S Bi:1:023:1 -115 16 <
ffff8a55b644ec00 733301254 C Bi:1:023:1 0 3 = 90010a
ffff8a55b644ec00 733302672 S Bi:1:023:1 -115 16 <
ffff8a55b644ec00 733305341 C Bi:1:023:1 0 6 = 90045b20 2033
ffff8a55b644ec00 733306686 S Bi:1:023:1 -115 16 <
ffff8a55b644ec00 733308626 C Bi:1:023:1 0 6 = 90043131 2e33
ffff8a55b644ec00 733310114 S Bi:1:023:1 -115 16 <
ffff8a55b644ec00 733311691 C Bi:1:023:1 0 6 = 90043737 3330
ffff8a55b644ec00 733313145 S Bi:1:023:1 -115 16 <
ffff8a55b644ec00 733314892 C Bi:1:023:1 0 6 = 9004365d 2078
ffff8a55b644ec00 733316388 S Bi:1:023:1 -115 16 <
ffff8a55b644ec00 733318063 C Bi:1:023:1 0 6 = 90043220 3a20
ffff8a55b644ec00 733319465 S Bi:1:023:1 -115 16 <
ffff8a55b644ec00 733321280 C Bi:1:023:1 0 6 = 90043030 3030
ffff8a55b644ec00 733322647 S Bi:1:023:1 -115 16 <
ffff8a55b644ec00 733324692 C Bi:1:023:1 0 6 = 90043030 3030
ffff8a55b644ec00 733326189 S Bi:1:023:1 -115 16 <
ffff8a55b644ec00 733327706 C Bi:1:023:1 0 6 = 90043030 3030
ffff8a55b644ec00 733329303 S Bi:1:023:1 -115 16 <
ffff8a55b644ec00 733330896 C Bi:1:023:1 0 6 = 90043030 3030
ffff8a55b644ec00 733332365 S Bi:1:023:1 -115 16 <
ffff8a55b644ec00 733334106 C Bi:1:023:1 0 6 = 90042078 3120
ffff8a55b644ec00 733335573 S Bi:1:023:1 -115 16 <
ffff8a55b644ec00 733337396 C Bi:1:023:1 0 6 = 90043a20 3030
ffff8a55b644ec00 733338812 S Bi:1:023:1 -115 16 <
ffff8a55b644ec00 733340535 C Bi:1:023:1 0 6 = 90043030 3030
ffff8a55b644ec00 733341982 S Bi:1:023:1 -115 16 <
ffff8a55b644ec00 733343695 C Bi:1:023:1 0 6 = 90043030 3030
ffff8a55b644ec00 733345192 S Bi:1:023:1 -115 16 <
ffff8a55b644ec00 733346909 C Bi:1:023:1 0 6 = 90043030 3030
ffff8a55b644ec00 733348300 S Bi:1:023:1 -115 16 <
ffff8a55b644ec00 733350186 C Bi:1:023:1 0 6 = 90043030 2078
ffff8a55b644ec00 733351748 S Bi:1:023:1 -115 16 <
ffff8a55b644ec00 733353337 C Bi:1:023:1 0 6 = 90043020 3a20
ffff8a55b644ec00 733355307 S Bi:1:023:1 -115 16 <
ffff8a55b644ec00 733356558 C Bi:1:023:1 0 6 = 90046666 6666
ffff8a55b644ec00 733358074 S Bi:1:023:1 -115 16 <
ffff8a55b644ec00 733359755 C Bi:1:023:1 0 6 = 90046666 3830
ffff8a55b644ec00 733361238 S Bi:1:023:1 -115 16 <
ffff8a55b644ec00 733362972 C Bi:1:023:1 0 6 = 90043831 3930
ffff8a55b644ec00 733364574 S Bi:1:023:1 -115 16 <
ffff8a55b644ec00 733366142 C Bi:1:023:1 0 6 = 90046630 3030
ffff8a55b644ec00 733367500 S Bi:1:023:1 -115 16 <
ffff8a55b644ec00 733368726 C Bi:1:023:1 0 3 = 90010a
ffff8a55b644ec00 733370562 S Bi:1:023:1 -115 16 <
ffff8a55b644ec00 733372775 C Bi:1:023:1 0 6 = 90045b20 2033
ffff8a55b644ec00 733374503 S Bi:1:023:1 -115 16 <
ffff8a55b644ec00 733376133 C Bi:1:023:1 0 6 = 90043131 2e34
ffff8a55b644ec00 733377671 S Bi:1:023:1 -115 16 <
ffff8a55b644ec00 733379183 C Bi:1:023:1 0 6 = 90043434 3738
ffff8a55b644ec00 733380619 S Bi:1:023:1 -115 16 <
ffff8a55b644ec00 733382343 C Bi:1:023:1 0 6 = 9004335d 2043
ffff8a55b644ec00 733383875 S Bi:1:023:1 -115 16 <
ffff8a55b644ec00 733385551 C Bi:1:023:1 0 6 = 9004616c 6c20
ffff8a55b644ec00 733387487 S Bi:1:023:1 -115 16 <
ffff8a55b644ec00 733388781 C Bi:1:023:1 0 6 = 90047472 6163
ffff8a55b644ec00 733390429 S Bi:1:023:1 -115 16 <
ffff8a55b644ec00 733391751 C Bi:1:023:1 0 5 = 9003653a 0a
ffff8a55b644ec00 733393148 S Bi:1:023:1 -115 16 <
ffff8a55b644ec00 733395819 C Bi:1:023:1 0 6 = 90045b20 2033
ffff8a55b644ec00 733397271 S Bi:1:023:1 -115 16 <
ffff8a55b644ec00 733398978 C Bi:1:023:1 0 6 = 90043131 2e34
ffff8a55b644ec00 733400275 S Bi:1:023:1 -115 16 <
ffff8a55b644ec00 733402190 C Bi:1:023:1 0 6 = 90043637 3832
ffff8a55b644ec00 733403533 S Bi:1:023:1 -115 16 <
ffff8a55b644ec00 733405382 C Bi:1:023:1 0 6 = 9004365d 2020
ffff8a55b644ec00 733406743 S Bi:1:023:1 -115 16 <
ffff8a55b644ec00 733408606 C Bi:1:023:1 0 6 = 90046472 6d5f
ffff8a55b644ec00 733410072 S Bi:1:023:1 -115 16 <
ffff8a55b644ec00 733411793 C Bi:1:023:1 0 6 = 90046372 7463
ffff8a55b644ec00 733413068 S Bi:1:023:1 -115 16 <
ffff8a55b644ec00 733414986 C Bi:1:023:1 0 6 = 90045f77 6169
ffff8a55b644ec00 733416315 S Bi:1:023:1 -115 16 <
ffff8a55b644ec00 733418209 C Bi:1:023:1 0 6 = 9004745f 6f6e
ffff8a55b644ec00 733420635 S Bo:1:023:2 -115 2 = 9002
ffff8a55b644ec00 733421040 C Bo:1:023:2 0 2 >
ffff8a55b644ec00 733421700 S Bi:1:023:1 -115 16 <
ffff8a55b644ec00 733422195 C Bi:1:023:1 0 6 = 9004655f 7662
ffff8a55b644ec00 733423613 S Bi:1:023:1 -115 16 <
ffff8a55b644ec00 733424615 C Bi:1:023:1 0 6 = 90046c61 6e6b
ffff8a55b644ec00 733426082 S Bi:1:023:1 -115 16 <
ffff8a55b644ec00 733427802 C Bi:1:023:1 0 6 = 90042b30 7831
ffff8a55b644ec00 733429485 S Bi:1:023:1 -115 16 <
ffff8a55b644ec00 733431014 C Bi:1:023:1 0 6 = 90043963 2f30
ffff8a55b644ec00 733432971 S Bi:1:023:1 -115 16 <
ffff8a55b644ec00 733434244 C Bi:1:023:1 0 6 = 90047832 3230
ffff8a55b644ec00 733435846 S Bi:1:023:1 -115 16 <
ffff8a55b644ec00 733437406 C Bi:1:023:1 0 6 = 90042028 5029
ffff8a55b644ec00 733438703 S Bi:1:023:1 -115 16 <
ffff8a55b644ec00 733440046 C Bi:1:023:1 0 3 = 90010a
ffff8a55b644ec00 733441415 S Bi:1:023:1 -115 16 <
ffff8a55b644ec00 733444081 C Bi:1:023:1 0 6 = 90045b20 2033
ffff8a55b644ec00 733445498 S Bi:1:023:1 -115 16 <
ffff8a55b644ec00 733447237 C Bi:1:023:1 0 6 = 90043131 2e35
ffff8a55b644ec00 733448808 S Bi:1:023:1 -115 16 <
ffff8a55b644ec00 733450433 C Bi:1:023:1 0 6 = 90043136 3038
ffff8a55b644ec00 733451771 S Bi:1:023:1 -115 16 <
ffff8a55b644ec00 733453640 C Bi:1:023:1 0 6 = 9004395d 2020
ffff8a55b644ec00 733455067 S Bi:1:023:1 -115 16 <
ffff8a55b644ec00 733456844 C Bi:1:023:1 0 6 = 90046472 6d5f
ffff8a55b644ec00 733458133 S Bi:1:023:1 -115 16 <
ffff8a55b644ec00 733460035 C Bi:1:023:1 0 6 = 9004636c 6965
ffff8a55b644ec00 733461365 S Bi:1:023:1 -115 16 <
ffff8a55b644ec00 733463227 C Bi:1:023:1 0 6 = 90046e74 5f6d
ffff8a55b644ec00 733464889 S Bi:1:023:1 -115 16 <
ffff8a55b644ec00 733466441 C Bi:1:023:1 0 6 = 90046f64 6573
ffff8a55b644ec00 733467749 S Bi:1:023:1 -115 16 <
ffff8a55b644ec00 733469642 C Bi:1:023:1 0 6 = 90046574 5f77
ffff8a55b644ec00 733471009 S Bi:1:023:1 -115 16 <
ffff8a55b644ec00 733472844 C Bi:1:023:1 0 6 = 90046169 745f
ffff8a55b644ec00 733474156 S Bi:1:023:1 -115 16 <
ffff8a55b644ec00 733476057 C Bi:1:023:1 0 6 = 9004666f 725f
ffff8a55b644ec00 733477294 S Bi:1:023:1 -115 16 <
ffff8a55b644ec00 733479240 C Bi:1:023:1 0 6 = 90047662 6c61
ffff8a55b644ec00 733481230 S Bi:1:023:1 -115 16 <
ffff8a55b644ec00 733482437 C Bi:1:023:1 0 6 = 90046e6b 2b30
ffff8a55b644ec00 733483785 S Bi:1:023:1 -115 16 <
ffff8a55b644ec00 733485629 C Bi:1:023:1 0 6 = 90047836 632f
ffff8a55b644ec00 733487021 S Bi:1:023:1 -115 16 <
ffff8a55b644ec00 733488839 C Bi:1:023:1 0 6 = 90043078 3830
ffff8a55b644ec00 733490108 S Bi:1:023:1 -115 16 <
ffff8a55b644ec00 733491542 C Bi:1:023:1 0 3 = 90010a
ffff8a55b644ec00 733492879 S Bi:1:023:1 -115 16 <
ffff8a55b644ec00 733495525 C Bi:1:023:1 0 6 = 90045b20 2033
ffff8a55b644ec00 733497102 S Bi:1:023:1 -115 16 <
ffff8a55b644ec00 733498664 C Bi:1:023:1 0 6 = 90043131 2e35
ffff8a55b644ec00 733499991 S Bi:1:023:1 -115 16 <
ffff8a55b644ec00 733501858 C Bi:1:023:1 0 6 = 90043637 3531
ffff8a55b644ec00 733503108 S Bi:1:023:1 -115 16 <
ffff8a55b644ec00 733505104 C Bi:1:023:1 0 6 = 9004395d 2020
ffff8a55b644ec00 733506516 S Bi:1:023:1 -115 16 <
ffff8a55b644ec00 733508292 C Bi:1:023:1 0 6 = 90046472 6d5f
ffff8a55b644ec00 733509557 S Bi:1:023:1 -115 16 <
ffff8a55b644ec00 733511470 C Bi:1:023:1 0 6 = 90046662 5f68
ffff8a55b644ec00 733512789 S Bi:1:023:1 -115 16 <
ffff8a55b644ec00 733514658 C Bi:1:023:1 0 6 = 9004656c 7065
ffff8a55b644ec00 733516180 S Bi:1:023:1 -115 16 <
ffff8a55b644ec00 733517867 C Bi:1:023:1 0 6 = 9004725f 6461
ffff8a55b644ec00 733519209 S Bi:1:023:1 -115 16 <
ffff8a55b644ec00 733521060 C Bi:1:023:1 0 6 = 90046d61 6765
ffff8a55b644ec00 733522355 S Bi:1:023:1 -115 16 <
ffff8a55b644ec00 733524281 C Bi:1:023:1 0 6 = 90045f77 6f72
ffff8a55b644ec00 733525727 S Bi:1:023:1 -115 16 <
ffff8a55b644ec00 733527473 C Bi:1:023:1 0 6 = 90046b2b 3078
ffff8a55b644ec00 733528795 S Bi:1:023:1 -115 16 <
ffff8a55b644ec00 733530668 C Bi:1:023:1 0 6 = 90043137 342f
ffff8a55b644ec00 733531973 S Bi:1:023:1 -115 16 <
ffff8a55b644ec00 733533876 C Bi:1:023:1 0 6 = 90043078 3361
ffff8a55b644ec00 733535251 S Bi:1:023:1 -115 16 <
ffff8a55b644ec00 733536675 C Bi:1:023:1 0 4 = 9002300a
ffff8a55b644ec00 733537944 S Bi:1:023:1 -115 16 <
ffff8a55b644ec00 733540719 C Bi:1:023:1 0 6 = 90045b20 2033
ffff8a55b644ec00 733542534 S Bi:1:023:1 -115 16 <
ffff8a55b644ec00 733543923 C Bi:1:023:1 0 6 = 90043131 2e36
ffff8a55b644ec00 733545453 S Bi:1:023:1 -115 16 <
ffff8a55b644ec00 733547100 C Bi:1:023:1 0 6 = 90043132 3735
ffff8a55b644ec00 733548474 S Bi:1:023:1 -115 16 <
ffff8a55b644ec00 733550303 C Bi:1:023:1 0 6 = 9004335d 2020
ffff8a55b644ec00 733551705 S Bi:1:023:1 -115 16 <
ffff8a55b644ec00 733553490 C Bi:1:023:1 0 6 = 90047072 6f63
ffff8a55b644ec00 733554782 S Bi:1:023:1 -115 16 <
ffff8a55b644ec00 733556723 C Bi:1:023:1 0 6 = 90046573 735f
ffff8a55b644ec00 733558303 S Bi:1:023:1 -115 16 <
ffff8a55b644ec00 733559960 C Bi:1:023:1 0 6 = 90046f6e 655f
ffff8a55b644ec00 733561469 S Bi:1:023:1 -115 16 <
ffff8a55b644ec00 733563176 C Bi:1:023:1 0 6 = 9004776f 726b
ffff8a5530c63a80 733564968 S Bi:1:023:1 -115 16 <
ffff8a5530c63a80 733566302 C Bi:1:023:1 0 6 = 90042b30 7831
ffff8a5530c63a80 733567555 S Bi:1:023:1 -115 16 <
ffff8a5530c63a80 733569504 C Bi:1:023:1 0 6 = 90043838 2f30
ffff8a5530c63a80 733570854 S Bi:1:023:1 -115 16 <
ffff8a5530c63a80 733572722 C Bi:1:023:1 0 6 = 90047832 6534
ffff8a5530c63a80 733574521 S Bi:1:023:1 -115 16 <
ffff8a5530c63a80 733575299 C Bi:1:023:1 0 3 = 90010a
ffff8a5530c63a80 733576691 S Bi:1:023:1 -115 16 <
ffff8a5530c63a80 733579360 C Bi:1:023:1 0 6 = 90045b20 2033
ffff8a5530c63a80 733580783 S Bi:1:023:1 -115 16 <
ffff8a5530c63a80 733582522 C Bi:1:023:1 0 6 = 90043131 2e36
ffff8a5530c63a80 733583833 S Bi:1:023:1 -115 16 <
ffff8a5530c63a80 733585718 C Bi:1:023:1 0 6 = 90043531 3337
ffff8a5530c63a80 733587114 S Bi:1:023:1 -115 16 <
ffff8a5530c63a80 733588935 C Bi:1:023:1 0 6 = 9004395d 2020
ffff8a5530c63a80 733590254 S Bi:1:023:1 -115 16 <
ffff8a5530c63a80 733592115 C Bi:1:023:1 0 6 = 9004776f 726b
ffff8a5530c63a80 733593441 S Bi:1:023:1 -115 16 <
ffff8a5530c63a80 733595317 C Bi:1:023:1 0 6 = 90046572 5f74
ffff8a5530c63a80 733596692 S Bi:1:023:1 -115 16 <
ffff8a5530c63a80 733598517 C Bi:1:023:1 0 6 = 90046872 6561
ffff8a5530c63a80 733599808 S Bi:1:023:1 -115 16 <
ffff8a5530c63a80 733601721 C Bi:1:023:1 0 6 = 9004642b 3078
ffff8a5530c63a80 733603006 S Bi:1:023:1 -115 16 <
ffff8a5530c63a80 733604994 C Bi:1:023:1 0 6 = 90043138 632f
ffff8a5530c63a80 733606397 S Bi:1:023:1 -115 16 <
ffff8a5530c63a80 733608134 C Bi:1:023:1 0 6 = 90043078 3330
ffff8a5530c63a80 733609447 S Bi:1:023:1 -115 16 <
ffff8a5530c63a80 733610920 C Bi:1:023:1 0 4 = 9002300a
ffff8a5530c63a80 733612272 S Bi:1:023:1 -115 16 <
ffff8a5530c63a80 733614957 C Bi:1:023:1 0 6 = 90045b20 2033
ffff8a5530c63a80 733616342 S Bi:1:023:1 -115 16 <
ffff8a5530c63a80 733618139 C Bi:1:023:1 0 6 = 90043131 2e36
ffff8a5530c63a80 733619486 S Bi:1:023:1 -115 16 <
ffff8a5530c63a80 733621345 C Bi:1:023:1 0 6 = 90043837 3030
ffff8a5530c63a80 733622656 S Bi:1:023:1 -115 16 <
ffff8a5530c63a80 733624558 C Bi:1:023:1 0 6 = 9004325d 2020
ffff8a5530c63a80 733625932 S Bi:1:023:1 -115 16 <
ffff8a5530c63a80 733627742 C Bi:1:023:1 0 6 = 90046b74 6872
ffff8a5530c63a80 733629179 S Bi:1:023:1 -115 16 <
ffff8a5530c63a80 733630958 C Bi:1:023:1 0 6 = 90046561 642b
ffff8a5530c63a80 733632275 S Bi:1:023:1 -115 16 <
ffff8a5530c63a80 733634145 C Bi:1:023:1 0 6 = 90043078 3131
ffff8a5530c63a80 733635711 S Bi:1:023:1 -115 16 <
ffff8a5530c63a80 733637352 C Bi:1:023:1 0 6 = 9004382f 3078
ffff8a5530c63a80 733638599 S Bi:1:023:1 -115 16 <
ffff8a5530c63a80 733640551 C Bi:1:023:1 0 6 = 90043132 340a
ffff8a5530c63a80 733642168 S Bi:1:023:1 -115 16 <
ffff8a5530c63a80 733644588 C Bi:1:023:1 0 6 = 90045b20 2033
ffff8a5530c63a80 733646019 S Bi:1:023:1 -115 16 <
ffff8a5530c63a80 733647762 C Bi:1:023:1 0 6 = 90043131 2e37
ffff8a5530c63a80 733649028 S Bi:1:023:1 -115 16 <
ffff8a5530c63a80 733651035 C Bi:1:023:1 0 6 = 90043136 3632
ffff8a5530c63a80 733652582 S Bi:1:023:1 -115 16 <
ffff8a5530c63a80 733654220 C Bi:1:023:1 0 6 = 9004365d 2020
ffff8a5530c63a80 733655705 S Bi:1:023:1 -115 16 <
ffff8a5530c63a80 733657379 C Bi:1:023:1 0 6 = 90047265 745f
ffff8a5530c63a80 733658648 S Bi:1:023:1 -115 16 <
ffff8a5530c63a80 733660577 C Bi:1:023:1 0 6 = 90046672 6f6d
ffff8a5530c63a80 733661973 S Bi:1:023:1 -115 16 <
ffff8a5530c63a80 733663781 C Bi:1:023:1 0 6 = 90045f66 6f72
ffff8a5530c63a80 733665351 S Bi:1:023:1 -115 16 <
ffff8a5530c63a80 733667018 C Bi:1:023:1 0 6 = 90046b2b 3078
ffff8a5530c63a80 733668406 S Bi:1:023:1 -115 16 <
ffff8a5530c63a80 733670219 C Bi:1:023:1 0 6 = 90043130 2f30
ffff8a5530c63a80 733671726 S Bi:1:023:1 -115 16 <
ffff8a5530c63a80 733673362 C Bi:1:023:1 0 6 = 90047832 300a
ffff8a5530c63a80 733674655 S Bi:1:023:1 -115 16 <
ffff8a5530c63a80 733677384 C Bi:1:023:1 0 6 = 90045b20 2033
ffff8a5530c63a80 733678741 S Bi:1:023:1 -115 16 <
ffff8a5530c63a80 733680600 C Bi:1:023:1 0 6 = 90043131 2e37
ffff8a5530c63a80 733682495 S Bi:1:023:1 -115 16 <
ffff8a5530c63a80 733683922 C Bi:1:023:1 0 6 = 90043439 3434
ffff8a5530c63a80 733685467 S Bi:1:023:1 -115 16 <
ffff8a5530c63a80 733687066 C Bi:1:023:1 0 6 = 9004375d 202d
ffff8a5530c63a80 733688469 S Bi:1:023:1 -115 16 <
ffff8a5530c63a80 733690192 C Bi:1:023:1 0 6 = 90042d2d 5b20
ffff8a5530c63a80 733691558 S Bi:1:023:1 -115 16 <
ffff8a5530c63a80 733693383 C Bi:1:023:1 0 6 = 9004656e 6420
ffff8a5530c63a80 733694667 S Bi:1:023:1 -115 16 <
ffff8a5530c63a80 733696719 C Bi:1:023:1 0 6 = 90047472 6163
ffff8a5530c63a80 733698197 S Bi:1:023:1 -115 16 <
ffff8a5530c63a80 733699822 C Bi:1:023:1 0 6 = 90046520 3030
ffff8a5530c63a80 733701396 S Bi:1:023:1 -115 16 <
ffff8a5530c63a80 733702987 C Bi:1:023:1 0 6 = 90043030 3030
ffff8a5530c63a80 733704365 S Bi:1:023:1 -115 16 <
ffff8a5530c63a80 733706203 C Bi:1:023:1 0 6 = 90043030 3030
ffff8a5530c63a80 733707689 S Bi:1:023:1 -115 16 <
ffff8a5530c63a80 733709384 C Bi:1:023:1 0 6 = 90043030 3030
ffff8a5530c63a80 733710654 S Bi:1:023:1 -115 16 <
ffff8a5530c63a80 733712726 C Bi:1:023:1 0 6 = 90043030 205d
ffff8a5530c63a80 733714126 S Bi:1:023:1 -115 16 <
ffff8a5530c63a80 733715812 C Bi:1:023:1 0 6 = 90042d2d 2d0a
ffff8a5530c63a80 733717148 S Bi:1:023:1 -115 16 <
ffff8a5530c63a80 733719963 C Bi:1:023:1 0 6 = 90045b20 2033
ffff8a5530c63a80 733721364 S Bi:1:023:1 -115 16 <
ffff8a5530c63a80 733723143 C Bi:1:023:1 0 6 = 90043131 2e37
ffff8a5530c63a80 733724518 S Bi:1:023:1 -115 16 <
ffff8a5530c63a80 733726361 C Bi:1:023:1 0 6 = 90043932 3030
ffff8a5530c63a80 733728348 S Bi:1:023:1 -115 16 <
ffff8a5530c63a80 733729598 C Bi:1:023:1 0 6 = 9004385d 2065
ffff8a5530c63a80 733731087 S Bi:1:023:1 -115 16 <
ffff8a5530c63a80 733732753 C Bi:1:023:1 0 6 = 90047564 3a20
ffff8a5530c63a80 733734027 S Bi:1:023:1 -115 16 <
ffff8a5530c63a80 733735935 C Bi:1:023:1 0 6 = 90045258 3436
ffff8a5530c63a80 733737324 S Bi:1:023:1 -115 16 <
ffff8a5530c63a80 733739147 C Bi:1:023:1 0 6 = 90042046 3120
ffff8a5530c63a80 733741163 S Bi:1:023:1 -115 16 <
ffff8a5530c63a80 733742386 C Bi:1:023:1 0 6 = 90047669 613d
ffff8a5530c63a80 733744270 S Bi:1:023:1 -115 16 <
ffff8a5530c63a80 733745554 C Bi:1:023:1 0 6 = 9004636f 6e73
ffff8a5530c63a80 733746862 S Bi:1:023:1 -115 16 <
ffff8a5530c63a80 733748748 C Bi:1:023:1 0 6 = 90046f6c 6520
ffff8a5530c63a80 733750139 S Bi:1:023:1 -115 16 <
ffff8a5530c63a80 733751973 C Bi:1:023:1 0 6 = 90046972 7173
ffff8a5530c63a80 733753574 S Bi:1:023:1 -115 16 <
ffff8a5530c63a80 733755141 C Bi:1:023:1 0 6 = 90043d31 2066
ffff8a5530c63a80 733756501 S Bi:1:023:1 -115 16 <
ffff8a5530c63a80 733758420 C Bi:1:023:1 0 6 = 90046175 6c74
ffff8a5530c63a80 733759857 S Bi:1:023:1 -115 16 <
ffff8a5530c63a80 733761354 C Bi:1:023:1 0 5 = 90033d30 0a
ffff8a5530c63a80 733762752 S Bi:1:023:1 -115 16 <
ffff8a5530c63a80 733765460 C Bi:1:023:1 0 6 = 90045b20 2033
ffff8a5530c63a80 733766820 S Bi:1:023:1 -115 16 <
ffff8a5530c63a80 733768653 C Bi:1:023:1 0 6 = 90043131 2e38
ffff8a5530c63a80 733769914 S Bi:1:023:1 -115 16 <
ffff8a5530c63a80 733771828 C Bi:1:023:1 0 6 = 90043337 3434
ffff8a5530c63a80 733773069 S Bi:1:023:1 -115 16 <
ffff8a5530c63a80 733775013 C Bi:1:023:1 0 6 = 9004355d 2065
ffff8a5530c63a80 733776713 S Bi:1:023:1 -115 16 <
ffff8a5530c63a80 733778187 C Bi:1:023:1 0 6 = 90047564 3a20
ffff8a5530c63a80 733779511 S Bi:1:023:1 -115 16 <
ffff8a5530c63a80 733781383 C Bi:1:023:1 0 6 = 90047265 626f
ffff8a5530c63a80 733782644 S Bi:1:023:1 -115 16 <
ffff8a5530c63a80 733784610 C Bi:1:023:1 0 6 = 90046f74 3220
ffff8a5530c63c00 733785948 S Bi:1:023:1 -115 16 <
ffff8a5530c63c00 733787802 C Bi:1:023:1 0 6 = 9004626f 6f74
ffff8a5530c63c00 733789048 S Bi:1:023:1 -115 16 <
ffff8a5530c63c00 733791063 C Bi:1:023:1 0 6 = 90046c6f 6164
ffff8a5530c63c00 733792609 S Bi:1:023:1 -115 16 <
ffff8a5530c63c00 733794184 C Bi:1:023:1 0 6 = 90046572 2072
ffff8a5530c63c00 733795617 S Bi:1:023:1 -115 16 <
ffff8a5530c63c00 733797385 C Bi:1:023:1 0 6 = 90046571 7565
ffff8a5530c63c00 733798689 S Bi:1:023:1 -115 16 <
ffff8a5530c63c00 733800629 C Bi:1:023:1 0 6 = 90047374 6564
ffff8a5530c63c00 733802087 S Bi:1:023:1 -115 16 <
ffff8a5530c63c00 733803171 C Bi:1:023:1 0 3 = 90010a
ffff8a5530c63c00 733804540 S Bi:1:023:1 -115 16 <
ffff8a5530c63c00 733807230 C Bi:1:023:1 0 6 = 90045b20 2033
ffff8a5530c63c00 733808598 S Bi:1:023:1 -115 16 <
ffff8a5530c63c00 733810411 C Bi:1:023:1 0 6 = 90043131 2e38
ffff8a5530c63c00 733811794 S Bi:1:023:1 -115 16 <
ffff8a5530c63c00 733813617 C Bi:1:023:1 0 6 = 90043739 3238
ffff8a5530c63c00 733815031 S Bi:1:023:1 -115 16 <
ffff8a5530c63c00 733816842 C Bi:1:023:1 0 6 = 9004325d 205b
ffff8a5530c63c00 733818250 S Bi:1:023:1 -115 16 <
ffff8a5530c63c00 733820049 C Bi:1:023:1 0 6 = 90046472 6d3a
ffff8a5530c63c00 733822202 S Bi:1:023:1 -115 16 <
ffff8a5530c63c00 733823413 C Bi:1:023:1 0 6 = 90046470 755f
ffff8a5530c63c00 733825143 S Bi:1:023:1 -115 16 <
ffff8a5530c63c00 733826442 C Bi:1:023:1 0 6 = 9004656e 636f
ffff8a5530c63c00 733827866 S Bi:1:023:1 -115 16 <
ffff8a5530c63c00 733829618 C Bi:1:023:1 0 6 = 90046465 725f
ffff8a5530c63c00 733831074 S Bi:1:023:1 -115 16 <
ffff8a5530c63c00 733832843 C Bi:1:023:1 0 6 = 90047068 7973
ffff8a5530c63c00 733834117 S Bi:1:023:1 -115 16 <
ffff8a5530c63c00 733836103 C Bi:1:023:1 0 6 = 90045f63 6d64
ffff8a5530c63c00 733837888 S Bi:1:023:1 -115 16 <
ffff8a5530c63c00 733839227 C Bi:1:023:1 0 6 = 90045f70 7265
ffff8a5530c63c00 733840530 S Bi:1:023:1 -115 16 <
ffff8a5530c63c00 733842420 C Bi:1:023:1 0 6 = 90047061 7265
ffff8a5530c63c00 733843783 S Bi:1:023:1 -115 16 <
ffff8a5530c63c00 733845690 C Bi:1:023:1 0 6 = 90045f66 6f72
ffff8a5530c63c00 733846952 S Bi:1:023:1 -115 16 <
ffff8a5530c63c00 733848856 C Bi:1:023:1 0 6 = 90045f6b 6963
ffff8a5530c63c00 733850194 S Bi:1:023:1 -115 16 <
ffff8a5530c63c00 733852048 C Bi:1:023:1 0 6 = 90046b6f 6666
ffff8a5530c63c00 733853574 S Bi:1:023:1 -115 16 <
ffff8a5530c63c00 733855220 C Bi:1:023:1 0 6 = 90045d20 2a45
ffff8a5530c63c00 733856761 S Bi:1:023:1 -115 16 <
ffff8a5530c63c00 733858421 C Bi:1:023:1 0 6 = 90045252 4f52
ffff8a5530c63c00 733859664 S Bi:1:023:1 -115 16 <
ffff8a5530c63c00 733861633 C Bi:1:023:1 0 6 = 90042a20 6661
ffff8a5530c63c00 733862972 S Bi:1:023:1 -115 16 <
ffff8a5530c63c00 733864837 C Bi:1:023:1 0 6 = 9004696c 6564
ffff8a5530c63c00 733866236 S Bi:1:023:1 -115 16 <
ffff8a5530c63c00 733868162 C Bi:1:023:1 0 6 = 90042077 6169
ffff8a5530c63c00 733869592 S Bi:1:023:1 -115 16 <
ffff8a5530c63c00 733871235 C Bi:1:023:1 0 6 = 9004745f 666f
ffff8a5530c63c00 733872700 S Bi:1:023:1 -115 16 <
ffff8a5530c63c00 733874459 C Bi:1:023:1 0 6 = 9004725f 6964
ffff8a5530c63c00 733875925 S Bi:1:023:1 -115 16 <
ffff8a5530c63c00 733877642 C Bi:1:023:1 0 6 = 90046c65 3a20
ffff8a5530c63c00 733878860 S Bi:1:023:1 -115 16 <
ffff8a5530c63c00 733880842 C Bi:1:023:1 0 6 = 90046964 3a33
ffff8a5530c63c00 733882284 S Bi:1:023:1 -115 16 <
ffff8a5530c63c00 733884078 C Bi:1:023:1 0 6 = 90043520 7265
ffff8a5530c63c00 733885450 S Bi:1:023:1 -115 16 <
ffff8a5530c63c00 733887220 C Bi:1:023:1 0 6 = 9004743a 2d31
ffff8a5530c63c00 733888693 S Bi:1:023:1 -115 16 <
ffff8a5530c63c00 733890429 C Bi:1:023:1 0 6 = 90043130 2070
ffff8a5530c63c00 733891839 S Bi:1:023:1 -115 16 <
ffff8a5530c63c00 733893626 C Bi:1:023:1 0 6 = 9004703a 300a
ffff8a5530c63c00 733894921 S Bi:1:023:1 -115 16 <
ffff8a5530c63c00 733896615 C Bi:1:023:1 -62 0
