ffff8a55e7830c00 3836593881 S Bi:1:020:1 -115 16 <
ffff8a55e7830c00 3836614630 C Bi:1:020:1 -2 0
ffff8a55e7830c00 3836614818 S Bi:1:020:1 -115 16 <
ffff8a55e7830c00 3836635533 C Bi:1:020:1 -2 0
ffff8a55e7830c00 3836635698 S Bi:1:020:1 -115 16 <
ffff8a55e7830c00 3836656528 C Bi:1:020:1 -2 0
ffff8a55e7830c00 3836656712 S Bi:1:020:1 -115 16 <
ffff8a55e7830c00 3836677527 C Bi:1:020:1 -2 0
ffff8a55e7830c00 3836677714 S Bi:1:020:1 -115 16 <
ffff8a55e7830c00 3836698762 C Bi:1:020:1 -2 0
ffff8a55e7830c00 3836698962 S Bi:1:020:1 -115 16 <
ffff8a55e7830c00 3836719879 C Bi:1:020:1 -2 0
ffff8a55e7830c00 3836720101 S Bi:1:020:1 -115 16 <
ffff8a55e7830c00 3836740941 C Bi:1:020:1 -2 0
ffff8a55e7830c00 3836741098 S Bi:1:020:1 -115 16 <
ffff8a55e7830c00 3836761932 C Bi:1:020:1 -2 0
ffff8a55e7830c00 3836762111 S Bi:1:020:1 -115 16 <
ffff8a55e7830c00 3836783099 C Bi:1:020:1 -2 0
ffff8a55e7830c00 3836783260 S Bi:1:020:1 -115 16 <
ffff8a55e7830c00 3836803877 C Bi:1:020:1 -2 0
ffff8a55e7830c00 3836804082 S Bi:1:020:1 -115 16 <
ffff8a55e7830c00 3836824815 C Bi:1:020:1 -2 0
ffff8a55e7830c00 3836824988 S Bi:1:020:1 -115 16 <
ffff8a55e7830c00 3836845670 C Bi:1:020:1 -2 0
ffff8a55e7830c00 3836845802 S Bi:1:020:1 -115 16 <
ffff8a55e7830c00 3836866494 C Bi:1:020:1 -2 0
ffff8a55e7830c00 3836866620 S Bi:1:020:1 -115 16 <
ffff8a55e7830c00 3836887224 C Bi:1:020:1 -2 0
ffff8a55e7830c00 3836887360 S Bi:1:020:1 -115 16 <
ffff8a55e7830c00 3836908057 C Bi:1:020:1 -2 0
ffff8a55e7830c00 3836908195 S Bi:1:020:1 -115 16 <
ffff8a55e7830c00 3836928839 C Bi:1:020:1 -2 0
ffff8a55e7830c00 3836928970 S Bi:1:020:1 -115 16 <
ffff8a55e7830c00 3836949706 C Bi:1:020:1 -2 0
ffff8a55e7830c00 3836949822 S Bi:1:020:1 -115 16 <
ffff8a55e7830c00 3836970412 C Bi:1:020:1 -2 0
ffff8a55e7830c00 3836970637 S Bi:1:020:1 -115 16 <
ffff8a55e7830c00 3836991323 C Bi:1:020:1 -2 0
ffff8a55e7830c00 3836991453 S Bi:1:020:1 -115 16 <
ffff8a55e7830c00 3837011970 C Bi:1:020:1 -2 0
ffff8a55e7830c00 3837012146 S Bi:1:020:1 -115 16 <
ffff8a55e7830c00 3837032869 C Bi:1:020:1 -2 0
ffff8a55e7830c00 3837033036 S Bi:1:020:1 -115 16 <
ffff8a55e7830c00 3837053582 C Bi:1:020:1 -2 0
ffff8a55e7830c00 3837053701 S Bi:1:020:1 -115 16 <
ffff8a55e7830c00 3837074345 C Bi:1:020:1 -2 0
ffff8a55e7830c00 3837074484 S Bi:1:020:1 -115 16 <
ffff8a55e7830c00 3837095268 C Bi:1:020:1 -2 0
ffff8a55e7830c00 3837095421 S Bi:1:020:1 -115 16 <
ffff8a55e7830c00 3837116193 C Bi:1:020:1 -2 0
ffff8a55e7830c00 3837116321 S Bi:1:020:1 -115 16 <
ffff8a55e7830c00 3837136943 C Bi:1:020:1 -2 0
ffff8a55e7830c00 3837137071 S Bi:1:020:1 -115 16 <
ffff8a55e7830c00 3837157768 C Bi:1:020:1 -2 0
ffff8a55e7830c00 3837157944 S Bi:1:020:1 -115 16 <
ffff8a55e7830c00 3837178581 C Bi:1:020:1 -2 0
ffff8a55e7830c00 3837178703 S Bi:1:020:1 -115 16 <
ffff8a55e7830c00 3837199316 C Bi:1:020:1 -2 0
ffff8a55e7830c00 3837199408 S Bi:1:020:1 -115 16 <
ffff8a55e7830c00 3837220075 C Bi:1:020:1 -2 0
ffff8a55e7830c00 3837220203 S Bi:1:020:1 -115 16 <
ffff8a55e7830c00 3837240822 C Bi:1:020:1 -2 0
ffff8a55e7830c00 3837240926 S Bi:1:020:1 -115 16 <
ffff8a55e7830c00 3837261555 C Bi:1:020:1 -2 0
ffff8a55e7830c00 3837261660 S Bi:1:020:1 -115 16 <
ffff8a55e7830c00 3837282270 C Bi:1:020:1 -2 0
ffff8a55e7830c00 3837282395 S Bi:1:020:1 -115 16 <
ffff8a55e7830c00 3837303089 C Bi:1:020:1 -2 0
ffff8a55e7830c00 3837303282 S Bi:1:020:1 -115 16 <
ffff8a55e7830c00 3837323802 C Bi:1:020:1 -2 0
ffff8a55e7830c00 3837323928 S Bi:1:020:1 -115 16 <
ffff8a55e7830c00 3837344573 C Bi:1:020:1 -2 0
ffff8a55e7830c00 3837344713 S Bi:1:020:1 -115 16 <
ffff8a55e7830c00 3837365319 C Bi:1:020:1 -2 0
ffff8a55e7830c00 3837365409 S Bi:1:020:1 -115 16 <
ffff8a55e7830c00 3837385942 C Bi:1:020:1 -2 0
ffff8a55e7830c00 3837386035 S Bi:1:020:1 -115 16 <
ffff8a55e7830c00 3837406812 C Bi:1:020:1 -2 0
ffff8a55e7830c00 3837406918 S Bi:1:020:1 -115 16 <
ffff8a55e7830c00 3837427629 C Bi:1:020:1 -2 0
ffff8a55e7830c00 3837427737 S Bi:1:020:1 -115 16 <
ffff8a55e7830c00 3837448412 C Bi:1:020:1 -2 0
ffff8a55e7830c00 3837448537 S Bi:1:020:1 -115 16 <
ffff8a55e7830c00 3837469601 C Bi:1:020:1 -2 0
ffff8a55e7830c00 3837469734 S Bi:1:020:1 -115 16 <
ffff8a55e7830c00 3837490392 C Bi:1:020:1 -2 0
ffff8a55e7830c00 3837490512 S Bi:1:020:1 -115 16 <
ffff8a55e7830c00 3837511004 C Bi:1:020:1 -2 0
ffff8a55e7830c00 3837511111 S Bi:1:020:1 -115 16 <
ffff8a55e7830c00 3837531623 C Bi:1:020:1 -2 0
ffff8a55e7830c00 3837531722 S Bi:1:020:1 -115 16 <
ffff8a55e7830c00 3837552401 C Bi:1:020:1 -2 0
ffff8a55e7830c00 3837552526 S Bi:1:020:1 -115 16 <
ffff8a55e7830c00 3837573225 C Bi:1:020:1 -2 0
ffff8a55e7830c00 3837573348 S Bi:1:020:1 -115 16 <
ffff8a55e7830c00 3837594032 C Bi:1:020:1 -2 0
ffff8a55e7830c00 3837594163 S Bi:1:020:1 -115 16 <
ffff8a55e7830c00 3837614671 C Bi:1:020:1 -2 0
ffff8a55e7830c00 3837614797 S Bi:1:020:1 -115 16 <
ffff8a55e7830c00 3837635239 C Bi:1:020:1 -2 0
ffff8a55e7830c00 3837635329 S Bi:1:020:1 -115 16 <
ffff8a55e7830c00 3837655911 C Bi:1:020:1 -2 0
ffff8a55e7830c00 3837656076 S Bi:1:020:1 -115 16 <
ffff8a55e7830c00 3837676612 C Bi:1:020:1 -2 0
ffff8a55e7830c00 3837676740 S Bi:1:020:1 -115 16 <
ffff8a55e7830c00 3837697294 C Bi:1:020:1 -2 0
ffff8a55e7830c00 3837697402 S Bi:1:020:1 -115 16 <
ffff8a55e7830c00 3837718117 C Bi:1:020:1 -2 0
ffff8a55e7830c00 3837718239 S Bi:1:020:1 -115 16 <
ffff8a55e7830c00 3837738845 C Bi:1:020:1 -2 0
ffff8a55e7830c00 3837738975 S Bi:1:020:1 -115 16 <
ffff8a55e7830c00 3837759425 C Bi:1:020:1 -2 0
ffff8a55e7830c00 3837759529 S Bi:1:020:1 -115 16 <
ffff8a55e7830c00 3837780084 C Bi:1:020:1 -2 0
ffff8a55e7830c00 3837780248 S Bi:1:020:1 -115 16 <
ffff8a55e7830c00 3837800826 C Bi:1:020:1 -2 0
ffff8a55e7830c00 3837800936 S Bi:1:020:1 -115 16 <
ffff8a55e7830c00 3837821428 C Bi:1:020:1 -2 0
ffff8a55e7830c00 3837821528 S Bi:1:020:1 -115 16 <
ffff8a55e7830c00 3837842121 C Bi:1:020:1 -2 0
ffff8a55e7830c00 3837842273 S Bi:1:020:1 -115 16 <
ffff8a55e7830c00 3837862843 C Bi:1:020:1 -2 0
ffff8a55e7830c00 3837862971 S Bi:1:020:1 -115 16 <
ffff8a55e7830c00 3837883593 C Bi:1:020:1 -2 0
ffff8a55e7830c00 3837883726 S Bi:1:020:1 -115 16 <
ffff8a55e7830c00 3837904413 C Bi:1:020:1 -2 0
ffff8a55e7830c00 3837904550 S Bi:1:020:1 -115 16 <
ffff8a55e7830c00 3837925018 C Bi:1:020:1 -2 0
ffff8a55e7830c00 3837925119 S Bi:1:020:1 -115 16 <
ffff8a55e7830c00 3837945690 C Bi:1:020:1 -2 0
ffff8a55e7830c00 3837945811 S Bi:1:020:1 -115 16 <
ffff8a55e7830c00 3837966485 C Bi:1:020:1 -2 0
ffff8a55e7830c00 3837966683 S Bi:1:020:1 -115 16 <
ffff8a55e7830c00 3837987348 C Bi:1:020:1 -2 0
ffff8a55e7830c00 3837987502 S Bi:1:020:1 -115 16 <
ffff8a55e7830c00 3838008092 C Bi:1:020:1 -2 0
ffff8a55e7830c00 3838008209 S Bi:1:020:1 -115 16 <
ffff8a55e7830c00 3838028796 C Bi:1:020:1 -2 0
ffff8a55e7830c00 3838028920 S Bi:1:020:1 -115 16 <
ffff8a55e7830c00 3838049554 C Bi:1:020:1 -2 0
ffff8a55e7830c00 3838049681 S Bi:1:020:1 -115 16 <
ffff8a55e7830c00 3838070156 C Bi:1:020:1 -2 0
ffff8a55e7830c00 3838070280 S Bi:1:020:1 -115 16 <
ffff8a55e7830c00 3838090757 C Bi:1:020:1 -2 0
ffff8a55e7830c00 3838090866 S Bi:1:020:1 -115 16 <
ffff8a55e7830c00 3838111418 C Bi:1:020:1 -2 0
ffff8a55e7830c00 3838111543 S Bi:1:020:1 -115 16 <
ffff8a55e7830c00 3838132118 C Bi:1:020:1 -2 0
ffff8a55e7830c00 3838132253 S Bi:1:020:1 -115 16 <
ffff8a55e7830c00 3838152827 C Bi:1:020:1 -2 0
ffff8a55e7830c00 3838152949 S Bi:1:020:1 -115 16 <
ffff8a55e7830c00 3838173481 C Bi:1:020:1 -2 0
ffff8a55e7830c00 3838173599 S Bi:1:020:1 -115 16 <
ffff8a55e7830c00 3838194124 C Bi:1:020:1 -2 0
ffff8a55e7830c00 3838194221 S Bi:1:020:1 -115 16 <
ffff8a55e7830c00 3838214722 C Bi:1:020:1 -2 0
ffff8a55e7830c00 3838214824 S Bi:1:020:1 -115 16 <
ffff8a55e7830c00 3838235510 C Bi:1:020:1 -2 0
ffff8a55e7830c00 3838235643 S Bi:1:020:1 -115 16 <
ffff8a55e7830c00 3838256124 C Bi:1:020:1 -2 0
ffff8a55e7830c00 3838256227 S Bi:1:020:1 -115 16 <
ffff8a55e7830c00 3838276843 C Bi:1:020:1 -2 0
ffff8a55e7830c00 3838277020 S Bi:1:020:1 -115 16 <
ffff8a55e7830c00 3838297553 C Bi:1:020:1 -2 0
ffff8a55e7830c00 3838297673 S Bi:1:020:1 -115 16 <
ffff8a55e7830c00 3838318409 C Bi:1:020:1 -2 0
ffff8a55e7830c00 3838318568 S Bi:1:020:1 -115 16 <
ffff8a55e7830c00 3838339172 C Bi:1:020:1 -2 0
ffff8a55e7830c00 3838339306 S Bi:1:020:1 -115 16 <
ffff8a55e7830c00 3838359842 C Bi:1:020:1 -2 0
ffff8a55e7830c00 3838359971 S Bi:1:020:1 -115 16 <
ffff8a55e7830c00 3838380510 C Bi:1:020:1 -2 0
ffff8a55e7830c00 3838380628 S Bi:1:020:1 -115 16 <
ffff8a55e7830c00 3838401131 C Bi:1:020:1 -2 0
ffff8a55e7830c00 3838401232 S Bi:1:020:1 -115 16 <
ffff8a55e7830c00 3838421684 C Bi:1:020:1 -2 0
ffff8a55e7830c00 3838421786 S Bi:1:020:1 -115 16 <
ffff8a55e7830c00 3838442373 C Bi:1:020:1 -2 0
ffff8a55e7830c00 3838442502 S Bi:1:020:1 -115 16 <
ffff8a55e7830c00 3838463029 C Bi:1:020:1 -2 0
ffff8a55e7830c00 3838463146 S Bi:1:020:1 -115 16 <
ffff8a55e7830c00 3838483777 C Bi:1:020:1 -2 0
ffff8a55e7830c00 3838483924 S Bi:1:020:1 -115 16 <
ffff8a55e7830c00 3838504711 C Bi:1:020:1 -2 0
ffff8a55e7830c00 3838504894 S Bi:1:020:1 -115 16 <
ffff8a55e7830c00 3838525412 C Bi:1:020:1 -2 0
ffff8a55e7830c00 3838525527 S Bi:1:020:1 -115 16 <
ffff8a55e7830c00 3838546156 C Bi:1:020:1 -2 0
ffff8a55e7830c00 3838546387 S Bi:1:020:1 -115 16 <
ffff8a55e7830c00 3838567064 C Bi:1:020:1 -2 0
ffff8a55e7830c00 3838567198 S Bi:1:020:1 -115 16 <
ffff8a55e7830c00 3838587714 C Bi:1:020:1 -2 0
ffff8a55e7830c00 3838587843 S Bi:1:020:1 -115 16 <
ffff8a55e7830c00 3838608508 C Bi:1:020:1 -2 0
ffff8a55e7830c00 3838608638 S Bi:1:020:1 -115 16 <
ffff8a55e7830c00 3838629199 C Bi:1:020:1 -2 0
ffff8a55e7830c00 3838629326 S Bi:1:020:1 -115 16 <
ffff8a55e7830c00 3838649837 C Bi:1:020:1 -2 0
ffff8a55e7830c00 3838649943 S Bi:1:020:1 -115 16 <
ffff8a55e7830c00 3838670522 C Bi:1:020:1 -2 0
ffff8a55e7830c00 3838670682 S Bi:1:020:1 -115 16 <
ffff8a55e7830c00 3838691213 C Bi:1:020:1 -2 0
ffff8a55e7830c00 3838691383 S Bi:1:020:1 -115 16 <
ffff8a55e7830c00 3838711860 C Bi:1:020:1 -2 0
ffff8a55e7830c00 3838711963 S Bi:1:020:1 -115 16 <
ffff8a55e7830c00 3838732632 C Bi:1:020:1 -2 0
ffff8a55e7830c00 3838732782 S Bi:1:020:1 -115 16 <
ffff8a55e7830c00 3838753326 C Bi:1:020:1 -2 0
ffff8a55e7830c00 3838753459 S Bi:1:020:1 -115 16 <
ffff8a55e7830c00 3838773909 C Bi:1:020:1 -2 0
ffff8a55e7830c00 3838774015 S Bi:1:020:1 -115 16 <
ffff8a55e7830c00 3838794580 C Bi:1:020:1 -2 0
ffff8a55e7830c00 3838794715 S Bi:1:020:1 -115 16 <
ffff8a55e7830c00 3838815209 C Bi:1:020:1 -2 0
ffff8a55e7830c00 3838815322 S Bi:1:020:1 -115 16 <
ffff8a55e7830c00 3838835908 C Bi:1:020:1 -2 0
ffff8a55e7830c00 3838836139 S Bi:1:020:1 -115 16 <
ffff8a55e7830c00 3838856642 C Bi:1:020:1 -2 0
ffff8a55e7830c00 3838856757 S Bi:1:020:1 -115 16 <
ffff8a55e7830c00 3838877314 C Bi:1:020:1 -2 0
ffff8a55e7830c00 3838877443 S Bi:1:020:1 -115 16 <
ffff8a55e7830c00 3838897968 C Bi:1:020:1 -2 0
ffff8a55e7830c00 3838898147 S Bi:1:020:1 -115 16 <
ffff8a55e7830c00 3838918667 C Bi:1:020:1 -2 0
ffff8a55e7830c00 3838918788 S Bi:1:020:1 -115 16 <
ffff8a55e7830c00 3838939307 C Bi:1:020:1 -2 0
ffff8a55e7830c00 3838939430 S Bi:1:020:1 -115 16 <
ffff8a55e7830c00 3838959974 C Bi:1:020:1 -2 0
ffff8a55e7830c00 3838960123 S Bi:1:020:1 -115 16 <
ffff8a55e7830c00 3838980783 C Bi:1:020:1 -2 0
ffff8a55e7830c00 3838980881 S Bi:1:020:1 -115 16 <
ffff8a55e7830c00 3839001474 C Bi:1:020:1 -2 0
ffff8a55e7830c00 3839001604 S Bi:1:020:1 -115 16 <
ffff8a55e7830c00 3839022179 C Bi:1:020:1 -2 0
ffff8a55e7830c00 3839022355 S Bi:1:020:1 -115 16 <
ffff8a55e7830c00 3839042929 C Bi:1:020:1 -2 0
ffff8a55e7830c00 3839043038 S Bi:1:020:1 -115 16 <
ffff8a55e7830c00 3839063753 C Bi:1:020:1 -2 0
ffff8a55e7830c00 3839063909 S Bi:1:020:1 -115 16 <
ffff8a55e7830c00 3839084599 C Bi:1:020:1 -2 0
ffff8a55e7830c00 3839084756 S Bi:1:020:1 -115 16 <
ffff8a55e7830c00 3839105338 C Bi:1:020:1 -2 0
ffff8a55e7830c00 3839105474 S Bi:1:020:1 -115 16 <
ffff8a55e7830c00 3839126033 C Bi:1:020:1 -2 0
ffff8a55e7830c00 3839126160 S Bi:1:020:1 -115 16 <
ffff8a55e7830c00 3839146882 C Bi:1:020:1 -2 0
ffff8a55e7830c00 3839147042 S Bi:1:020:1 -115 16 <
ffff8a55e7830c00 3839167628 C Bi:1:020:1 -2 0
ffff8a55e7830c00 3839167766 S Bi:1:020:1 -115 16 <
ffff8a55e7830c00 3839188304 C Bi:1:020:1 -2 0
ffff8a55e7830c00 3839188412 S Bi:1:020:1 -115 16 <
ffff8a55e7830c00 3839209035 C Bi:1:020:1 -2 0
ffff8a55e7830c00 3839209150 S Bi:1:020:1 -115 16 <
ffff8a55e7830c00 3839229897 C Bi:1:020:1 -2 0
ffff8a55e7830c00 3839230015 S Bi:1:020:1 -115 16 <
ffff8a55e7830c00 3839250563 C Bi:1:020:1 -2 0
ffff8a55e7830c00 3839250687 S Bi:1:020:1 -115 16 <
ffff8a55e7830c00 3839271282 C Bi:1:020:1 -2 0
ffff8a55e7830c00 3839271460 S Bi:1:020:1 -115 16 <
ffff8a55e7830c00 3839292117 C Bi:1:020:1 -2 0
ffff8a55e7830c00 3839292283 S Bi:1:020:1 -115 16 <
ffff8a55e7830c00 3839313063 C Bi:1:020:1 -2 0
ffff8a55e7830c00 3839313187 S Bi:1:020:1 -115 16 <
ffff8a55e7830c00 3839333894 C Bi:1:020:1 -2 0
ffff8a55e7830c00 3839334039 S Bi:1:020:1 -115 16 <
ffff8a55e7830c00 3839354569 C Bi:1:020:1 -2 0
ffff8a55e7830c00 3839354679 S Bi:1:020:1 -115 16 <
ffff8a55e7830c00 3839375147 C Bi:1:020:1 -2 0
ffff8a55e7830c00 3839375254 S Bi:1:020:1 -115 16 <
ffff8a55e7830c00 3839395890 C Bi:1:020:1 -2 0
ffff8a55e7830c00 3839396102 S Bi:1:020:1 -115 16 <
ffff8a55e7830c00 3839416664 C Bi:1:020:1 -2 0
ffff8a55e7830c00 3839416787 S Bi:1:020:1 -115 16 <
ffff8a55e7830c00 3839437313 C Bi:1:020:1 -2 0
ffff8a55e7830c00 3839437425 S Bi:1:020:1 -115 16 <
ffff8a55e7830c00 3839458178 C Bi:1:020:1 -2 0
ffff8a55e7830c00 3839458308 S Bi:1:020:1 -115 16 <
ffff8a55e7830c00 3839478914 C Bi:1:020:1 -2 0
ffff8a55e7830c00 3839479022 S Bi:1:020:1 -115 16 <
ffff8a55e7830c00 3839499491 C Bi:1:020:1 -2 0
ffff8a55e7830c00 3839499586 S Bi:1:020:1 -115 16 <
ffff8a55e7830c00 3839520188 C Bi:1:020:1 -2 0
ffff8a55e7830c00 3839520333 S Bi:1:020:1 -115 16 <
ffff8a55e7830c00 3839540907 C Bi:1:020:1 -2 0
ffff8a55e7830c00 3839541025 S Bi:1:020:1 -115 16 <
ffff8a55e7830c00 3839561689 C Bi:1:020:1 -2 0
ffff8a55e7830c00 3839561838 S Bi:1:020:1 -115 16 <
ffff8a55e7830c00 3839582477 C Bi:1:020:1 -2 0
ffff8a55e7830c00 3839583826 S Bo:1:020:2 -115 2 = 9002
ffff8a55e7830c00 3839584444 C Bo:1:020:2 0 2 >
ffff8a55e7830c00 3839585151 S Bi:1:020:1 -115 16 <
ffff8a55e7830c00 3839586631 C Bi:1:020:1 0 6 = 90045b20 3131
ffff8a55e7830c00 3839588037 S Bi:1:020:1 -115 16 <
ffff8a55e7830c00 3839589790 C Bi:1:020:1 0 6 = 90043836 2e32
ffff8a55e7830c00 3839591243 S Bi:1:020:1 -115 16 <
ffff8a55e7830c00 3839592997 C Bi:1:020:1 0 6 = 90043731 3733
ffff8a55e7830c00 3839594391 S Bi:1:020:1 -115 16 <
ffff8a55e7830c00 3839596220 C Bi:1:020:1 0 6 = 9004385d 2065
ffff8a55e7830c00 3839597474 S Bi:1:020:1 -115 16 <
ffff8a55e7830c00 3839599484 C Bi:1:020:1 0 6 = 90047564 3a20
ffff8a55e7830c00 3839600790 S Bi:1:020:1 -115 16 <
ffff8a55e7830c00 3839602644 C Bi:1:020:1 0 6 = 90045258 3436
ffff8a55e7830c00 3839604040 S Bi:1:020:1 -115 16 <
ffff8a55e7830c00 3839605796 C Bi:1:020:1 0 6 = 90042046 3120
ffff8a55e7830c00 3839607316 S Bi:1:020:1 -115 16 <
ffff8a55e7830c00 3839609040 C Bi:1:020:1 0 6 = 90047669 613d
ffff8a55e7830c00 3839610342 S Bi:1:020:1 -115 16 <
ffff8a55e7830c00 3839612249 C Bi:1:020:1 0 6 = 90046972 7120
ffff8a55e7830c00 3839614050 S Bi:1:020:1 -115 16 <
ffff8a55e7830c00 3839615428 C Bi:1:020:1 0 6 = 90046972 7173
ffff8a55e7830c00 3839616575 S Bi:1:020:1 -115 16 <
ffff8a55e7830c00 3839618633 C Bi:1:020:1 0 6 = 90043d34 2066
ffff8a55e7830c00 3839619929 S Bi:1:020:1 -115 16 <
ffff8a55e7830c00 3839621808 C Bi:1:020:1 0 6 = 90046175 6c74
ffff8a550489b780 3839623133 S Bi:1:020:1 -115 16 <
ffff8a550489b780 3839624811 C Bi:1:020:1 0 5 = 90033d30 0a
ffff8a550489b780 3839626667 S Bi:1:020:1 -115 16 <
ffff8a550489b780 3839628385 C Bi:1:020:1 0 6 = 90045b20 3131
ffff8a550489b780 3839629754 S Bi:1:020:1 -115 16 <
ffff8a550489b780 3839631589 C Bi:1:020:1 0 6 = 90043836 2e33
ffff8a550489b780 3839633110 S Bi:1:020:1 -115 16 <
ffff8a550489b780 3839634776 C Bi:1:020:1 0 6 = 90043133 3536
ffff8a550489b780 3839636205 S Bi:1:020:1 -115 16 <
ffff8a550489b780 3839638021 C Bi:1:020:1 0 6 = 9004325d 2065
ffff8a550489b780 3839639497 S Bi:1:020:1 -115 16 <
ffff8a550489b780 3839641259 C Bi:1:020:1 0 6 = 90047564 3a20
ffff8a550489b780 3839643044 S Bi:1:020:1 -115 16 <
ffff8a550489b780 3839644403 C Bi:1:020:1 0 6 = 90047265 626f
ffff8a550489b780 3839645646 S Bi:1:020:1 -115 16 <
ffff8a550489b780 3839647579 C Bi:1:020:1 0 6 = 90046f74 3220
ffff8a550489b780 3839649060 S Bi:1:020:1 -115 16 <
ffff8a550489b780 3839650796 C Bi:1:020:1 0 6 = 9004626f 6f74
ffff8a550489b780 3839652272 S Bi:1:020:1 -115 16 <
ffff8a550489b780 3839653997 C Bi:1:020:1 0 6 = 90046c6f 6164
ffff8a550489b780 3839655336 S Bi:1:020:1 -115 16 <
ffff8a550489b780 3839657321 C Bi:1:020:1 0 6 = 90046572 2072
ffff8a550489b780 3839658768 S Bi:1:020:1 -115 16 <
ffff8a550489b780 3839660410 C Bi:1:020:1 0 6 = 90046571 7565
ffff8a550489b780 3839661775 S Bi:1:020:1 -115 16 <
ffff8a550489b780 3839663595 C Bi:1:020:1 0 6 = 90047374 6564
ffff8a550489b780 3839665010 S Bi:1:020:1 -115 16 <
ffff8a550489b780 3839666231 C Bi:1:020:1 0 3 = 90010a
ffff8a550489b780 3839667936 S Bi:1:020:1 -115 16 <
ffff8a550489b780 3839668523 C Bi:1:020:1 -62 0
